topic,category,question,answer,keywords,timestamp
Professor Information and Course Feedback,Academic,اي احد عنده اي معلومة عن ذولي الدكاترة يفيدنا عنهم,سريع في الشرح بس هو اللي يوضع الاختبارات و واجباته كثيره بس ما يهتم إذا حبيتهم صح او لا اهم شي تسلمهم..و ما يسمح تشرب ماء او تتكلم أو تصور في الكلاس. شرحه متوسط ماله شي.,"['دكاترة', 'شرح', 'اختبارات', 'واجبات']",2020-09-15
Course Registration Information,Academic,متى تسجيل المواد؟,بيكون شهر ١٠ تاريخ ١٤ اول يوم تسجيل,"['تسجيل المواد', 'تاريخ التسجيل']",2020-09-15
New Semester Procedures,Academic,ايش الاجرائات الطلاب اللي داخلين سمستر ١ ، مخلصين الفاونديشن السمستر الماضي,هو دائما تروح الاكاديميك اوفيس بس مدري كيف الوضع الان. لو معاك رقم الادفايزر حقك تواصل معاه احسن,"['اجرائات', 'سمستر ١', 'الفاونديشن', 'اكاديميك اوفيس']",2020-09-15
Professor Feedback for Solid Mechanics,Academic,هاذا قائمه الدكاتره في ماده السولد لو عندكم اي معلومات عن هاذولا الدكاتره كلمونا,هذا درسني ، اي كلام شرحه مضروب ما تفهم شيء. هذا درسوا عنده بعض الشباب لا بأس به ، وتعامله محترم جداً كان ال academic advisor حقي,"['دكاترة', 'السولد', 'شرح', 'اختبارات']",2020-09-26
Professor Feedback for Thermodynamics,Academic,هذولاء دكاتره الثيرموديناميكس اذا احد عنده علم بهم ياريت يفيدنا,هذي انتبه تدخل عندها. هذا شرحه ماله شي. هذه شرحها تعبان. توكل معاه من افضل الدكاترة فيروز,"['دكاترة', 'ثيرموديناميكس', 'شرح', 'فيروز']",2020-09-27
Professor Feedback for Fluid Mechanics,Academic,هذولاء دكاتره فلويد ١ اذا احد عنده علم بهم ياريت يفيدنا,ادخل عنده وانت مغمض. هذا يشرح ماليزي,"['دكاترة', 'فلويد ١', 'شرح']",2020-09-29
