[01/03/2025, 1:45:12โฏPM] ~โฏูุงุฑุณ ุงูุณููู: ๐๐ ุจูุณููู ุงูููููู ุงูุฑููุญููููฐูู ุงูุฑููุญูููู ๐๐

ุงูุณูุงู ุนูููู ูุฑุญูุฉ ุงููู ูุจุฑูุงุชู

ุฅูู ูู ุทูุงุจ YSAG ูู ูููุฉ ุงูุญูุณุจุฉุ ููุง ูุถุน ุจูู ุฃูุฏููู ููุชุจุฉ ุงูุนูู ูุงูููุฑ! ๐๐ก
ุงุฌุนููุง ูุฐุง ุงูููุงู ููุจุนูุง ููุฎูุฑุ ููุชููู ูููุนุฑูุฉุ ูุตุฑุญูุง ููุชุนุงูู. ูุง ุชุจุฎููุง ุจูุดุงุฑูุฉ ูุดุงุฑูุนููุ ูุงุฌุจุงุชููุ ุงุฎุชุจุงุฑุงุชููุ ููููุฒ ุฎุจุฑุงุชูู ูุน ุฅุฎูุงููู ูุฃุฎูุงุชููุ ูุงูุนูู ููุฑ ูุถูุก ุฏุฑูุจ ุงูุฌููุน!

โจ ๏ดฟููู ุฐูุง ุงูููุฐูู ููููุฑูุถู ุงูููููู ููุฑูุถูุง ุญูุณูููุง ููููุถูุงุนููููู ูููู ุฃูุถูุนูุงููุง ููุซููุฑูุฉู  ููุงูููููู ููููุจูุถู ููููุจูุณูุทู ููุฅููููููู ุชูุฑูุฌูุนูููู๏ดพ โจ
(ุณูุฑุฉ ุงูุจูุฑุฉ: 245)

๐ ููุงู ุฑุณูู ุงููู ๏ทบ:
"ูู ุณูู ุทุฑูููุง ููุชูุณ ููู ุนูููุงุ ุณูููู ุงููู ูู ุจู ุทุฑูููุง ุฅูู ุงูุฌูุฉ."
(ุฑูุงู ูุณูู)

๐ ูู ุณุจุจูุง ูู ุจูุงุก ุฌูู ุฃููู.. ูุณุงูู ูู ูุดุฑ ุงูุฎูุฑ ูุงูุนูู! ๐

๐ ุฑุงุจุท ุงูููุชุจุฉ:
๐ Google Drive Library: https://drive.google.com/drive/folders/1VCGjBmTWzD5xiWm31FH0yE4I-O-u6sMm?usp=drive_link

ุงูุดุฑูุง ุงูุนูู.. ูุจุงูุนูู ุชุฑุชูู ุงูุฃูู! ๐๐
โ[01/03/2025, 1:47:18โฏPM] ~โฏูููุฏ: โ<attached: 00003148-PHOTO-2025-03-01-13-47-18.jpg>
[01/03/2025, 1:47:18โฏPM] ~โฏ.: ุงูุณูุงู ุนูููู
ุฑูุถุงู ูุฑูู ููู ุนุงู ูุงูุชู ุจุฎูุฑ
ูููู ุงุนุฑู ูู ููู ุงุฌูุจ ุงู study plan ุนุดุงู ุชุฌุฏูุฏ ุงูููุฒุฉุ
[01/03/2025, 1:50:15โฏPM] ~โฏูููุฏ: ุงูุช ุจูุงูุฑููุณุ
[01/03/2025, 1:50:25โฏPM] ~โฏูููุฏ: ุณูุณุชุฑ ููุ
[01/03/2025, 1:50:39โฏPM] ~โฏ.: ูุนู ุณูุณุชุฑ ูฆ
[01/03/2025, 1:56:21โฏPM] ~โฏYusufZain: ู ุนูููู ุงูุณูุงู
ุชูุงุตู ูุน ุฏูุชูุฑุฉ ุฑูุญุงูู ู ูู ุญุชุนุทูู ุงูstudy plan
ููุณ ุงูุทุฑููุฉ ุงูุงูุช ุนููุชูุง ูุน attendance report
[01/03/2025, 4:17:49โฏPM] ~โฏAbdulkader: ูุนูููู ุงูุณูุงู ูุงูุฑุญูุฉุ ูุงูุช ุจุฎูุฑ ูุตุญุฉ ูุนุงููุฉุ

ูุฐู ูุง ุตุงุญุจู ุชูุชุจูุง ุจูุฏูุ
ุงุนูู table ูู word ูุญุท ุงูุฃุนูุฏุฉ ูุงูุขุชู
#  |  Course Code  |  Course Name  |  Credit

ูุงูุชุญ ุงูcourse menu ุญูู ููุฒู ูู ุงูููุฑุณุงุช ุงูู ูุณุฉ ูุง ุฃุฎุฐุชูุง ูู ุงูุฌุฏููุ ูุงุฑุณู ุงูุฌุฏูู ููููุชุจ ุงูุฃูุงุฏููู ููุชูุซูู ูููุญุตูู ุนูู ุจูุงู study plan explanation letter ูุฃู ูุฐุง ููู ุจุฑุถู.


(# = Number) โ<This message was edited>
โ[01/03/2025, 4:19:27โฏPM] ~โฏAbdulkader: โ<attached: 00003155-PHOTO-2025-03-01-16-19-27.jpg>
โ[01/03/2025, 5:38:30โฏPM] ~โฏูููุฏ: โ<attached: 00003156-PHOTO-2025-03-01-17-38-30.jpg>
โ[03/03/2025, 12:17:14โฏPM] ~โฏูููุฏ: ุงูุนุฏุฏ ุงูุซุงูุซ ูู ุงููุฌูุฉ ุงูุดูุฑูุฉ_ุงููุฌูุฉ ุงูุซูุงููุฉ.pdf โข โ16 pages โ<attached: 00003157-ุงูุนุฏุฏ ุงูุซุงูุซ ูู ุงููุฌูุฉ ุงูุดูุฑูุฉ_ุงููุฌูุฉ ุงูุซูุงููุฉ.pdf>
[04/03/2025, 10:59:05โฏAM] ~โฏูุงุฑุณ ุงูุณููู: ุงูุณูุงู ุนูููู ูุฑุญูุฉ ุงููู ูุจุฑูุงุชูุู ุฑูุถุงู ูุจุงุฑู ุนูููุง ูุนููููุ๐ฟ

ุงุฎูุชู ู ุงุฎูุงุชู ุงูุงูุงุถู ููุชุจุฉ YSAG Computing ุชุนูู ุนู ูุชุญ ุจุงุจ ุงูุชุจุฑุน ุจููููุงุช ุงูุฏุฑุงุณูุฉ (Final, tests, prpjects, assignment) ูู ุฎูุงู ุงูุฑุงุจุท ุงูููุญู ููุชู ุงุถุงูุชูุงุ

 ูุงู ุฑุณูู ุงููู -๏ทบ-: "ุฅุฐุง ูุงุช ุงุจู ุขุฏู ุงููุทุน ุนููู ุฅูุง ูู ุซูุงุซ: ุตุฏูุฉ ุฌุงุฑูุฉุ ุฃู ุนูู ููุชูุน ุจูุ ุฃู ููุฏ ุตุงูุญ ูุฏุนู ูู".
[04/03/2025, 9:48:02โฏPM] โช+60ย11โ6395ย6657โฌ: โโช+60ย11โ6395ย6657โฌ joined from the community
[05/03/2025, 9:48:42โฏPM] ~โฏMALEK: โ~โฏMALEK joined from the community
โ[06/03/2025, 12:22:17โฏPM] ~โฏูููุฏ: โ<attached: 00003161-PHOTO-2025-03-06-12-22-17.jpg>
โ[06/03/2025, 10:13:02โฏPM] ~โฏูููุฏ: โ<attached: 00003162-PHOTO-2025-03-06-22-13-02.jpg>
[07/03/2025, 11:16:38โฏAM] ~โฏูููุฏ: โThis message was deleted.
โ[07/03/2025, 11:22:58โฏAM] ~โฏูููุฏ: โ<attached: 00003164-PHOTO-2025-03-07-11-22-58.jpg>
[07/03/2025, 3:03:46โฏPM] ~โฏOTP: ุงูุณูุงู ุนูููู ูุฑุญูุฉ ุงููู ูุจุฑูุงุชู 
ูุชู ุจููุชุญ ุงูุชุณุฌูู ููุณูุณุชุฑุุ
[07/03/2025, 4:02:28โฏPM] ~โฏOTP: ุทูุจ ูู ูู ุญุงุฌู ูุงุฒู ูุณูููุง ูุจู ูุฐุง ูุนูู ุงู ุชุณุฌูู ููุง ุดูุ
ููุง ุจ ุงูุชูุงุฑูุฎ ูุฐูู ุจุณ ูุณุฌู ูุฎูุงุต
[07/03/2025, 4:33:35โฏPM] ~โฏAhmed Abdulhafith Alkabyle: ุนู ุญุฏ ุนููู ูุงูู ุงู ุชุณุฌูู ุชุงููุ ุงู ุงู ุดู ูุจู.
[07/03/2025, 4:34:41โฏPM] ~โฏOTP: ุชูุงู ูุดููุฑ ู ุบุงูู
[07/03/2025, 4:38:56โฏPM] ~โฏAhmed Abdulhafith Alkabyle: ุงูุนูู.
[07/03/2025, 4:00:55โฏPM] ~โฏAhmed Abdulhafith Alkabyle: ููู 14 ูู15
[07/03/2025, 10:22:12โฏPM] ~โฏAmr Qatab: ูู ุงูุณูุณุชุฑ ูู 
ุนุงุฏู ุชุณุฌูููู ููุณ ุงููุณูุชุฑุงุช ุงูุซุงููู 
ุจููุณ ุงูููู ุงูุตุฏ
[07/03/2025, 10:22:22โฏPM] ~โฏAmr Qatab: ูุงูุถุง ุงูู ูุชู ูุณุชูุฑ ุงูุชุณุฌูู
[07/03/2025, 11:11:43โฏPM] ~โฏAhmed Abdulhafith Alkabyle: ุจุงููุณุจุฉ ูู ุณูุณุชุฑ ุงูุงูู ุญุงูู ุชุชุฃูุฏ ูู office 
ุจุณ ุชูุฑูุจุง ููุณ ุงูููููู
[07/03/2025, 11:12:31โฏPM] ~โฏAmr Qatab: ุทูุจ ููู ูู ุงุฐุง ุณูุญุช
[07/03/2025, 11:13:38โฏPM] ~โฏAhmed Abdulhafith Alkabyle: ุจูููู ูุณุชูุฑ  ูุญุฏ ุซูุงุซ ุงุณุงุจูุน

ุงูููู ุงูููููู ุณุฌู ูููู ุงูู ูุชุงุญ ูู ููุงุฏ 
ุจุนุฏูุง ุงูู ุงุณุจูุนูู ูู ุงูุณูุณุชุฑ
ุจูููู ููุชูุญ amendment 
ุชูุฏุฑ ุชุบูุฑ ุณูุดู ุชุญุฐู ุชุถูู ูุงุฏุฉ ูููุฐุง
[07/03/2025, 11:14:41โฏPM] ~โฏAhmed Abdulhafith Alkabyle: ูู ูุฑูุจ ุงู telegram ูู office

ุชูุฏุฑ ุชุณุฃู ููู

https://t.me/ugfcutm
[07/03/2025, 11:16:34โฏPM] ~โฏAhmed Abdulhafith Alkabyle: ููู ูุฑูุจ ูุฐุง ุฎุงุต ุจุงูุฌุฏูู time table ูุชุณุฌูู ุงูููุงุฏ ุญุชู 

https://t.me/+mg67hwfZjV1lZmQ1
[07/03/2025, 11:33:54โฏPM] ~โฏAmr Qatab: ุจุณ ุงุนุชูุฏ ุงูู ุณูุณุชุฑ ุงุฌุจุงุฑู ุงูููุงุฏ
[07/03/2025, 11:34:02โฏPM] ~โฏAmr Qatab: ุชูุงู ูุนุทูู ุงูุนุงููุฉ ูุงูุตุฑุช
[08/03/2025, 2:17:27โฏPM] ~โฏูุงุฑุณ ุงูุณููู: โ~โฏูุงุฑุณ ุงูุณููู pinned a message
[09/03/2025, 3:49:08โฏPM] ~โฏRami Mohamed: โ~โฏูุงุฑุณ ุงูุณููู added ~โฏRami Mohamed
โ[09/03/2025, 6:30:28โฏPM] ~โฏูููุฏ: โ<attached: 00003182-PHOTO-2025-03-09-18-30-28.jpg>
[10/03/2025, 2:11:20โฏAM] ~โฏูุงุฑุณ ุงูุณููู: ุงูุณูุงู ุนูููู ูุง ุงุฎูุงู ุงู ุงุญุฏ ูุณุง ูุฎูุต semester 4 ุงู semester 5 ูููู ุชุฌููู ุจูุฎุงุต ุถุฑูุฑู
[10/03/2025, 5:37:52โฏAM] ~โฏGARRAH: ุงูุณูุงู ุนูููู ูุฑุญูุฉ ุงููู ูุจุฑูุงุชู 
ูุง ุฅุฎูุงู ุฅุฐุง ุงุญุฏ ุนูุฏู ูููุงุช ูููุงุช ูุณูุณุชุฑ 1, 2 ูุฑุณููุง 
ูุฌุฒุงูู ุงููู ุฎูุฑ
[10/03/2025, 6:51:30โฏAM] ~โฏOTP: https://drive.google.com/drive/folders/1pMQdrC_Q8dk3ouk5u6Lh8sBdaU-WpxTw?usp=sharing
[10/03/2025, 6:51:49โฏAM] ~โฏOTP: ูุนูููู ุงูุณูุงู ูุฑุญูุฉ ุงููู ูุจุฑูุงุชู
[10/03/2025, 11:23:08โฏAM] ~โฏุฒููุจ: ุฃุนุชูุฏ ุฃุณูุงุก ุงูููุงุฏ ุชุบูุฑุช ููุงุ
[10/03/2025, 11:25:06โฏAM] ~โฏOTP: ูุงููุด ุนูู ูุงููู 
ูุฐุง ูู ุดุฎุต ุงุฑุณูู ููุฌุฑูุจ ูู ูุจู ูุงูุง ุงุฑุณูุชู ุงูุงู ููู ุทูุจู
[10/03/2025, 11:25:31โฏAM] ~โฏAmr Qatab: ููุณ ุงููุงูุฏ ุจูู
[10/03/2025, 11:25:53โฏAM] ~โฏAmr Qatab: ูููุชูุฑู ุทุจุนุง ูุฏุฑู ุงูุณูุช ููุฑ
[10/03/2025, 12:03:10โฏPM] ~โฏุฒููุจ: ุทูุจ ูู ููู ูููู ุฃุญุตู ุงููุงูุฏุจูู ูุฐุงุ
[10/03/2025, 12:03:45โฏPM] ~โฏุฒููุจ: ุงูุญุฏูุซ ูุนูู ุญููุง SCSEH
[10/03/2025, 3:35:19โฏPM] ~โฏูููุฏ: @601169721623
โ[11/03/2025, 8:34:50โฏAM] ~โฏRami: โ<attached: 00003194-PHOTO-2025-03-11-08-34-50.jpg>
[11/03/2025, 8:35:11โฏAM] ~โฏRami: โThis message was deleted.
[11/03/2025, 8:58:13โฏAM] ~โฏAbdul: ูุงููู ูุง ุจุนุฑููุง ุจุณ ุดูููุง ุญุฒููู๐๐
[11/03/2025, 9:05:33โฏAM] ~โฏRami: ุงูุณูุงู ุนูููู ุ ูู ุงุญุฏ ูุนุฑู ุงูุฏูุชูุฑู ุฏู ุณูุฆู ููุง ูููุณู ุ
[11/03/2025, 4:11:34โฏPM] ~โฏNoor: โ~โฏNoor joined from the community
[11/03/2025, 4:48:09โฏPM] ~โฏูููุฏ: โ~โฏูููุฏ turned off admin approval to join this group
[11/03/2025, 4:44:30โฏPM] ~โฏูููุฏ: *ุจุณู ุงููู ุงูุฑุญูู ุงูุฑุญูู* 

 *ุงูุณูุงู ุนูููู ูุฑุญูุฉ ุงููู ูุจุฑูุงุชู* ุ 

ูุณุฑูุง ุฏุนูุชูู ููุงูุถูุงู ุฅูู 

 *YSAG GROUPS* 

ููู ููุตุฉ ูููุฒุฉ ุชุฌูุน ุงูุทูุงุจ ูุงูููุชููู ูู ูุฎุชูู ุงูุชุฎุตุตุงุช ุงูุฃูุงุฏูููุฉ ูุงูููููุฉ.  

ูุถู ูุฐุง *ุงููุฌุชูุน* ูุฌููุนุงุช ูุชุฎุตุตุฉ ุชุชูุญ ููู ูุฑุตุฉ ุงูุชูุงุตู ูุงูุงุณุชูุงุฏุฉ ูู ุชุฌุงุฑุจ ุงูุขุฎุฑูู ูู ุงููุฌุงูุงุช ุงูุชุงููุฉ:  


- ุงูุจุฑุฏุฌูู

- ุงูููุฏุณุฉ ุงูุทุจูุฉ

- ุงูููุฏุณุฉ ุงูููุฑุจุงุฆูุฉ

- *ุงูููุฏุณุฉ ุงูููููุงุฆูุฉ* 

- ุงูููุฏุณุฉ ุงููููุงููููุฉ 
 
- ููุฏุณุฉ ุงูุญุงุณุจ

- ููุฏุณุฉ ุงูุจุชุฑูู  

- ุฅุฏุงุฑุฉ ุงูุฃุนูุงู (Business Management)  

- ุจุงูุฅุถุงูุฉ ุฅูู ูุฌููุนุฉ ูุฎุตุตุฉ ูุทูุงุจ ุงููุงุฌุณุชูุฑ ูุงูุฏูุชูุฑุงู (PhD & Master Students).  


ูุฏููุง ูู ุจูุงุก ูุฌุชูุน ุฃูุงุฏููู ููููู ูุชูุงูู ูุนุฒุฒ ูู ูุฑุต ุงูุชุนูู ูุงูุชุนุงูู.  


๐ก ุฅุฐุง ููุช ููุชูุงู/ููุชูุฉ ุจุงูุงูุถูุงู ุฅูู ูุฐุง ุงููุฌุชูุน ุงููููุฒุ *ูุฑุฌู ุงูุถุบุท ุนูู ุงูุฑุงุจุท* :

https://chat.whatsapp.com/Hj0GOae55iu4q2ejEilFy2


ูุณุนุฏ ุจุงูุถูุงููู ููููู ูุนูุง ุฌุฒุกูุง ูู ูุฐุง ุงููุฌุงุญ ุงููุดุชุฑู.  

 *YSAG* 
 *ISS-YEMEN*
[11/03/2025, 5:37:39โฏPM] ~โฏAhmat: โ~โฏูุงุฑุณ ุงูุณููู added ~โฏAhmat
[11/03/2025, 5:37:49โฏPM] ~โฏูุงุฑุณ ุงูุณููู: โ~โฏูุงุฑุณ ุงูุณููู turned on admin approval to join this group
[11/03/2025, 5:40:07โฏPM] ~โฏูุงุฑุณ ุงูุณููู: โ~โฏูุงุฑุณ ุงูุณููู turned off admin approval to join this group
[12/03/2025, 6:36:20โฏAM] ~โฏAhmed: โ~โฏAhmed joined from the community
[12/03/2025, 11:55:14โฏAM] โช+965ย9897ย2954โฌ: โโช+965ย9897ย2954โฌ joined from the community
[12/03/2025, 12:57:09โฏPM] ~โฏูุงุฑุณ ุงูุณููู: Timetable 20242025

https://docs.google.com/spreadsheets/d/1PJcxNQU4TKjkFPpCKpI99cAf0Al1fP7CwQwsShHOrXk/edit?usp=drivesdk
[12/03/2025, 1:22:00โฏPM] ~โฏฮKI: ุงูุณูุงู ุนูููู ูุฑุญูุฉ ุงููู ูุจุฑูุงุชู 
ููุงุฏ ุงู university elective ููู ุงุญุตููุงุ
[12/03/2025, 1:30:32โฏPM] ~โฏูุงุฑุณ ุงูุณููู: ูุนูููู ุงูุณูุงู ูุฑุญูุฉ ุงููู ูุจุฑูุงุชู
ุชุญุตููุง ุบุงูุจุง ูู timetable ููุณู
[12/03/2025, 1:35:03โฏPM] ~โฏุงููุงุซู ุจุงููููฐู: ุจุชุญุตููุง ุชุญุช ุณูุฉ ุซุงูุซุฉ
[12/03/2025, 1:35:42โฏPM] ~โฏุงููุงุซู ุจุงููููฐู: ุจุณ ุบุงูุจุง ุชุฑู ุซุงูู ูุงูู free elective ูุงูููุงุฏ ุซูููุฉ
[12/03/2025, 1:38:08โฏPM] ~โฏ.: โ~โฏ. joined from the community
[12/03/2025, 6:13:48โฏPM] ~โฏjad hijazi: ุงูุณูุงู ุนูููู 
ุงูุง ุณูุฉ ุงููู ููุญุชุงุฌ ูุณุงุนุฏุชูู ุจุงููุณุจุฉ ููููุงุฏ ูุงูุง  ุฏูุงุชุฑุฉ  ูููู ุงูุฒู ุนูุฏูู
[12/03/2025, 6:19:53โฏPM] Majoody: ูุนูููู ุงูุณูุงู 
ุจุฏุงูุฉ ุชุฌูุจ ุงููุงูุฏ ุจูู ุญู ุชุฎุตุตู ูุงูุงูุชูู ุญูู ุ ุจุนุฏูู ุชุดูู ูุด ุนูุฏู ููุงุฏ ููุณูุณุชุฑ ุงูุฌุงู ุ ุจุนุฏูุง ุชุดูู ุจุงูุฌุฏูู (ููู ููุงุนูุฏ ูุงุณูุงุก ุงูุฏูุงุชุฑุฉ ) (ุฑุงุจุท ุงูุฌุฏูู ุนุงุฏุฉ ููุฑุณู ููุง ุ ุงู ุชููุงู ุจุงููููู ุงูุฌุงูุนู )
[12/03/2025, 6:20:19โฏPM] Majoody: ุจุนุฏูู ุชุดูู ุงูุด ุงุณูุงุก ุงูุฏูุงุชุฑุฉ ููุฐู ุงููุงุฏุฉ ูุชุดุงุฑููู ููุง ูุงูุฅุฎูุงู ูุณุงุนุฏููู
[12/03/2025, 6:22:15โฏPM] ~โฏjad hijazi: ุจุงูุฑ ุงูุดุงููู ูู ุงูุงุฌุชูุงุน ุจุฎูุฑููุง ุงูููุฑูุถ ุดู ุงูููุงุฏ ุุ
[12/03/2025, 6:40:02โฏPM] ~โฏNaif: ุทูุจ ูุฎูุงู ูู ูุฑูุจ ู KL ุ ุนุดุงู ุฏูุงุชุฑู
[12/03/2025, 6:42:54โฏPM] Majoody: ุตุฑุงุญุฉ ูุง ุงุนุฑู ูุญุชูู ุงูุงุฌุชูุงุน ูุฐุง
[12/03/2025, 6:43:18โฏPM] Majoody: ุงุนุทูู ุงู supervisor ุญูู ููุง ูุณุง ุ
[12/03/2025, 6:43:40โฏPM] Majoody: ุดุจุงุจ ุงูู ุณูุณุชุฑ ูุง ุชุชุณุฌู ุงูููุงุฏ ุชููุงุฆู ุ ุงุชุฐูุฑ ูุฐุง ูุงูุช
[12/03/2025, 6:44:52โฏPM] ~โฏSalman Alameer: ุชุบูุฑ ุงููุธุงู
[12/03/2025, 8:02:34โฏPM] ~โฏjad hijazi: ูุง ูุง ุนุทููู
[12/03/2025, 8:50:08โฏPM] ~โฏMahmoud Elganzory: ูู myutm ุฑูุญ ููprofile ุชุญุช ุงุณูู ุจูููู ููุชูุจ AA
โ[12/03/2025, 9:08:07โฏPM] ~โฏูููุฏ: โ<attached: 00003223-PHOTO-2025-03-12-21-08-07.jpg>
[13/03/2025, 12:20:46โฏAM] โช+252ย63ย7029736โฌ: โโช+252ย63ย7029736โฌ joined from the community
[13/03/2025, 12:06:42โฏPM] ~โฏุฒููุจ: ุงูุณูุงู ุนูููู ูุฑุญูุฉ ุงููู. ูู ุฃุญุณู ุจูู Dr. Rozilawati binti Dollah @ Md. Zain ู Dr. Mohamad Shukor bin Talib ูู ูุงุฏุฉ Probability & Statistical Data Analysis โ<This message was edited>
[13/03/2025, 12:10:23โฏPM] ~โฏุฒููุจ: ููู ุฃุญุณู ุจูู Ts. Ms. Hazinah binti Kutty Mammi ู Dr Adnan Khalid ู Dr Danlami ูู ูุงุฏุฉ Network Communications
[13/03/2025, 12:38:21โฏPM] ~โฏAli Alrekaby: ูุนูููู ุงูุณูุงู
[13/03/2025, 12:38:50โฏPM] ~โฏAli Alrekaby: Dr Adnan ู Danlami  ุฐููุง ุฌุฏุฏ ุงุชููุน โ<This message was edited>
[13/03/2025, 1:21:49โฏPM] ~โฏุณูู ุงูุฏูู: โ~โฏุณูู ุงูุฏูู joined from the community
[13/03/2025, 1:32:49โฏPM] ~โฏAmr Qatab: ุงูุณูุงู ุนูููู 
ูุงุดุจุงุจ ุตุญ ุงู ููุงุฏ ุงูููุชูุฑู ู ุงูุณูุช ููุฑ ูุชุดุงุจู 
ุจุณ ูู ูู ููุณ ุงูุณูุงุดู 

ูุนูู ูู ุณูุดูุงุช ูููุง ุทูุงุจ ููุชูุฑู ูุณูุช ููุฑ
[13/03/2025, 1:37:17โฏPM] ~โฏAhmed Marwan: ูุนูููู ุงูุณูุงู 
ุงูู ุชูุฑูุจุงู ูุชุดุงุจูู ูู ุงูู ุณูุชูู

ุจุงููุณุจู ููุณูุงุดู ุญุณุจ ุงูุฏูุชูุฑ ุจูุดูู ุงูู ุทุงูุจ ูุชูุฑู ุฏุงุฎู ุณูุดู ุณููุชููุฑ ุญููููู ุบูุฑ ุณูุดู ูุงู ุทูุงุจ ุงูุณูุดู ูุซูุฑ ุงู ุงูุนูุณ ุงู ูุฐุง ุจุณ ุชุทูุน ูุฒุงุฌ
[13/03/2025, 1:43:00โฏPM] ~โฏAmr Qatab: ุงูุง 
ุงุฐุง ุชูุงู ูุนุทูู ุงูุนุงููุฉ
[13/03/2025, 4:03:00โฏPM] ~โฏGARRAH: ูู ุงูุณูุณุชุฑ ุงููุงุถู ูุตูููู ููู ุชุฎุตุต ูู ุณูุงุดูู ูู ููุงุฏ ุงูุชุฎุตุต
[13/03/2025, 4:21:17โฏPM] ~โฏูุญูุฏ: โ~โฏูุญูุฏ joined from the community
โ[13/03/2025, 4:26:22โฏPM] ~โฏูููุฏ: โ<attached: 00003235-PHOTO-2025-03-13-16-26-22.jpg>
[13/03/2025, 6:12:11โฏPM] โช+60ย11โ3307ย3792โฌ: โโช+60ย11โ3307ย3792โฌ joined from the community
[13/03/2025, 8:55:47โฏPM] ~โฏAmr Qatab: ุงูุณูุงู ุนูููู ูุฑุญูุฉ ุงููู 
ูุงุดุจุงุจ ูู ููุชูุฑู ุงูุด ุงูุงุณุชุฏู ุจูุงู ูููู ุชุฑุณูููุง
[13/03/2025, 9:02:15โฏPM] Hamdan Saleh: ุงุนุชูุฏ ููู ุงูุงุฏูุงูุฒุฑ ุชุจุนู ุจูุฑุณูู
[13/03/2025, 9:16:22โฏPM] ~โฏAmr Qatab: ุชูุงู ุชุณูู ูุนุทูู ุงูุนุงููู
โ[13/03/2025, 9:56:03โฏPM] ~โฏูููุฏ: โ<attached: 00003240-PHOTO-2025-03-13-21-56-03.jpg>
โ[13/03/2025, 10:04:29โฏPM] ~โฏFarah~โข: โ<attached: 00003241-PHOTO-2025-03-13-22-04-29.jpg>
[13/03/2025, 10:33:32โฏPM] ~โฏAhmed Mahgoub: ุงููุง ูุฒุจูุท ุงููุงุฏู ุงุตูุง ููุดุฑ ูุงุญุฏ ุชูุงุช ุณุงุนุงุช ุงุณุจูุนูุง
โ[14/03/2025, 12:23:32โฏAM] ~โฏOTP: โ<attached: 00003243-PHOTO-2025-03-14-00-23-32.jpg>
[14/03/2025, 12:27:37โฏAM] ~โฏใ โโข โกฬฌฬฉฬะดฮฒฦกวชฦกฤยฒยบยนยณ: ุงุฑุจุนุงุก ูุฎููุณ
[14/03/2025, 12:28:19โฏAM] ~โฏใ โโข โกฬฌฬฉฬะดฮฒฦกวชฦกฤยฒยบยนยณ: ุณูุดู ุงุฑุจุนุงุก ูุฎููุณ ูุงูุณูุดู ุงูู ุชุญุช ุงุฑุจุนุงุก ูุฌูุนู
[14/03/2025, 12:28:32โฏAM] ~โฏใ โโข โกฬฌฬฉฬะดฮฒฦกวชฦกฤยฒยบยนยณ: ุงูุชู ุงุฎุชุงุฑ ูุงุญุฏ ูู ุงูุณูุงุดู ุจุญูุซ ูุง ูุณุจุจ ููุงุด ูู ุงูุฌุฏูู โ<This message was edited>
[14/03/2025, 12:30:19โฏAM] ~โฏOTP: ุจุงูุถุจุท ูููุฐุง ุณุงูุช ูุงูู ุงุฑุชุจุดุช ุดููู 
ูุงูู ุชูููุช ุงูุฏูุชูุฑู ูุฐู ูุตุงุฏู ูุน ูุงุฏู ุซุงููู ู ูุงุจูุฏุฑ ุงุฎุชุงุฑูู ุณูุง
[14/03/2025, 12:30:39โฏAM] ~โฏOTP: ูุดููุฑ ู ุญุจูุจ
[14/03/2025, 12:30:53โฏAM] ~โฏใ โโข โกฬฌฬฉฬะดฮฒฦกวชฦกฤยฒยบยนยณ: ุงูุนูู
[14/03/2025, 3:06:04โฏAM] ~โฏ966554008374: ุงูุณูุงู ุนููููุ  ูุง ุฌูุงุนุฉ ุงูุงู ูู ุทุฑููุฉ ูุงูุง ุงุฎุชุงุฑ ุงูุณูุดู ุงููุง ุงุนุฑู ูู ุณูุดู ูู ุฏูุงุชุฑุชู
[14/03/2025, 3:17:28โฏAM] ~โฏAhmed Abdulhafith Alkabyle: ูู ุงู time table
[14/03/2025, 3:17:39โฏAM] ~โฏAhmed Abdulhafith Alkabyle: .
[14/03/2025, 3:18:20โฏAM] ~โฏAhmed Abdulhafith Alkabyle: ุจุณ ุจุนุถ ููุงุฏ ุงู elective ุงู 2 credit
ูุงูููู ุธุงูุฑุฉ ุจุณ ููุชูุจ ุณูุดู local
ุงู international
[14/03/2025, 3:40:22โฏAM] ~โฏ๐: ุงูุณูุงู ุนูููู ูุง ุฌูุงุนู ุงูุญูู ูุงุฒู ุงุณูู Academic Verfication ุนุดุงู ุงุณุฌู ุงูููุงุฏ ูุงูุฏูุงุชุฑู ุ
โ[14/03/2025, 3:53:22โฏAM] ~โฏ966554008374: โ<attached: 00003255-PHOTO-2025-03-14-03-53-22.jpg>
[14/03/2025, 4:06:28โฏAM] ~โฏYusufZain: ุฌุฑุจุช ุชุนูู copy paste?
[14/03/2025, 4:06:57โฏAM] ~โฏYusufZain: ุชุณูู select ูููุฑุจุน ูุงูู ุจุนุฏูุง ุชูุณุฎ ูู ุงูุฌุฏูู ุงููุงุถู
[14/03/2025, 4:07:11โฏAM] ~โฏOTP: ุงูููู ูุงุฑุถู
[14/03/2025, 4:07:41โฏAM] ~โฏYusufZain: ุฅุฐุง ูุง ุฑุถู ุงูุณุฎ ุงูููุงู ุงูููุชูุจ
[14/03/2025, 4:08:07โฏAM] ~โฏRami Mohamed: ุญูู ุงูููู ู excel . ุจุนุฏูู ุชูุฏุฑ ุชุนุฏู ุนููู
[14/03/2025, 4:12:17โฏAM] Majoody: โThis message was deleted.
โ[14/03/2025, 5:05:11โฏAM] Ahmed Ghaleb: โ<attached: 00003262-PHOTO-2025-03-14-05-05-11.jpg>
[14/03/2025, 5:05:25โฏAM] ~โฏูุงุฑุณ ุงูุณููู: ููุณ ุงูุดู
[14/03/2025, 5:05:36โฏAM] ~โฏูุงุฑุณ ุงูุณููู: ุชูุงุตู ูุนุงูู ุจูุฆูููู
[14/03/2025, 5:08:15โฏAM] ~โฏFarah~โข: ุงูุณูุงู ุนูููู 
ุฏูููุชู ุงูููุฑูุถ ุงู ูุชุฑุฉ ุงูุงูููุฏูููุช ูุชููู ุจุฏุงูุฉ ูู ูกูง. ูู ุฏู ูุนูุงู ุงู ุงูุงุณุจูุน ุงูุฌุงู ูููุด ูุญุงุถุฑุงุช ุ
[14/03/2025, 5:41:34โฏAM] ~โฏMohamad Noureddine: ูุง ููู ูุญุงุถุฑุงุช
โ[14/03/2025, 5:41:39โฏAM] ~โฏุฒููุจ: Screenshot 2025-03-14 104019.png โ<attached: 00003267-Screenshot 2025-03-14 104019.png>
[14/03/2025, 5:42:56โฏAM] ~โฏMohamad Noureddine: ูู ููุฑู ุชุนุจูู ูุชุฑุณูู ูู academic officeุ ุชูุงุตูู ูุนูู ุงู ุงุฑุณูู ูู supervisor
[14/03/2025, 5:46:35โฏAM] ~โฏุฒููุจ: ุทูุจ ุงูsupervisor ูู ููุณู ุงูacademic advisor ุตุญุ ุฅุฐุง ููุณู ูููุชูุง ูู ููู ูุงุฑุฏุช ุฅูุด ุฃุณููุ ูู ุถุฑูุฑู ุฃุนุจูู ูุจู ูุง ุฃุณุฌู ุงูููุงุฏ ููุง ูููู ุฃุนุจูู ุจุนุฏููุ
[14/03/2025, 5:56:58โฏAM] ~โฏุฒููุจ: ุทูุจ ูููููู ุงู add button ูุง ุฑุถู ูุถูููู application ุฌุฏูุฏุฉ
[14/03/2025, 5:57:26โฏAM] ~โฏAhmed Abdulhafith Alkabyle: ููู 17 ุจููุชุญ 
ูุด ุงูููู
[14/03/2025, 5:57:40โฏAM] ~โฏุฒููุจ: ุฃูุง ุทูุจ ุชุณูู
[14/03/2025, 5:59:13โฏAM] ~โฏุฒููุจ: ูุฅุฐุง ุญุจูุช ุฃุฑุณููุง ุฅูููู ุฅูุด ูุงุฒู ุฃุทูุจ ูููุง ุจุงูุถุจุท ูุนููุ ูุง ุงุณุชูุนุจุช ุงูุจุฑูุณุณ
[14/03/2025, 6:04:32โฏAM] ~โฏAhmed Abdulhafith Alkabyle: ุชุทูุจู exemption ูู english ูุน ุดูุงุฏุฉ ูุงููุนูููุงุช ูุงููู

ูุฑุญ ุชุฑุฏ ุนููู  ุจุฎุทูุงุช ุงูุชูุฏูู.
[14/03/2025, 6:05:44โฏAM] ~โฏุฒููุจ: ูุนูุด ูู ุณุฃูุช ุฅูุด ุงููุนูููุงุช ุจุงูุถุจุท ุงููู ูุงุฒู ุฃุฑุณููุง ูุน ุงูุดูุงุฏุฉุ
[14/03/2025, 6:13:01โฏAM] ~โฏAhmed Abdulhafith Alkabyle: ุทูุจุช ุงู exemption 
ูุงู ูุงุฏุฉ ูุน code ุงููุงุฏุฉ

ุดูุงุฏุฉ ุงูุงููุชุณ ุงู ุบูุฑูุง.
ุงูุงุณู
ุงู matric no ุงู isid no
[14/03/2025, 6:14:59โฏAM] ~โฏAhmed Abdulhafith Alkabyle: ูู ุงูุบุงูุจ ุฑุญ ุจุชูููู ุงูู ุงูุชูุฏูู ุงูููุงูู ูู student portal
[14/03/2025, 6:15:12โฏAM] ~โฏAhmed Abdulhafith Alkabyle: ููุท ุชุจุนู ููุณ ุงูุฎุทูุงุช ูุฐู ุจุนุฏ ููุชุญ ุงู system ููู 17
[14/03/2025, 6:15:35โฏAM] ~โฏAhmed Abdulhafith Alkabyle: ููู ุงูุงุฎูุฑ ุชุฎุชุงุฑ ุฎุงูู  ุงู transcript ูุชุญูู ุจููุง ุดูุงุฏุฉ ุงููุบู
[14/03/2025, 6:16:26โฏAM] ~โฏุฒููุจ: ุทูุจ ุงููู ูุนุทูู ุงูุนุงููุฉ ูุง ูุตุฑุช ๐
[14/03/2025, 9:51:21โฏAM] ~โฏAmr Qatab: ุงูุณูุงู ุนูููู 
ูุงุดุจุงุจ ูู ููุชูุฑู ูุญุถุฑ ุงูุณ ูููู ูุชูุงุตู ูุนู
โ[14/03/2025, 9:53:02โฏAM] ~โฏAmr Qatab: โ<attached: 00003282-PHOTO-2025-03-14-09-53-02.jpg>
[14/03/2025, 12:01:14โฏPM] ~โฏAmr Qatab: ุทูุจ ุงูุงู ูุณุฌู ุงูููุงุฏ ููุณ ุงููููู 
ุงู ูู ุจูุณุฌููุง ููุง ููู ุงูุงุซููู ููุณูู ูู ุดู
[14/03/2025, 12:03:46โฏPM] ~โฏAhmed Abdulhafith Alkabyle: ุงููุง ุณุฌู ููุณูุง ุ
ุญุงูู ุชูุงุฑู ููุช ูู section ุจุญูุซ ูุงูุฌู ููุงุณุงุช ูู ููุณ ุงูููุช
โ[14/03/2025, 12:05:55โฏPM] ~โฏAmr Qatab: โ<attached: 00003285-PHOTO-2025-03-14-12-05-55.jpg>
[14/03/2025, 12:06:15โฏPM] ~โฏAmr Qatab: 15
[14/03/2025, 12:06:44โฏPM] ~โฏAmr Qatab: ูุฑูุฏุช
[14/03/2025, 12:07:28โฏPM] ~โฏAmr Qatab: ุจุณ ูุงุบุงูู ุฑุญุช ุงูููู ูููููู ูุงูู ุจูุณุฌูู ูู ูู ุดู ููู ุงูุงุซููู
[14/03/2025, 12:08:15โฏPM] ~โฏAhmed Abdulhafith Alkabyle: ูู ุงุบูุงุท ูุฐู

ุงู Graduate success 
ูู value and identity
ููุงุฏ ุงูุญุฐูู ูุงุชุณุญููู
[14/03/2025, 12:10:10โฏPM] ~โฏAhmed Abdulhafith Alkabyle: ุงุฐุง ููุง ูุงูููู ููู ุงุญุณู
[14/03/2025, 12:10:13โฏPM] ~โฏAhmed Abdulhafith Alkabyle: ุงุฐุง ุงูุช ูุงุชุญ ุนูุฏู ุงูุชุณุฌูู ุจุงููููุน
ุงุฐุง ุญุงุจุจ ุงุชุฌุฑุจ ุชุณุฌู ููุญุฏู ุณุฌู ูุงุฎุชุงุฑ ูุน ุงูุฏูุงุชุฑู ุงูู ุณูุนุชูู ุงูููุณู 

ูุฑุงุฌุน ูุนูู ุงูุชุณุฌูู ููู ุงูุงุซููู
[14/03/2025, 12:10:38โฏPM] ~โฏAmr Qatab: ุงููููุน ูุนูู ููุงูู ูุงุจููุชุญ
[14/03/2025, 12:10:47โฏPM] ~โฏAmr Qatab: ุงูููู ููุง ุฎูุฑ ุงู ุดุงุก ุงููู
[14/03/2025, 12:10:54โฏPM] ~โฏAmr Qatab: ููุนุทูู ุงูุนุงููู ูุงุงุงูุตุฑุช ููุนู
[14/03/2025, 12:11:38โฏPM] ~โฏAhmed Abdulhafith Alkabyle: ุงููู ูุนุงููู
โ[14/03/2025, 1:00:27โฏPM] ~โฏAhmed Abdulhafith Alkabyle: Manual Credit Transfer & Credit Exemption for Student.pdf โข โ11 pages โ<attached: 00003296-Manual Credit Transfer & Credit Exemption for Student.pdf>
[14/03/2025, 1:00:27โฏPM] ~โฏAhmed Abdulhafith Alkabyle: Credit Exemption ุชูุง ุตุงุฑ ุงูููุงูู ููุชุญ ูู ููู 17 

ุงู ุงุฑุณู ุงููู ูู noorina@utm.my ููุง ุงููุณุฆููุฉ ุนู ุงู exemption
โ[14/03/2025, 1:00:27โฏPM] ~โฏAhmed Abdulhafith Alkabyle: โ<attached: 00003298-PHOTO-2025-03-14-13-00-27.jpg>
[14/03/2025, 1:00:29โฏPM] ~โฏAhmed Abdulhafith Alkabyle: ูุนูููู ุงูุณูุงู ูุฑุญูู ุงููู ูุจุฑูุงุชู 
ููุณ ุงูููู ูุด ููุฌูุฏ ูู ูููุน ุงููููุฉ

ุจุณ ุถุงูููู ุฌุฏูู ุงููุงูุฏ   
https://comp.utm.my/secrh/
[14/03/2025, 1:00:29โฏPM] ~โฏAhmed Abdulhafith Alkabyle: ุชุจุน ุชุงูู ูุงุญุฏ ุงู February intake 
ุงุฐุง ูุฐุง ุงูู ุณูุณุชุฑ ููู
[14/03/2025, 1:02:09โฏPM] ~โฏAli Elber: ุงูุณูุงู ุนูููู ูุฑุญูู ุงููู..... ุดุจุงุจ ูู software quality assurance ูููู ูุชุงุญ ูู semester?
[14/03/2025, 1:03:07โฏPM] ~โฏYusufZain: ู ุนูููู ุงูุณูุงู ู ุฑุญูุฉ ุงููู
[14/03/2025, 1:04:26โฏPM] ~โฏYusufZain: ุงุบูุจ ุงููุงุฎุฏู SQA ููููู ุณูุณุชุฑ 5 ู 6 ูู ุณูุณุชุฑ ุงูุซุงูู
[14/03/2025, 1:04:49โฏPM] ~โฏYusufZain: SQA ูููู ูุชุงุญ ูู ุงูุณูุณุชุฑ ุงูุซุงูู
[14/03/2025, 1:05:20โฏPM] ~โฏYusufZain: ูุนูู ุงูุณูุณุชุฑ ูุฏู ูุชุงุญ ุจุณ ุงูุจุนุฏู ูุงู
[14/03/2025, 1:05:41โฏPM] ~โฏAli Elber: ูููุชู
[14/03/2025, 3:32:27โฏPM] ~โฏMoqbel: ุงูุณูุงู ุนูููู ุงุญุฏ ุนูุฏู ุฑูู ุงู ุชูู
Prof. Ts. Dr. Wan Mohd Nasir bin Wan Kadir
[14/03/2025, 3:49:59โฏPM] ~โฏAhmed Abdulhafith Alkabyle: ูุงูุฑุฏ ุจุงูุนุงุฏุฉ ูู ุชูู
ุจุณ ุฌุฑุจ
โ[14/03/2025, 3:50:23โฏPM] ~โฏAhmed Abdulhafith Alkabyle: โ<attached: 00003309-PHOTO-2025-03-14-15-50-23.jpg>
[14/03/2025, 3:50:55โฏPM] ~โฏMoqbel: ุณููุช
โ[14/03/2025, 10:54:41โฏPM] ~โฏTk: โ<attached: 00003311-PHOTO-2025-03-14-22-54-41.jpg>
[14/03/2025, 10:55:46โฏPM] ~โฏTk: ุงูุณูุงู ุนูููู ุูุนููุด ุฅุฐุง ุงุญุฏ ูุนุฑู ุงูุงุณุชุงุฐู ุฏูู ุุงู ูุงุญุฏ ูููู ุฃุญุณู ุฅุฐุง ุณูุญุชู!ุ
[14/03/2025, 10:57:52โฏPM] Majoody: ุนุงูุฏุฉ ูููุณุฉ ุฌุฏุง
[14/03/2025, 10:57:54โฏPM] Majoody: ุฎุฐ ูุนูุง
[14/03/2025, 10:58:00โฏPM] Majoody: ุงูุจููุฉ ูุง ุงุนุฑููู
[14/03/2025, 10:58:05โฏPM] Majoody: ูุนูููู ุงูุณูุงู ูุฑุญูุฉ ุงููู ูุจุฑูุงุชู
[14/03/2025, 11:07:38โฏPM] ~โฏTk: ุดูุฑุงุุ๐ 
ุนุงูุฒ ุฒูู ุชุงูู ุจุฑุถู ุงุฎุฏ ูุน ุงูุจููู
[14/03/2025, 11:08:47โฏPM] ~โฏHanan Osama: ูุนูููู ุงูุณูุงู ูุฏ ุญุตู ุฃุฎุฏุช ูุน pang ูุจู ูุฏุง ุชุนุงููู ูููุณ ู ุจุฏู ุฏุฑุฌุงุช ูููุณุฉ โ<This message was edited>
[15/03/2025, 1:19:58โฏAM] ~โฏMoath_Mo.dev: ุฒูุฑุงููู ูููุณู
โ[15/03/2025, 3:04:09โฏAM] ~โฏAli Elber: โ<attached: 00003320-PHOTO-2025-03-15-03-04-09.jpg>
[15/03/2025, 3:04:34โฏAM] Majoody: ุดูุฑู
[15/03/2025, 3:04:51โฏAM] ~โฏAli Elber: ุชุณูููู
[15/03/2025, 3:12:41โฏAM] Majoody: ุงููู ูุณููู
[15/03/2025, 11:00:28โฏAM] ~โฏAbdulrahman Reda: โ~โฏAbdulrahman Reda joined from the community
[15/03/2025, 4:57:21โฏAM] ~โฏSu: โThis message was deleted.
โ[15/03/2025, 4:17:47โฏAM] ~โฏAli Elber: โ<attached: 00003326-PHOTO-2025-03-15-04-17-47.jpg>
[15/03/2025, 4:18:27โฏAM] ~โฏShams elshabrawy: ุงู ุญุงุฌู ุงูุง ููุฑ ุนุฒูุฒู๐
[15/03/2025, 4:18:47โฏAM] ~โฏShams elshabrawy: ุฏูุชูุฑ ุฎุทูุจ ุฑุงูู ูุฏุฑุฌุงุชู ุญููู
[15/03/2025, 4:20:46โฏAM] ~โฏAli Elber: ุชูุงู ุดูุฒุง
[15/03/2025, 9:31:46โฏAM] ~โฏAhmed Abdulhafith Alkabyle: ุงูุณูุงู ุนูููู ูู ูู ุญุฏ ุฌุฑุจ  ูุนุง ูุฐุง ุงูุฏูุชูุฑ ูุจู 
Dr. Cik Suhaimi bin Yusofุ

ููู ูุงู ุจุงูุดุฑุญ ูุงูุฏุฑุฌุงุช โ<This message was edited>
[15/03/2025, 9:32:33โฏAM] Nouredin: ู ุนูููู ุงูุณูุงูุ ุดูู ุงูุฑุณุงุฆู ุงูู ููู ุฏู ูุง ุตุฏููู โ<This message was edited>
[15/03/2025, 10:15:27โฏAM] ~โฏAhmed Abdulhafith Alkabyle: ูู ูู ุญุฏ ุฌุฑุจ  ูุนุง ูุฐู ุงูุฏูุชูุฑู   

Dr. Nor Haizan binti Mohamed Radzi

ููู ูุงูุช ุจุงูุดุฑุญยูุงูุฏุฑุฌุงุช
[15/03/2025, 11:18:46โฏAM] ~โฏSondos Moustafa: ุงูุณูุงู ุนููููุ ุญุฏ ูุนุงู ุฑูู Ms Aida ูู ุงู Academic office ? โ<This message was edited>
[15/03/2025, 5:05:34โฏPM] ~โฏkh: ูุง ุฌูุงุนุฉ ููู ููู ูุงุฏุฑ ูุฏุฎู ุงูุจูุฑุชุงู ููุณุฌู
[15/03/2025, 5:05:47โฏPM] ~โฏkh: ูููู ุงุญู ุงูููุถูุน
[15/03/2025, 5:06:35โฏPM] ~โฏOTP: ูุญุฏ ูุงุฏุฑ
[15/03/2025, 5:06:37โฏPM] ~โฏOTP: ูุทูุน ุงูุฑูุฑ
[15/03/2025, 5:06:59โฏPM] ~โฏkh: Invalid login?
โ[15/03/2025, 5:07:49โฏPM] ~โฏOTP: โ<attached: 00003339-PHOTO-2025-03-15-17-07-49.jpg>
[15/03/2025, 5:08:18โฏPM] ~โฏkh: ุทูุจ ูููู ูุณุฌู ุงูุญูู
[15/03/2025, 5:12:02โฏPM] ~โฏOTP: ูุงููุง ุฑุงุญ ูุณุฌูููุง ูู
[15/03/2025, 5:14:26โฏPM] ~โฏMajid: ุดุฑุญูุง ุนุงุฏู ู ุชุนุงูููุง ุฃุณูุฃ ูู ุงูุณูุก ู ุชุฎุณู ุจุงูุฏุฑุฌุงุช
[15/03/2025, 5:15:08โฏPM] ~โฏkh: ุงููุฏ ูุนูู ูุฑูุญ ููุงูุ
[15/03/2025, 5:15:16โฏPM] ~โฏkh: ููุง ูุงูู ูู
[15/03/2025, 5:17:42โฏPM] ~โฏOTP: ูุงุชุงุฎุฐ ุจ ููุงูู
[15/03/2025, 5:18:08โฏPM] ~โฏOTP: ูุฐุง ููุงู ุฌููุงูุง
[15/03/2025, 5:19:02โฏPM] ~โฏOTP: For your info, we r having issue with the course registration system. So we have temporary solution so that u all can join the class on 17 march onwards until the system issue settle. So we will register u all manually as for now. Any latest update i will inform in the group.

1. I will share the list of student name. U can check u belong to which section. 
2. I will ask the lecturer to share with me the meeting link, so that u can join class on 17.
3. U cannot change the section to avoid conflict. U must join the section that been assigned to u. 
4. For english, if ur english result not meet the req as i mentioned during the briefing, please take note to make amendment next week. 

Later i share the list of student name n class. I ll try today.
[15/03/2025, 5:19:13โฏPM] ~โฏOTP: ูุฐู ุฑุณุงูุชูุง ุจ ุงูุชููุฌุฑุงู
[15/03/2025, 5:29:01โฏPM] ~โฏkh: ุงูุง ุงุตูุง ูุณุฌู ุงูููุงุฏ ูู ุงูู
[15/03/2025, 5:29:10โฏPM] ~โฏkh: ุจุณ ููู ูุงุฏุฉ ุจุนูุฏูุง
[15/03/2025, 5:29:18โฏPM] ~โฏkh: ูุงุฒู
โ[15/03/2025, 5:29:46โฏPM] ~โฏkh: โ<attached: 00003352-PHOTO-2025-03-15-17-29-46.jpg>
[15/03/2025, 5:30:02โฏPM] ~โฏkh: ููู ุณูุดู ุจุณ ูุทุงูุจ ูุงุญุฏุ
[15/03/2025, 5:30:42โฏPM] ~โฏุงููุงุซู ุจุงููููฐู: ุงุฐุง ุจุชุนูุฏูุง ุบุงูุจุง ูุง ุญุชุนุฑู ุชุณุฌู ุงูุงู ุจูุง ุงูู ุณุฌูุช ูู ูุจู 
ุจุณ ูู ุงูammendment ุบุงูุจุง ุญุชุนุฑู
[15/03/2025, 5:31:22โฏPM] ~โฏAzzam Digale ๐ฑ: Science and technology โ๏ธโ๏ธ
[15/03/2025, 5:31:42โฏPM] ~โฏkh: ูุงูammendment ุฐุง ููู ุฃุณููู
[15/03/2025, 5:32:47โฏPM] ~โฏุงููุงุซู ุจุงููููฐู: ูู ุฎูุงุฑ amendment ูู ุงูุจูุฑุชุงู ุชุฎุชุงุฑู
[15/03/2025, 5:32:59โฏPM] ~โฏุงููุงุซู ุจุงููููฐู: ุงู ุชุฑูุญ ุนูุฏูู ุงูุงูููุณ
[15/03/2025, 5:34:42โฏPM] ~โฏุงููุงุซู ุจุงููููฐู: ูู ููู ูขู ุทุจุนุง
 ููุฏุฉ ุงุณุจูุน โ<This message was edited>
[15/03/2025, 5:46:58โฏPM] ~โฏkh: ุชูุงู
[15/03/2025, 5:47:06โฏPM] ~โฏkh: ูุนุทูู ุงูุนุงููุฉ
[15/03/2025, 5:48:45โฏPM] ~โฏkh: ุทูุจ ุนุดุงู ุงุดุฑุญ ููููู ุงูุง ุฑุณุจุช ูุงุฏุฉ ููุง ุจุงุฑุช ูก ู ูข
[15/03/2025, 5:49:14โฏPM] ~โฏkh: ููุงุฒู ุฃุนูุฏ ุจุงุฑุช ูก ูุงููุณู ุจุงุฑุช ูข ูุฏุฑู ููู
[15/03/2025, 6:13:32โฏPM] ~โฏุงููุงุซู ุจุงููููฐู: ููู ุงู academic advisor ุชุจุนู ููู ุจูุณุงุนุฏู
โ[15/03/2025, 6:13:41โฏPM] ~โฏุงููุงุซู ุจุงููููฐู: โ<attached: 00003365-PHOTO-2025-03-15-18-13-41.jpg>
[15/03/2025, 6:14:13โฏPM] ~โฏุงููุงุซู ุจุงููููฐู: ุจุณ ูู ุดู ุงุณูู course withdrawal ุชูุฏุฑ ุชูุบู ุงููุงุฏุฉ ูู ููู ูง ุงุจุฑูู
[15/03/2025, 10:10:25โฏPM] ~โฏโฆ: โ~โฏโฆ joined from the community
โ[15/03/2025, 10:10:41โฏPM] ~โฏโฆ: โimage omitted
โ[16/03/2025, 1:51:39โฏAM] ~โฏูููุฏ: โ<attached: 00003369-PHOTO-2025-03-16-01-51-39.jpg>
โ[16/03/2025, 4:03:01โฏAM] ~โฏAhmat: โ<attached: 00003370-PHOTO-2025-03-16-04-03-01.jpg>
[16/03/2025, 4:03:40โฏAM] ~โฏShams elshabrawy: ููุฑุนููู
[16/03/2025, 5:07:17โฏAM] ~โฏSalman Alameer: ููุฑุนููู ุงุฎุฐุช ูุนุงูุง ูุงุฏุชูู ูุจู ูุฐุง ุชุนุทู ุฏุฑุฌุงุช ุน ูุฏ ุชุนุจู ุจุณ ูุดููุชูุง ุงููุญูุฏู ุงููุง ูุงุชุฑุฏ ุนูู ุงู ุฑุณุงูู ุชุฑุณููุง ููุง ููุงุชุณูู ูุฑูุจ ููุณูุดู
โ[16/03/2025, 7:34:26โฏAM] ~โฏRami Mohamed: โ<attached: 00003373-PHOTO-2025-03-16-07-34-26.jpg>
[16/03/2025, 7:35:38โฏAM] ~โฏRami Mohamed: โPOLL:
web programming
โOPTION: pang (1 vote)
โOPTION: Nor azman (0 votes)
โOPTION: Aida (11 votes)
โOPTION: zuraifah (0 votes)
โ[16/03/2025, 12:56:26โฏPM] ~โฏโฆ: โ<attached: 00003375-PHOTO-2025-03-16-12-56-26.jpg>
[16/03/2025, 1:46:39โฏPM] ~โฏ๐: ุงูุณูุงู ุนูููู
[16/03/2025, 1:47:38โฏPM] ~โฏ๐: ูุง ุฌูุงุนุฉ ุงูู ุนูุฏู ุงูููู ุงูุณูุจุฑ ูุงูุฒุฑ ุนุฏููู ูุฑุณูู ุจุงููู ุงู ุงูู ูุนุฑู ููู ุงูุฏุฑ ุงุชูุงุตู ูุนูุง ูููุฏูู
[16/03/2025, 1:51:56โฏPM] ~โฏAhmed Abdulhafith Alkabyle: Adilah firdaus?
[16/03/2025, 1:57:27โฏPM] ~โฏMoath_Mo.dev: ูุชุง ููุชุญ ุงูุงูุฏููุช ุ
[16/03/2025, 1:57:43โฏPM] ~โฏ๐: ุงุชููุน
[16/03/2025, 1:58:12โฏPM] ~โฏ๐: ุงูุญูู ุจุงููุณุจู ููุณูุณุชุฑ ูู ูู ุงูุฏุฑ ุงุบูุฑ ุณูุดูู ูู ูุฐู ุงููุชุฑู ุ
[16/03/2025, 1:59:40โฏPM] ~โฏMoath_Mo.dev: ูุจ ุงุชููุน
โ[16/03/2025, 2:01:49โฏPM] ~โฏAhmed Abdulhafith Alkabyle: โ<attached: 00003383-Dr Adila Firdaus.vcf>
[16/03/2025, 2:17:25โฏPM] ~โฏ๐: ูุนุทููู ุงูุนุงููู ูุงุชูุตุฑูุง
[16/03/2025, 2:51:37โฏPM] ~โฏMoath_Mo.dev: ุ
[16/03/2025, 2:52:05โฏPM] ~โฏAhmed Abdulhafith Alkabyle: ุชูุฑูุจุง ุจูุฑุง 
17
[16/03/2025, 3:21:31โฏPM] ~โฏ๐: ุชูุจู ุฑุณุงุฆู ูุงุชุณ ููุง ูุงุฒู ุงุชูุงุตู ูุนูุง ุนุจุฑ ุงูุงูููู ุ
[16/03/2025, 3:29:24โฏPM] ~โฏAhmed Abdulhafith Alkabyle: ูู ูุจู ูุงูุช ุจุชุฑุฏ ุนุงููุงุชุณ ุนุงุฏู.
[16/03/2025, 4:38:20โฏPM] ~โฏAmr Qatab: ุงูุณูุงู ุนูููู 
ูุงุดุจุงุจ ููู ุงุฏุฎู ูุฑูุจ ุงูุชููุฌุฑุงู ูุทูุงุจ ุงูููุชูุฑู ุณูุณุชุฑ ูู
[16/03/2025, 4:39:07โฏPM] ~โฏAmr Qatab: โThis message was deleted.
[16/03/2025, 4:43:25โฏPM] ~โฏMohaned: ูุนูููู ุงูุณูุงู 
ูุง ุงุชููุน ูู ุฌุฑูุจ ูุณููุณุชุฑ ูุญุฏุฏ ููู ูู ุฌุฑูุจ ููู ูุงุฏุฉ โฆ ุดูู ุงู e learning ุบุงูุจุง ูู ุฏูุชูุฑ ุจูุนูู ุฌุฑูุจ ููุณูุดู ุญูู
[16/03/2025, 4:43:49โฏPM] ~โฏAmr Qatab: ุทูุจ ุงูุง ูุงุณุฌูุช ููุงุฏ ุนูู ุงุณุงุณ ุจูุณุฌูู ููุง ูู ุจูุฑู ๐
[16/03/2025, 4:49:00โฏPM] ~โฏMohaned: ุทูุจ ุจุฎุตูุต ุงูุชุณุฌูู ุชูุงุตู ูุน nurulaida@utm.my ูู ุงููุณุคููุฉ ุนู ุงูุชุณุฌูู ู ูู ุงูุณูุงุดู ูู ุงู ูู ููุงุด ููู ุฑูุญุงูู โฆ
[16/03/2025, 4:51:06โฏPM] ~โฏูุงุฑุณ ุงูุณููู: ุงูุณูุงู ุนูููู ูุง ุนูุงู ุงูุง ุณุฌูุช ููู ุดูุ ุจุณ ูุง ุทูุนุช ุนูุฏู ุงูููุงุฏ ูู elearning ูู ูุงุฐุง ุทุจูุนู ูููู ูุถุน ุงูููุงุณุงุช ุจูุฑุง ููู ุงุญุถุฑ ุจุฏูู ุฑุงุจุท ูู ุงูุฏูุชูุฑุ
[16/03/2025, 4:52:08โฏPM] ~โฏูุงุฑุณ ุงูุณููู: ุงูู ุนูุฏู ูุนูููู ูููุฏูุง
[16/03/2025, 4:53:20โฏPM] ~โฏAzzam Digale ๐ฑ: ูู ุชุฑุฏุ ููุฏ ุฃุฑุณูุช ููุง ุนุฏุฉ ูุฑุงุช.
[16/03/2025, 4:54:40โฏPM] ~โฏุงููุงุซู ุจุงููููฐู: https://elearning.utm.my/24252/
[16/03/2025, 4:54:43โฏPM] ~โฏAmr Qatab: ุชูุงู 
ุฌุฒุงู ุงููู ุฎูุฑ ุงูุฌุฒุงุก
[16/03/2025, 4:55:40โฏPM] ~โฏูุงุฑุณ ุงูุณููู: ูุนุทูู ุงูุนุงููู ๐ซก๐ซก
[16/03/2025, 4:56:25โฏPM] ~โฏุงููุงุซู ุจุงููููฐู: ุงููู ูุนุงููู
[16/03/2025, 6:00:36โฏPM] Hamdan Saleh: ุดุจุงุจ ูููู ุฌุฏูู ุงููุบุงุช
โ[16/03/2025, 8:22:24โฏPM] ~โฏA.: Foreign Language Timetable Semester 2 202425.pdf โข โ4 pages โ<attached: 00003402-Foreign Language Timetable Semester 2 202425.pdf>
[16/03/2025, 8:22:32โฏPM] ~โฏA.: @60172730164
[16/03/2025, 8:23:20โฏPM] Hamdan Saleh: ุชุณูู ูุงุบุงูู๐
โ[16/03/2025, 8:47:42โฏPM] Majoody: โimage omitted
โ[16/03/2025, 8:48:54โฏPM] Majoody: โimage omitted
[16/03/2025, 8:54:34โฏPM] ~โฏYoussey Tahoon: Mohd Foad ุงููุญูุฏ ุงููู ุณูุนุช ุนูู ููุงู ุญูู ูู ุงููุงุฏู ุตุฑุงุญู
[16/03/2025, 8:54:51โฏPM] Majoody: ุญุณุจ ูุง ุงุนุฑู ุฏุฑุฌุงุชู ูุด ููุงุจุฏ
[16/03/2025, 11:36:49โฏPM] โช+60ย11โ1880ย5285โฌ: โโช+60ย11โ1880ย5285โฌ joined from the community
[17/03/2025, 2:02:10โฏAM] ุญุงูุฏ ุงูุชูููู: โุญุงูุฏ ุงูุชูููู joined from the community
โ[16/03/2025, 9:42:06โฏPM] ~โฏFarah~โข: โ<attached: 00003411-PHOTO-2025-03-16-21-42-06.jpg>
[16/03/2025, 9:42:46โฏPM] ~โฏ966554008374: ูุซูุฑ ูุฏุญูุง shahliza
โ[16/03/2025, 9:43:06โฏPM] ~โฏFarah~โข: โ<attached: 00003413-PHOTO-2025-03-16-21-43-06.jpg>
[16/03/2025, 9:44:54โฏPM] ~โฏmaria: ุงู amendment ูููุชุญ ุจูุฑุง ููุง ุงุชุฃุฌู ูููู 20ุ
[16/03/2025, 9:46:42โฏPM] ~โฏMahmoud Elganzory: ruhidah
[16/03/2025, 9:47:50โฏPM] ~โฏOTP: ุชุงุฑูุฎ 20 ููู 27 ุงู ุดุงุก ุงููู
โ[16/03/2025, 9:57:00โฏPM] ~โฏFarah~โข: โ<attached: 00003417-PHOTO-2025-03-16-21-57-00.jpg>
[16/03/2025, 9:57:59โฏPM] ~โฏOTP: ุจุนุถ ุทูุงุจ ูุงููุง Izyan
[16/03/2025, 10:00:43โฏPM] ~โฏFarah~โข: ุทูุจ ููุง ุชุฏุฑูุณูุง ูููุณ ููุง ูููุชูู ุจู ุงูุงูุฑ ุงูู ุงุฐุงูุฑ ููุญุฏูุ
[16/03/2025, 10:01:07โฏPM] ~โฏFarah~โข: ู ุจุนุฏูู ูุนุงููุชูุง ูุน ุงูุทูุงุจ ุฎุตูุตุง ุงููุด ูุงููุฒููู
[16/03/2025, 10:01:44โฏPM] ~โฏmaria: norisam ุทูุจุ
[16/03/2025, 10:02:37โฏPM] ~โฏOTP: ูุงุนูุฏู ุนูู ูุงููู
ุงูุง ุณูุณุชุฑ ุงูู 
ูุชููููุง ุน ูุญูุฏ ู roz ู izyan ู ูุงูุช izyan ูู ุงูุงูุถู ุชุนุชุจุฑ
[16/03/2025, 10:04:25โฏPM] ~โฏOTP: ุงููู ูุดุชู ูุนุฑู ุนู ุงูุฏูุงุชุฑู ูุงูู ูุฑุฌุน ูู ูุฐู ุงูุฑุณุงูู ูููุฑู ุงููุญุงุฏุซุงุช ูู ุงุณุชูุณุงุฑุงุช ุนู ุงูุฏูุงุชุฑู
[16/03/2025, 10:13:01โฏPM] ~โฏMohaned: ุงุญูุฏ ูุงุฑุณ ูููุณ ูู ุงูุฏุฑุฌุงุช ุจุณ ุดุฑุญู ุณูุก
[16/03/2025, 10:18:12โฏPM] ~โฏMohaned: ุงูุฏูุชูุฑุฉ ูุงุฏู ูุฒุงุฌูุฉ ูู ุญุจุช ุงูุทุงูุจ ุญุชุณุงุนุฏู ูู ุงูุฏุฑุฌุงุช ู ุชุนุทูู ุฏุฑุฌุงุช ูููุณุฉ  ู ูู ูุฑูุชู ุญุชุนูู ุงููุณุชุญูู ุนุดุงู ุชููุตู ู ูู ุชูุฏุฑ ูููู ุงููุง ุชุฎููู ูุดูู ุงููุงุฏุฉ
[16/03/2025, 10:21:23โฏPM] ~โฏFarah~โข: ุงููู ุงูุจุฑ
[16/03/2025, 10:21:44โฏPM] ~โฏFarah~โข: ุทูุจ ูู ุญุฏ ุนูุฏู ุฑุงู ุชุงูู ๐
[16/03/2025, 10:21:48โฏPM] ~โฏBasil Abdalla Elsadig Ali: ููุณู ุงุณูุน ููุงู ูููุณ ุนู ุฏูุชูุฑ๐
[16/03/2025, 10:22:41โฏPM] ~โฏ.: ุงูููุงู ูุฐุง ุบูุฑ ุตุญูุญ ุงูุง ูู ุญุงูุงุช ุฎุงุตู ุฌุฏุง ูููุง ุฃุณุจุงุจูุง ูุบุงูุจุง ุชุตุฑูุงุช ุงูุทุงูุจ ูู ุงูู ุชุฃุซุฑ
[16/03/2025, 10:24:44โฏPM] ~โฏMohaned: ุงูุฏูุงุชุฑุฉ ุงููููุณูู ูู ุงูุดุฑุญ ู ุงูุฏุฑุฌุงุช ูุงุฏุฑูู ูู ุงููููุฉ ุนุดุงู ูุฏุง ูุงุฒู ุชุญุฏุฏ ุญุชุฏุฑุณ ูุญุงูู ู ุชุงุฎุฏ ุฏุฑุฌุงุช ููุง ุชุฏุฎู ูุน ุฏูุชูุฑ ุฏุงููุง ูุนุทูู ููุฑุฉ ูููุณุฉ ุนู ุงููุงุฏุฉ ููู ุญูููู ุดุฏูุฏ ุดููุฉ ูู ุงูุฏุฑุฌุงุช
[16/03/2025, 10:25:42โฏPM] ~โฏBasil Abdalla Elsadig Ali: ุงูุง ูุณู ุฏุงุฎู ุจุฑูุฏุฌููุฌ ุจูุฑุง 
ูู ูุณุชูู ุงูุฏูุงุชุฑุฉ ุณูุก ุจุดูู ุนุงูุ
[16/03/2025, 10:26:32โฏPM] ~โฏBasil Abdalla Elsadig Ali: ุงูุง ูุงุนุฏ ูู ุงูุฌุฑูุจ ูู ุดูุฑ 10 ููู ุฏูุชูุฑ ุงุณูุน ุนูู ุงูุง ูุชุดุฏุฏ ุงู ูุนุงููุชู ุณูุฆุฉ ุงู ูุง ููุตู ูุนูููุฉ
[16/03/2025, 10:27:09โฏPM] ~โฏ.: ุดุจุงุจ ูุงูู ุฏุงุนู ุงูุชุดุงุฆู 
ุงูุช ุจุณ ุณูู ุงูู ุนููู ูุงูุชุฒู ุจุงููุทููุจ
[16/03/2025, 10:28:17โฏPM] ~โฏMohaned: ุงูุณูุดู ุญููุง ูู ูฉ ุฑุณุจู ูู ุงููุงุฏุฉ ู ุฃุนุทุชูู ูู ุงุณุงูููุช ุตูุฑ ู ููู ูููุชูุง ูุงูุชูู ุงุนุทูุชู ุงูุชุฑ ููุง ุจุชุณุชุงูู
[16/03/2025, 10:29:11โฏPM] ~โฏMahmoud Elganzory: ูู ุฏูุงุชุฑุฉ ูููุณูู ูุชูุฑ ููู ููู ุจูุนุชูุฏ ุนูู ุชุนุงููู ูุน ุงูุฏูุชูุฑ
[16/03/2025, 10:30:10โฏPM] ~โฏ.: ุงุฎูู ุงูุง ููุฏุฑ ุญุงูู
ุจุณ ุงุฐุง ุตุงุฑ ุฐุง ุงูุดู ูููู ูู ุณุจุจ ุฎุงุต ุงู ุชุนุงูู ุฎุงุทุฆ
ูููู ุชูุงุตู ุงููุบู ููุณู ูุงู ุจุทุฑููู ุบูุฑ ุตุญูุญู 
ููุงูู ุชูุงุฆู ุฏุงููุง ูุณูู ุงูู ุนููู ูุฎูุงุต
[16/03/2025, 10:32:13โฏPM] ~โฏkh: ูุงูุญุจูุจ ุงุฐุง ุงูุช ุนุงููุชู ูููุณ ูู ูุนูู ุตุงุฑุช ูููุณุฉ ูุงููู
[16/03/2025, 10:32:14โฏPM] ~โฏAmar Hassan: ุฃููุฏ ุ ูุงู ูู ุดููู ูุงุญุฏ ูููู ููู ูุฎุชูู
[16/03/2025, 10:32:44โฏPM] ~โฏkh: ุงูุฑุฌุงู ูุง ุฑุญ ูุฌูุณ ููุฐุจ ุนูู ุงุณู ุงูุฏูุชูุฑ ููุฃูู ููุงู ูู ูุงุฎุฐ ุนูู ููุงูู ูุฎูุงุต
[16/03/2025, 10:33:25โฏPM] ~โฏOTP: ูุงุชุงุฎุฐ ุจููุงูู ุฒูุฏ ุงุชุงูุฏ
 ุงููู ุณูุนุชู 20 ููู 27
[16/03/2025, 10:33:45โฏPM] ~โฏ966554008374: ูุญุฏ ูุงุฎุฐ ุจููุงู ุงุญุฏ ููุง ุดู ุงูุชุง ุงุณูุน ูู ุงููู ููุงุฑู ุจูููู ูุงุฎุชุงุฑ ุงูุฐู ุชุฑุชุงุญ ูู
[16/03/2025, 10:34:11โฏPM] ~โฏkh: ุงุญุณู ุดู ุตุงุญุจ ูู ุงูุฏูุงุชุฑุฉ ูุนุงูููู ูุนุงููุฉ ุฌุฏุง ูููุณุฉ
[16/03/2025, 10:34:19โฏPM] ~โฏ966554008374: ุจุงูุงุฎูุฑ ุงูููุถูุน ูุนุชูุฏ ุนููู ูุงููู ูู ุงูุฏูุชูุฑ ุดูุทุงู
โ[16/03/2025, 10:34:31โฏPM] ~โฏAmar Hassan: ACADEMIC-CALENDAR-DEGREE-AND-POSTGRADUATE-2024_2025.pdf โข โ4 pages โ<attached: 00003444-ACADEMIC-CALENDAR-DEGREE-AND-POSTGRADUATE-2024_2025.pdf>
[16/03/2025, 10:34:46โฏPM] ~โฏAmar Hassan: ุนูู ุญุณุจ ูุฐุง ุงูุฌุฏูู ููุชูุจ 18ุ ุงูุงูููู ูุฐุง ูู ุฃุณุจูุน ูุฏุฑู ุฅุฐุง ุบูุฑูุง ุงู ูุง
โ[16/03/2025, 10:35:26โฏPM] ~โฏRazan Salah: โ<attached: 00003446-PHOTO-2025-03-16-22-35-26.jpg>
[16/03/2025, 10:36:55โฏPM] ~โฏ.: ุตุญ ููุงูู 
ุจุณ ุงูุง ูุณุง ูุง ุชุนุงููุช ูุน ุฃู ุฏูุชูุฑ ููุงูู ุจููู ูุชูุงุฆู ูุงูู ุญุชู ูู ูุนูุง ุงูููุงู ุตุญูุญ ุจุฃูู ุงูุฏูุชูุฑ ุงูููุงู ูุฐุง ุชุนุงููู ุณูุก 
ุงูุงุญุจุงุท ูุง ุจูุฌูุจ ูุชูุฌู ูุงูุงูุถู ูุณูู ุงูู ููุฏุฑ ูุฎูุงุต
[16/03/2025, 10:37:39โฏPM] ~โฏ.: ุตุญ ูุน ุงููุงุณ ูููุง ุนูููุง
[16/03/2025, 10:38:41โฏPM] Hamdan Saleh: ุงุฐุง ุงูุช ูุฌุชูุฏ ุนูุฏูุง ูุญูุธุช ุงุณูู ุจุชุนุงููู ุงุญุณู ูุนุงููู
[16/03/2025, 10:44:15โฏPM] ~โฏMohaned: ุงุชูู ูุนุงู ุ ุงู ูุงุญุฏ ุนูุฏ ุงุฒูุงู ุถุฑูุฑู ูุดูู ูุฐุง ุงูููุงู ูุงูู ูุฐุง ุญููุฑู ูุชูุฑ ู ูู ุงูููุงูุฉ ุงูุฏูุชูุฑ ูู ุดุงูู ูุฌุชูุฏ ูุง ุญูุธููู
[16/03/2025, 10:45:14โฏPM] ~โฏkh: ุฌูุงุนุฉ ุงูุฏูุงู ูุจุฏุง ุงููููุ
[16/03/2025, 10:45:26โฏPM] ~โฏkh: ููู ุนูุฏู ุงู timetable
[16/03/2025, 10:45:35โฏPM] ~โฏkh: ููู ุงูุณูุงุดู
[16/03/2025, 10:45:35โฏPM] ุฃุณุงูุฉ ุงูุญุณุงู ูุงููุฏูุดู: ุงููู
[16/03/2025, 10:46:10โฏPM] ~โฏkh: ููู ูุงุฏุฑ ุงูุงููู
[16/03/2025, 10:47:08โฏPM] ุฃุณุงูุฉ ุงูุญุณุงู ูุงููุฏูุดู: https://bit.ly/202420252x
[16/03/2025, 10:52:58โฏPM] ~โฏkh: ูุนุทูู ุงูุนุงููุฉ
โ[16/03/2025, 10:53:31โฏPM] ~โฏkh: โ<attached: 00003458-PHOTO-2025-03-16-22-53-31.jpg>
[16/03/2025, 10:53:43โฏPM] ~โฏkh: ููู ุงูููุงุฏ
[16/03/2025, 10:55:46โฏPM] ุฃุณุงูุฉ ุงูุญุณุงู ูุงููุฏูุดู: ุงููู ูุนุงููู
[16/03/2025, 10:56:18โฏPM] ุฃุณุงูุฉ ุงูุญุณุงู ูุงููุฏูุดู: ุทุจูุนูุ ูุณุง ุงูุฏูุงุชุฑุฉ ูุง ูุฒููุง ุงู materials ุชุจุน ุงูููุงุฏ
[16/03/2025, 11:05:08โฏPM] ~โฏkh: ุงููุง ุจุณ ููู ุงุฏุฎู ูุฑูุจุงุช ุงููุงุชุณ ุนุดุงู ุงุญุถุฑ ุงูููุงุฏ
[16/03/2025, 11:05:12โฏPM] ~โฏkh: ุงูุงูููุงูู
[16/03/2025, 11:05:39โฏPM] ~โฏMahmoud Elganzory: ูููู ูููุฒูููุง ุนูู ุจูุฑู ุงู ุจุนุฏู
[16/03/2025, 11:36:13โฏPM] Majoody: ูู ุทุงูุจ ูู ุชุฌุฑุจุฉ ูุฎุชููุฉ 
ุนูู ุงูุนููู ุจุนุทู ูู ุนูุฏู ูู ูุฌูุฉ ูุธุฑู ุงูุง ููุท ูุงุดูู ูุชุงูุฌูุง ุทูุจุฉ. ุงุฎูุงูู ุทูุงุจ ุงูู ุณูุณุชุฑุงุช :
- ูุง ูููู ูุงูู ุชุฑููุฒูู ุงุฐุง ุงูุฏูุชูุฑ ููููู ุงู ูุง ุจุงูููุงูุฉ ุงูุช ุจุชูุนุฏ ุชุญูุฑ ุจููู ูุจูู ููุณู ุจุงูููุงุฏ ุ ูุดุฑุญ ( ุฃุบูุจูุฉ )ุงูุฏูุงุชุฑุฉ ุบูุฑ ูุงูู ุงุจุฏุง ุจุงููุงููู ุงู ุงูููุฏ ุ ุงูุฌูุฏ ุงูุดุฎุตู ุทุจุนุง ุงูู ูู ุงูุฏูุชูุฑ ุจููุณู. ูุฃูุง ุฃูุถู ุงุดูู ุฏูุชูุฑ ูููู ูุณุท ุจูู ุงูุฏุฑุฌุงุช ูุงูุดุฑุญ ุ ุฃู ุญุชู ุฏุฑุฌุงุช ุจุฏูู ุดุฑุญ . 
- ุงูููุทุฉ ุงูุซุงููุฉ ููุถูุน ุงููุฑูุจุงุช ุงููุฑูุจุงุช ุงููุฑูุจุงุช ุ ุดูู ูู ูุฑูุจ ุทูุจ ูู ุงูุญูู ููุตูุฑ ุชูุตููู ูุน ุจุนุถ ุจููุฉ ุงูุณูุณุชุฑุงุช ูุจูู ุงูููุงุฏ ูุงุดูู ุงูููุทุฉ ูุฐู ุงูู ูู ุงูุฏูุชูุฑ ููุณู ุ ุงููุฑูุจ ุญูู ูููู ูุฎุณู ููู ุงูุฏุฑุฌุงุช ูู ูุง ูุงู ุทูุจ ูุญู ุดุฏ 
- ุงูููุทุฉ ุงูุฃุฎูุฑุฉ ูู ุจุชูุฑู ูุนู ุจุฏุฑุฌุงุชู ูุซููููุฑ ูู ูู ุงูุฃุณุฆูุฉ ุงูุณุงุจูุฉ ููุณููุงุช ูู ูุงุชุช ุ ุฑูุฒูุง ุนูููุง ุจุดูู ูุจูุฑ ุฌุฏุง ูุงูู ูููู ุงูู ุชููู ุฏุฑุงุณุฉ ูุงุฏุฉ ูุงูู ุชุฌู ุชุญู ูุง ุจุชุนุฑู ุชุญู ูุงูู ุทุฑููุฉ ุงูุณูุงู ูู ูุงูููุง .
ุงููู ูููู ุงูุฌููุน โ<This message was edited>
[16/03/2025, 11:38:55โฏPM] ~โฏBasil Abdalla Elsadig Ali: ุฌุฒุงู ุงููู ุฎูุฑุง
[16/03/2025, 11:39:04โฏPM] Majoody: ุฃุฌูุนูู ูุงุฑุจ ๐ค
[17/03/2025, 2:13:32โฏAM] ~โฏูููุฏ: *ุจุณู ุงููู ุงูุฑุญูู ุงูุฑุญูู* 

 *ุงูุณูุงู ุนูููู ูุฑุญูุฉ ุงููู ูุจุฑูุงุชู* ุ 

ูุณุฑูุง ุฏุนูุชูู ููุงูุถูุงู ุฅูู 

 *YSAG GROUPS* 

ููู ููุตุฉ ูููุฒุฉ ุชุฌูุน ุงูุทูุงุจ ูุงูููุชููู ูู ูุฎุชูู ุงูุชุฎุตุตุงุช ุงูุฃูุงุฏูููุฉ ูุงูููููุฉ.  

ูุถู ูุฐุง *ุงููุฌุชูุน* ูุฌููุนุงุช ูุชุฎุตุตุฉ ุชุชูุญ ููู ูุฑุตุฉ ุงูุชูุงุตู ูุงูุงุณุชูุงุฏุฉ ูู ุชุฌุงุฑุจ ุงูุขุฎุฑูู ูู ุงููุฌุงูุงุช ุงูุชุงููุฉ:
  

- ุงูุจุฑุฏุฌูู 

- ุงูุจุฑุฏุฌูู - ( *ูุฌูุชุน ูุณุงุฆู* )

- ุงูููุฏุณุฉ ุงูููุฑุจุงุฆูุฉ

- *ุงูููุฏุณุฉ ุงูููููุงุฆูุฉ* 

- ุงูููุฏุณุฉ ุงููููุงููููุฉ 
 
- ููุฏุณุฉ ุงูุญุงุณุจ

- ููุฏุณุฉ ุงูุจุชุฑูู  

- ุฅุฏุงุฑุฉ ุงูุฃุนูุงู (Business Management)  

- ุจุงูุฅุถุงูุฉ ุฅูู ูุฌููุนุฉ ูุฎุตุตุฉ ูุทูุงุจ ุงููุงุฌุณุชูุฑ ูุงูุฏูุชูุฑุงู (PhD & Master Students).  


ูุฏููุง ูู ุจูุงุก ูุฌุชูุน ุฃูุงุฏููู ููููู ูุชูุงูู ูุนุฒุฒ ูู ูุฑุต ุงูุชุนูู ูุงูุชุนุงูู.  


๐ก ุฅุฐุง ููุช ููุชูุงู/ููุชูุฉ ุจุงูุงูุถูุงู ุฅูู ูุฐุง ุงููุฌุชูุน ุงููููุฒุ *ูุฑุฌู ุงูุถุบุท ุนูู ุงูุฑุงุจุท* :

https://chat.whatsapp.com/Hj0GOae55iu4q2ejEilFy2


ูุณุนุฏ ุจุงูุถูุงููู ููููู ูุนูุง ุฌุฒุกูุง ูู ูุฐุง ุงููุฌุงุญ ุงููุดุชุฑู.  

 *YSAG* 
 *ISS-YEMEN*
[17/03/2025, 2:14:48โฏAM] ~โฏUnkown: ูุง ุดุจุงุจ ูููุน ุงูุฌุงูุนุฉ ููุชูุญ ูุนูู ุงูู ูู course registration? โ<This message was edited>
[17/03/2025, 2:23:03โฏAM] ~โฏAhmat: ููููุ ุงูู ูุง ูุญู ูุณุฌู ุฑุงุญ ูุชุณุฌู ุชููุงุฆู ูู ุงููููุฉ ุจุงููุณุจุฉ ููุณููุชููุฑ
[17/03/2025, 2:23:31โฏAM] ~โฏUnkown: ูุง ุงุจุบุง ุงุณุฌู ุงุจุบุง ุงุนุฏู โ<This message was edited>
[17/03/2025, 2:23:44โฏAM] ~โฏ966554008374: ุงูุณููุชููุฑ ูุฏ ุงุฑุณููุง ููุง ุงูุฌุฏูู
[17/03/2025, 2:23:48โฏAM] ~โฏ966554008374: ูุณุฌูููุง
[17/03/2025, 2:24:44โฏAM] ~โฏ966554008374: ุงูุชุธุฑ ููamendment week
[17/03/2025, 2:24:50โฏAM] ~โฏLoai AlQadasi (LQAD): ุงูุชุนุฏูู ุนูุฏู ุชุฑูุญ ูููููุฉ ููุณูุง ุฃู ุชุฑุณู ูุงุญุฏ 


ุฃู ุชูุชุธุฑ ููู ุชุงุฑูุฎ 20 ููุชุญ ุงูammendmnt
[17/03/2025, 2:25:15โฏAM] ~โฏUnkown: ุชูุงู ูุนุทููู ุงูุนุงููุฉ
[17/03/2025, 2:36:37โฏAM] ~โฏNaif: ุงูุณูุงู ุนูููู
[17/03/2025, 2:36:39โฏAM] ~โฏNaif: ุตุจุงุญ ุงูุฎูุฑ
โ[17/03/2025, 2:36:49โฏAM] ~โฏNaif: โimage omitted
[17/03/2025, 2:38:31โฏAM] ~โฏNaif: ูู ูู ุงุญุฏ ุฏุฑุณ ุนูุฏูุง ุดูุ ูุงูู ููุฒู ูุงุฏุฉ ุนูุฏ ุฏูุชูุฑ ู ูุฌุฃุฉ ุชุบูุฑ๐๐ โ<This message was edited>
[17/03/2025, 2:44:09โฏAM] ~โฏSondos Moustafa: ุงูุณูุงู ุนููููุ ูู ุงู amendment ูููุชุญ ุงูุชู ุ
[17/03/2025, 2:48:06โฏAM] ~โฏูุงุฑุณ ุงูุณููู: 20-27
[17/03/2025, 2:48:17โฏAM] ~โฏ.: ุงูุณูุงู ุนูููู 
ูุฐุง ุงูุด ุ
[17/03/2025, 2:48:24โฏAM] ~โฏูุญูุฏ: ุชูุฒุญุ ุงุฌูููุ
[17/03/2025, 2:48:59โฏAM] ~โฏูุงุฑุณ ุงูุณููู: ูุชุฑุฉ ุชุนุฏูู ุงูุณูุงุดู
[17/03/2025, 2:49:19โฏAM] ~โฏAbdulkader: ุฃุญูุงููุง ูุญุทูุง ุฑุงุจุท ุงููุฑูุจ ูู ูุณู ุงููAnnouncements
[17/03/2025, 2:54:31โฏAM] ~โฏAbdulkader: ููุถูุน ุงููุฑูุจุงุช ูููู ููุตู ุจูู ูุฌุงุญู ูุจูู ุฑุณูุจู ูู ุงููุงุฏุฉ ุญุฑูููุง.

ูููู ุงูุช ุชุดุชุบู ูุชูุธูู ูุน ูุฑูุจ ูุณูุงูุ ููููู ุงูุช ูุณูุงู ูุชุฏุฎู ูุน ูุฑูุจ ููุฑู ูุชูุดู ุจุงูุญุธ. ูู ููุชุง ุงูุญุงูุชูู ุญุงูู ุชุถุจุท ูุถุนู ูุชุดุชุบู ูููุณ.
โ[17/03/2025, 2:55:50โฏAM] ~โฏAbdulkader: โ<attached: 00003488-PHOTO-2025-03-17-02-55-50.jpg>
[17/03/2025, 2:56:02โฏAM] ~โฏ.: โThis message was deleted.
[17/03/2025, 2:56:04โฏAM] ~โฏAbdulkader: *ุชู ุชุฃุฌูู ุงููamendment* โ<This message was edited>
[17/03/2025, 3:11:43โฏAM] ~โฏูุงุฑุณ ุงูุณููู: +1
[17/03/2025, 3:39:58โฏAM] ~โฏFarah~โข: ุงูุณูุงู ุนูููู 
ูู ุญุฏ ุนูุฏู ุฑูู ุงูุฏูุชูุฑุฉ ุฏูู
Ms. Hazinah binti Kutty Mammi (P)
โ[17/03/2025, 3:47:51โฏAM] ~โฏูุญูุฏ: โ<attached: 00003493-Hazinah.vcf>
[17/03/2025, 3:48:59โฏAM] ~โฏMohamad Noureddine: ููุชุงุฒุฉ ุฌุฏุง
[17/03/2025, 3:49:05โฏAM] ~โฏMohamad Noureddine: ูุง ุชุนุฑู ุชุดุฑุญ ุจุณ ุจุชูุฒุน ุนูุงูุงุช
[17/03/2025, 3:49:24โฏAM] ~โฏูุญูุฏ: ูุชุณูุจ ููุงุณุงุช ุจุงููุจู ๐
[17/03/2025, 3:49:51โฏAM] ~โฏNaif: ุญูููู ุจุณ ูุงุฒู ุงุดูู ูู ุงูููุฏ ู ุงููุงููู๐
[17/03/2025, 3:50:34โฏAM] ~โฏFarah~โข: โThis message was deleted.
[17/03/2025, 3:50:46โฏAM] ~โฏNaif: ูุนุทููู ุงูุนุงููุฉ
[17/03/2025, 3:50:50โฏAM] ~โฏHebaโจ: Dr Adnan Khalid ููู ุ
โ[17/03/2025, 3:50:54โฏAM] ~โฏNaif: โ<attached: 00003501-STICKER-2025-03-17-03-50-54.webp>
[17/03/2025, 3:51:00โฏAM] ~โฏHebaโจ: ูู NC
[17/03/2025, 3:51:00โฏAM] ~โฏMohamad Noureddine: ุงููู ูุนุงููู
โ[17/03/2025, 3:51:47โฏAM] Ali Eslam: โ<attached: 00003504-PHOTO-2025-03-17-03-51-47.jpg>
[17/03/2025, 3:52:49โฏAM] ~โฏูุญูุฏ: ููุชุญ ุชุงุฑูุฎ 20 ูุงููุง 
ุจุณ ูุจ ุงููููุน ูุนุทูุจ ุนูุฏ ุงููู ุชูุฑูุจุง
[17/03/2025, 3:54:52โฏAM] Ali Eslam: bro I'm doing the course registeration with penalty I don't have time for 20th ๐ญ
โ[17/03/2025, 4:10:00โฏAM] ~โฏFarah~โข: โ<attached: 00003507-PHOTO-2025-03-17-04-10-00.jpg>
โ[17/03/2025, 4:10:09โฏAM] ~โฏFarah~โข: โ<attached: 00003508-PHOTO-2025-03-17-04-10-09.jpg>
[17/03/2025, 4:10:29โฏAM] ~โฏFarah~โข: ูุนูุด ูู ูููู ุฑูู ุงูุฏูุงุชุฑุฉ ุฏูู ููุงู ูู ุงุญุฏ ุนูุฏู
โ[17/03/2025, 4:10:55โฏAM] ~โฏYoussey Tahoon: โ<attached: 00003510-Dr. Ruhaidah Samsudin.vcf>
โ[17/03/2025, 4:17:45โฏAM] ~โฏูุงุฑุณ ุงูุณููู: โ<attached: 00003511-PHOTO-2025-03-17-04-17-45.jpg>
[17/03/2025, 4:18:14โฏAM] ~โฏูุงุฑุณ ุงูุณููู: Puan Rashidah Binti Kadir
[17/03/2025, 4:32:58โฏAM] ~โฏMohamad Noureddine: ุงูุง ุจูุนุฌุจูู ุดุฑุญูุง ูุงุนุทุชูู ุนูุงูุฉ ูููุณุฉ ุฌุฏุง ุ ุจุณ ุณูุนุช ุบูุฑู ุจูููููุง ุดุฑุญูุง ูู ุญูู
[17/03/2025, 4:33:06โฏAM] ~โฏAbdulkader: Personally, I've never had to pay any penalty the few times I registered late like this โ<This message was edited>
[17/03/2025, 4:34:19โฏAM] ~โฏูุงุฑุณ ุงูุณููู: ููู ุงูุนูุงูุงุช ูุนุงูุง ูู ุงุบูุจ ุงูู ุฎุดู ูุนุงูุง ุฌุงุจ ุฏุฑุฌุงุช ููุง ุ
[17/03/2025, 4:36:24โฏAM] ~โฏMohamad Noureddine: ูููู ูู ุงููุงุฏุฉ ูุงูุช cryptography ุตุนุจุฉ ูู ูู ุทุงูุจ ุฑุณุจ ุจุณ ุงูุงุบูุจ ุนูุงูุงุชู ุญููุฉ ุนูู ุญุฏ ุนููู
[17/03/2025, 4:37:00โฏAM] ~โฏูุงุฑุณ ุงูุณููู: ุงููู ูุณููู ูุดููุฑ ๐๐ป
[17/03/2025, 4:55:49โฏAM] ~โฏS3DOUN: โ~โฏS3DOUN joined from the community
โ[17/03/2025, 5:23:52โฏAM] ~โฏLoai AlQadasi (LQAD): โ<attached: 00003519-PHOTO-2025-03-17-05-23-52.jpg>
[17/03/2025, 5:25:04โฏAM] Majoody: ุงูุฏูุฑุง
[17/03/2025, 5:25:07โฏAM] Majoody: ููุชุงุฒุฉ ูุทูุจุฉ
[17/03/2025, 5:27:40โฏAM] ~โฏLoai AlQadasi (LQAD): ูู ุฃุญุฏ ุนูุฏู ููู ุงูุฌุฑูุจ ุฐุง ูุง ุดุจุงุจ
[17/03/2025, 5:31:39โฏAM] ~โฏL: โ~โฏL joined from the community
[17/03/2025, 5:33:59โฏAM] ~โฏHanan Osama: โThis message was deleted.
[17/03/2025, 5:37:04โฏAM] ~โฏูููุฏ: โThis message was deleted.
[17/03/2025, 5:37:32โฏAM] ~โฏูููุฏ: https://chat.whatsapp.com/Hj0GOae55iu4q2ejEilFy2
[17/03/2025, 5:58:39โฏAM] ~โฏYusufZain: ุณูุงู ุนูููู, ุนุงูุฒ ุงุณุฃู ุงุฏุง ุงูุฏุฑ ุงุณุฌู ููุงุฏ ุงููุบุฉ (ูุฑูุณู, ุตููู, ูุงุจุงูู) ูู short semester ุ
[17/03/2025, 6:13:10โฏAM] ~โฏใ โโข โกฬฌฬฉฬะดฮฒฦกวชฦกฤยฒยบยนยณ: ูู ุญุฏ ุนุฑู ุงูุด ุงุฎุฑ ุงูุงุฎุจุงุฑ ููุดููู ุงูุชุณุฌูู ุจุงููุณุจู ููุทูุงุจ ุงูู ุงูููุฑูุถ ูุณุฌูู ุงูููู ูุน ุบุฑุงูู ุชุงุฎูุฑ ููุง ูุฑูุญ ููู
[17/03/2025, 6:15:23โฏAM] ~โฏHanan Osama: โThis message was deleted.
โ[17/03/2025, 6:16:59โฏAM] ~โฏHanan Osama: โ<attached: 00003530-PHOTO-2025-03-17-06-16-59.jpg>
โ[17/03/2025, 7:09:10โฏAM] ~โฏ~Moayed: โ<attached: 00003531-PHOTO-2025-03-17-07-09-10.jpg>
[17/03/2025, 7:09:57โฏAM] ~โฏ~Moayed: ูู ุงุญุฏ ูุนุฑููุงุ
[17/03/2025, 7:10:13โฏAM] ~โฏHebaโจ: ุนุงุฏูุฉ ุตุฑุงุญุฉ
[17/03/2025, 7:10:23โฏAM] ~โฏHebaโจ: ุดุฑุญ ุนุงุฏู ู ูู ุงูุฏุฑุฌุงุช ุจุชุฏูู ุญูู
[17/03/2025, 7:10:31โฏAM] ~โฏHebaโจ: ุงุฎุฏูุง ูุนุงูุง digital
[17/03/2025, 9:59:49โฏAM] ~โฏAmr Qatab: โThis message was deleted.
โ[17/03/2025, 3:02:13โฏPM] ~โฏูููุฏ: Borang-Pembetulan-Kursus.pdf โข โ1 page โ<attached: 00003537-Borang-Pembetulan-Kursus.pdf>
[17/03/2025, 3:24:10โฏPM] ~โฏAmr Qatab: โThis message was deleted.
โ[17/03/2025, 3:24:44โฏPM] ~โฏAmr Qatab: โ<attached: 00003539-PHOTO-2025-03-17-15-24-44.jpg>
โ[17/03/2025, 3:25:57โฏPM] ~โฏAmr Qatab: โ<attached: 00003540-PHOTO-2025-03-17-15-25-57.jpg>
[17/03/2025, 3:26:46โฏPM] ~โฏNaif: ุดุฑุญู ุณูุก ุจุณ ููุงู ุจุงูุฏุฑุฌุงุช ุ ูุงุฒู ุชุฐุงูุฑ ูู ุงูุจูุช
โ[17/03/2025, 3:28:21โฏPM] ~โฏAmr Qatab: โ<attached: 00003542-PHOTO-2025-03-17-15-28-21.jpg>
[17/03/2025, 5:18:34โฏPM] ~โฏูุงุฑุณ ุงูุณููู: ุงูุชุจู ูู Seah ูุง ุชุฎุด ูุนุงู
[17/03/2025, 5:19:10โฏPM] ~โฏูุงุฑุณ ุงูุณููู: ุณูุนุช ูุฎุณู ุฏุฑุฌุงุช ู ุงุบูุจ ุงูุทูุจู ุนูุฏู ุตูู
[17/03/2025, 5:19:44โฏPM] ~โฏูุงุฑุณ ุงูุณููู: Nur eiliyah ููููู ูููุณู
[17/03/2025, 5:20:11โฏPM] Majoody: ุฏุฎูุช ูุน seah ูุจู
[17/03/2025, 5:20:20โฏPM] Majoody: ุงูุฏูุชูุฑ ูููุณ ููุนุง ูุง ูุฏุฑุฌุงุชู ุทูุจุฉ
[17/03/2025, 5:20:32โฏPM] Majoody: ููุนุทููู ููุชุงุช ูููุงููู ุ ููุง ุดูุช ููู ุฃู ุนูุตุฑูุฉ
[17/03/2025, 5:20:43โฏPM] Majoody: ูู ุฌุชูู ูุงุฏุฉ ูุนู ุจุงุฎุฐูุง ๐๐ป
[17/03/2025, 5:21:43โฏPM] ~โฏูุงุฑุณ ุงูุณููู: ูุงุญุฏ ูู ุงูุนูุงู ุงูุณูุณุชุฑ ุงููุงุถู ููู ุบูุฑ ุงูุณูุดูุ ุจุฑุถู ูุง ูู ุนุฑุจ ุนูุฏู
โ[17/03/2025, 5:27:53โฏPM] Majoody: โ<attached: 00003551-PHOTO-2025-03-17-17-27-53.jpg>
โ[17/03/2025, 5:27:54โฏPM] Majoody: โ<attached: 00003552-PHOTO-2025-03-17-17-27-54.jpg>
[17/03/2025, 5:37:56โฏPM] ~โฏAhmed Abdulhafith Alkabyle: ุจุงููุณุจุฉ ู seah ุฎุฐูุช ูุนุงู ูุฑุชูู ูุนู ุชุฌุฑุจู

ุชุนุงููู ุงูููุณ ูุดุฑุญู ุงูููุณ 
ุจุณ ููุนูุชู ูุงูุบุทูุด ูู ูู ุงูุณูุงูุฏ ูุฌู ูุดุฑุญ ุงูููุฑู ุงูุงุณุงุณูุฉ ูู topics ูููุฑ ุนู ุงุดูู example 

ูุจุงููุณุจู ูููุนูุชู ูู ุงูุฏุฑุฌุงุช

ุงู 1- assignment ูุนุทูู ูู ูุงุฑู ุญุชู ูู ูุณูู ูุชุฃุฎุฑ ูุญุชู ูู ุญูู ุบูุท 

ูุฏููุง ูุชุณุงูู ูู ูุงุญูุฉ ููุนุฏ ุงูุชุณููู ูููู ุงูููู ูุจู ูุง ุงูุง ูุจุฏุง marking

ุจุงููุณุจู ูู 2- project ูุดุฑุญูู ุดู ุงุฏูุฑ ุจุงูุฒุจุท  ููููู ุงูุด ุงุชุตูุญ ูุจู ุงุชุณููู ุจุณ ูุนุทูู ุญูู ููู ูู ูุงุญูุฉ ุฏุฑุฌุงุช 

3- ูู test ุจูุนุทูู tips ู reviews ููุนุทูู ุดุจู ูู ุงู test 

4- ุงู final ูุด ุญูุณุงุนุฏู ููู ุงูุช ูุฏุฑุงุณุชู ูู final
โ[17/03/2025, 5:39:30โฏPM] ~โฏL: โimage omitted
[17/03/2025, 5:40:37โฏPM] ~โฏL: Dr.Zurainai
[17/03/2025, 5:42:57โฏPM] ~โฏL: ูุงู ูุญุฏู ุชูุตุญููุง ูุงุฎุฐ ูุนูุง ุงู oop
[17/03/2025, 5:44:37โฏPM] ~โฏSalman Alameer: ุงูุตุญ ุจ ูุฒูุงุชู ูุจููู
[17/03/2025, 5:47:36โฏPM] ~โฏLoai AlQadasi (LQAD): ูุงุชู ุงููู Sean ูุฐุง ููุจูุง ูุฑุชูู ูุฑุฉ ูู ุงูุชุฑู ุงูุฃูู ููุฑุฉ ูู ุงูุซุงูู ูุฐุง
[17/03/2025, 5:59:19โฏPM] ~โฏL: ู ุฏุฑุฌุงุช ูุดุฑุญ ููุฐุงุ
[17/03/2025, 6:01:54โฏPM] ~โฏA.: ุจุงูุฏุฑุฌุงุช ุฑุญ ุชุนุทูู ุญูู ุจุงูููู ูุนูู ุชุตุญุญ ุงูุงุฎุชุจุงุฑ ุชูุงูู ุฏุฑุฌุชู 12.75 ุนุงุฏู๐๐

ููู ูุดุฑุญ ูุงูู ุงูุถู ูููุง ุงุณุทูุฑูู ูุญุจูุจู โ<This message was edited>
[17/03/2025, 7:20:53โฏPM] ~โฏSalman Alameer: ุชุฑู
โ[17/03/2025, 7:23:45โฏPM] ~โฏUnkown: โ<attached: 00003562-PHOTO-2025-03-17-19-23-45.jpg>
[17/03/2025, 7:28:59โฏPM] ~โฏFarah~โข: ูุนูููู ุงูุณูุงู
ุฏูุชูุฑ ููุงุฏ ุฌุฏุง ูููุณ ูุงูุดุฑุญ ุงูุตุญ ุจูู
[17/03/2025, 7:29:25โฏPM] ~โฏUnkown: Section 02 ?
[17/03/2025, 7:32:02โฏPM] ~โฏFarah~โข: ุงู
[17/03/2025, 7:34:26โฏPM] ~โฏLeena: ูุฏุฑุฌุงุช ูุชุนุงูู seah ููุชุงุฒุฒ ุจุณ ุดุฑุญู ุนุงุฏู ุฌุฏุงู
[17/03/2025, 7:35:45โฏPM] ~โฏLeena: ุดุฑุญูุง ุณูุก ุฌุฏุง ูุชุนุงูููุง ุณูุก ููุงู
[17/03/2025, 7:40:56โฏPM] ~โฏูุงุฑุณ ุงูุณููู: ูุงุฐู  ุงูุชุจู ูุง ุชุฎุด ูุนุงูุงุ ุงููู ูููููุง ุงูุดุฑ
[17/03/2025, 7:41:29โฏPM] ~โฏูุงุฑุณ ุงูุณููู: ุชุนุงููุ ุฏุฑุฌุงุชุ ุดุฑุญ

ูู ุดู ุฒู ุงูุฒูุช
[17/03/2025, 7:43:53โฏPM] ~โฏAmr Qatab: ุฌุฒุงูู ุงููู ุฎูุฑ ูุงุดุจุงุจ
[17/03/2025, 7:44:01โฏPM] ~โฏAmr Qatab: ุจุณ ููู ุงุบูุฑ ุณูุดู ูุงููููุน ูุนุทู
[17/03/2025, 7:44:08โฏPM] ~โฏAmr Qatab: ุงุฑูุญ ููููุชุจ ุญููู ุงู ุงูุชุธุฑ
[17/03/2025, 7:46:44โฏPM] ~โฏAmr Qatab: ูุงูู ุงูู ุณูุณุชุฑ ูุณุฌูููู ูู ๐๐๐
[17/03/2025, 7:47:16โฏPM] ~โฏAmr Qatab: ููุง ุงููู ููู ุงูุณูุดู ุงููุญูุฏ  ุงููุงุงุถู ๐
[17/03/2025, 7:49:34โฏPM] ~โฏLoai AlQadasi (LQAD): ุฃูุง ุฑุญุช ููู ุงูููู ูุงููุง ูุง ููุฏุฑ ุฅูุง ูุถูู ูุงุฏุฉ ุจุณ 


ูุง ููุฏุฑ ูุบูุฑ ููุง ุดูุก
[17/03/2025, 7:50:01โฏPM] ~โฏAmr Qatab: ุงุญูู 
ุฑุญูุง ูููุง ูุนูู ๐
[17/03/2025, 7:50:02โฏPM] ~โฏLoai AlQadasi (LQAD): ูุงุฒู  ูููู ููู 20
[17/03/2025, 7:50:07โฏPM] ~โฏLoai AlQadasi (LQAD): ูุงูุฌูุงู ูุนูู
[17/03/2025, 7:50:21โฏPM] ~โฏAmr Qatab: ุทูุจ ูู ูุฌุงู ูุบูุฑ
[17/03/2025, 7:50:26โฏPM] ~โฏ๐: ูุด ุฐุง ุ
[17/03/2025, 7:50:27โฏPM] ~โฏLoai AlQadasi (LQAD): ูุง ูุจููุง ููุฌุญ ููุฐุง ูุฐุง ุขูููู ููุง
[17/03/2025, 7:50:37โฏPM] ~โฏ๐: ุงู ุจุงููู ุงููุฏููุง
[17/03/2025, 7:50:37โฏPM] ~โฏLoai AlQadasi (LQAD): ุชุบูุฑ ูุงุฏุฉ ูุนููุ
[17/03/2025, 7:50:38โฏPM] ~โฏmotu: ููุง ูุงููู ูุง ุญุจูุจู. ุงู amendment ููุฑูุถ ููุชุญ ุจูุฑุง. ูู ูุง ูุชุญ ุจูุฑุง ูููููุง ููุชุญ ููู 20 

ุงูุตุญ ุญุงููุง ุชุดูู ูู ูู ููุงุฏ ุธุงููุฉ ูู ุจุนุถูุง ู ูุคุซุฑุฉ ูู ุงูุฌุฏูู ู ุงุญูุธูุง ุนุดุงู ุชุบูุฑูุง ุจุนุฏูู

ุงุจุนุฏ ุซู ุงุจุนุฏ ุซู ุงุจุนุฏ ูู Aryati ๐๐

ุงููู ููููู โ<This message was edited>
[17/03/2025, 7:50:46โฏPM] ~โฏAmr Qatab: ุงูุณูุดู
[17/03/2025, 7:51:07โฏPM] ~โฏLoai AlQadasi (LQAD): ูุง ุชูุฏุฑ ุฅูุง ููู ููุชุญ ุงูamendment
[17/03/2025, 7:51:23โฏPM] ~โฏLoai AlQadasi (LQAD): ุฃูุง ุฑุญุช ููู ุงูููู ูุง ูุงุฏููู
[17/03/2025, 7:51:41โฏPM] ~โฏAmr Qatab: ุงููู ูุทููู ๐๐ซ 

ุงูููู ูู ูุฌุงู ูุบูุฑ 
ููุง ุจุบูุฑ ุงูุฌุงูุนู ุจุนุฏูู ๐
[17/03/2025, 7:52:09โฏPM] ~โฏBasil Abdalla Elsadig Ali: Aryati ุชุฏุฑุณ ุฃู ูุงุฏุฉุ
โ[17/03/2025, 7:52:11โฏPM] ~โฏAmr Qatab: โ<attached: 00003590-PHOTO-2025-03-17-19-52-11.jpg>
[17/03/2025, 7:52:35โฏPM] ~โฏAmr Qatab: System analyisis and design
[17/03/2025, 7:52:47โฏPM] Hamdan Saleh: ุงุฐุง ุชุดุชู A ุฑูุญ ูุนุงูุง
[17/03/2025, 7:53:18โฏPM] ~โฏLoai AlQadasi (LQAD): ูููุง ูุดุชู A ูุง ุนููุง 

ูุนูู ูุชููู
[17/03/2025, 7:53:21โฏPM] Hamdan Saleh: ุจุณ ูู ุงุณุจูุน ูููุฒ ุจุชุฏูุฎ ุจู
[17/03/2025, 7:53:37โฏPM] ~โฏLoai AlQadasi (LQAD): ูุด ูุดููุฉ ุจุฅุฐู ุงููู ุชุณูู ูุง ุบุงูู
[17/03/2025, 7:54:40โฏPM] ~โฏmotu: ุชุชุณูู. ูููุฒุงุช ุงุฑุญู ูู ุงุณุงูููุชุงุช ุซูููุฉ
[17/03/2025, 7:57:00โฏPM] ~โฏูุงุฑุณ ุงูุณููู: ูุงุฐุง ุชุณุฌูู ูุฏููุ ุชุณุฌู ุงูููุงุฏ ุงูู ุชุฑูุฏูุง ูุน ุงูุณูุงุดู ุงูู ุชุฑูุฏู ู ุชุนุทู ุงููุฑูู ูู Academic office ูุงุฐุง ูู ุญุงูู ุงูู ุงููููุน ูุนุทู ุงู ุนูุฏู ูุดุงูู ุจStudent portal.
[17/03/2025, 7:57:37โฏPM] Hamdan Saleh: ุงู ูุงุฏูุ
[17/03/2025, 7:57:58โฏPM] ~โฏAmr Qatab: System analyisis and design
[17/03/2025, 7:58:16โฏPM] ~โฏAmr Qatab: ุทูุจ ุชููู ููุจูู ุงูุงู ูู ุงุฑูุญ ููู ุงูููู
[17/03/2025, 7:58:37โฏPM] ~โฏ๐: ูุนุทูู ุงูุนุงููุฉ ูุดููุฑ ูุนูู ุงูุฏุฑ ุงุณุชุนูููุง ุงุฐุง ูุงูุช ุงูุณูุงุดู ูู ุ
[17/03/2025, 7:59:37โฏPM] ~โฏูุงุฑุณ ุงูุณููู: ุงููุฏ ุจุณ ุงุฐุง ุฑุถูุ ูุงุฒู ุชููุนูู ุงูู ุชุญุชุงุฌ ุชุฎุด ุงูุณูุดูุ ุงูุถู ุงูู ุชููู ุฑูุญุงูู ุชุณูู increase capacity
[17/03/2025, 7:59:55โฏPM] ~โฏ๐: ูููู ุฑูููุง ุงู ุงูููููุง
[17/03/2025, 8:01:01โฏPM] ~โฏAmr Qatab: ุทูุจ ูุงุฐุง ุงูุณูุดู ูู ูู ูุญุชุงุฌ ุงููุงุน ๐
[17/03/2025, 8:01:40โฏPM] ~โฏOTP: ูุญุชุงุฌ ุจูุงู ูุงุฌูู๐คฃ๐คฃ๐คฃ๐คฃ
[17/03/2025, 8:03:58โฏPM] ~โฏูุงุฑุณ ุงูุณููู: https://t.me/ugfcutm

ุฐุง ุฑุงุจุท ุงููุฑูุจ ุชููููุฑุงู ููุฏูู ุชุดุฑุญ ูุดููุชู ุจููุฑูุจ ู ูู ุชุดูู ููู
[17/03/2025, 8:05:33โฏPM] ~โฏูุงุฑุณ ุงูุณููู: ุทูุงูู ุจ ูุณุฌููู
[17/03/2025, 8:15:29โฏPM] ~โฏLoai AlQadasi (LQAD): Human Computer Interaction

ุงููุงุฏุฉ ูุฐู ูููุง ูุงููุงู ููุง ูุงุ
[17/03/2025, 8:16:19โฏPM] ~โฏOmar: ุงููู
[17/03/2025, 8:22:53โฏPM] ~โฏ๐ธSHIMAA SALAH ๐ธ: ุงูุณูุงู ุนูููู
Dr. Norsham binti Idris ููู ุงูุฏูุชูุฑุฉ ุฏู
[17/03/2025, 8:45:16โฏPM] ~โฏ๐๐๐๐๐ โโถโโพ: โThis message was deleted.
โ[17/03/2025, 9:20:59โฏPM] ~โฏ๐: โ<attached: 00003612-PHOTO-2025-03-17-21-20-59.jpg>
[17/03/2025, 10:28:43โฏPM] ~โฏุฒููุจ: ุงูุณูุงู ุนูููู
ุงูE-learning ููุง UTM Smart ูุง ูุธูุฑูู ูููู ููุงุฏู ุงููุณุฌูุฉ. ูู ุนุงุฏู ููุง ูุงุฒู ุฃุณูู ุฅุฌุฑุงุก ูุนููุ
[17/03/2025, 11:00:43โฏPM] ~โฏ๐: ูุง ุงุฏุฑู ูุงููู ุงูุง ุชููู ุฏุงุฎู ุงู e learning ูููุงุฏู ูุณุฌูุฉ
[17/03/2025, 11:05:19โฏPM] ุฃุณุงูุฉ ุงูุญุณุงู ูุงููุฏูุดู: ูุงุฏุฉ ุงูุดุ
[17/03/2025, 11:29:24โฏPM] Majoody: ุงุฎูุงูู ูู ุจูุฒู ูุงุฏุฉ ูุงูู ุนูููุง pre request 
ูุตูุฑ ุงูุฒู ุงููุงุฏุฉ ูุงูุจุฑู ุฑูููุณุช ุญููุง ุจููุณ ุงูุณูุณุชุฑ ุ
[18/03/2025, 12:29:40โฏAM] ~โฏ.: 1 ุจุชุฏุฎู ููุง 
https://elearnppi.utmspace.edu.my/
2 ุงุถุบุท login
ุจุชูุชุจ 
matric no ููู
ุชุญุช 
ISID no
ุงููุนูููุงุช ุฐู ุจุชูุงูููุง ูู ุงูุงูููู โ<This message was edited>
[18/03/2025, 12:30:28โฏAM] ~โฏ.: ูุฐุง ูู ุงูุช ุจุฑุฏุฌ
[18/03/2025, 12:30:41โฏAM] ~โฏBasil Abdalla Elsadig Ali: ูู ูุง ุงุดุชุบู ุฌุฑุจ ุชุฏุฎู ุงู UTM ID ุจุฏู ุฑูู ุงููุงุชุฑู
[18/03/2025, 12:44:26โฏAM] ~โฏMohaned: ุนุงุฏู ูุตูุฑ ุ ูู ูุงุญุฏ ุนูููุง ู ุงูุงุฏููุฒุฑ ุญูู ูุงู ููุงูู ู ุญุชู ุงูacademic office ูุง ููููู
[18/03/2025, 3:02:57โฏAM] ~โฏAmmar Mostafa: ููุง ุงูุงููุฏููุช ูุชุญุช ูุง ุดุจุงุจุ
[18/03/2025, 3:03:20โฏAM] ~โฏMohannad Jebril: ููู ูขู
[18/03/2025, 3:03:43โฏAM] ~โฏAmmar Mostafa: ุงูุง ุชุณูู ูุง ุบุงูู
โ[18/03/2025, 3:29:26โฏAM] ~โฏFarah~โข: โ<attached: 00003624-PHOTO-2025-03-18-03-29-26.jpg>
[18/03/2025, 3:29:54โฏAM] ~โฏFarah~โข: ูู ูุงุญูุฉ ุงููุนุงููุฉุ
[18/03/2025, 3:33:26โฏAM] ~โฏHamza: ุงูุณูุงู ุนูููู ู ุฑุญูุฉ ุงูููุ
ุงุญุฏ ุนูุฏู ุฑูู Dr. Enick Norizam Bin Katmonุ
[18/03/2025, 3:43:22โฏAM] ~โฏูุงุฑุณ ุงูุณููู: ูุงุนูุงู ุญุชู ุงุบูุฑ ุงูุณูุดู  ูุงุฒู ุงุญุถุฑ ุงูููุงุณุงุช ุชุจุน ุงูุณูุดู ุงูู ุงุฑูุฏ ุงุฏุฎูู ููุง ุนุงุฏู ููุชุถุฑููุ
[18/03/2025, 3:45:39โฏAM] ~โฏMohamad Noureddine: ูุงุ ุจุชุญุถุฑ ููุงุณุงุช ุงูุณูุดู ุงููู ุงูุช ููู ุญุงููุงุ ุจุณ ุจุชูุฏุฑ ุชุณุชุฃุฐู ูู ุงูุฏูุชูุฑ ูุชุญุถุฑ ูุนุงู ุจุณูุดู ุชุงูู โ<This message was edited>
[18/03/2025, 3:46:37โฏAM] ~โฏูุงุฑุณ ุงูุณููู: rizam@utm.my
ูุงุนูุฏู ุฑููู ุจุณ ุฐุง ุงููููู
[18/03/2025, 4:04:06โฏAM] Nouredin: ูููุง ูุงููุงู ุจูฃู ุฏุฑุฌุฉ ุจุณ ูููุด ุชูุณุช ุฃู ูููุฒุงุชุ ูููุง ูุดุงุฑูุน
[18/03/2025, 7:03:23โฏAM] ~โฏAbdullah Alyafei: โ~โฏAbdullah Alyafei joined from the community
โ[18/03/2025, 7:04:34โฏAM] ~โฏAbdullah Alyafei: โ<attached: 00003632-PHOTO-2025-03-18-07-04-34.jpg>
[18/03/2025, 7:10:58โฏAM] ~โฏAli Alrekaby: ูุจ
[18/03/2025, 7:11:04โฏAM] ~โฏAli Alrekaby: ูุฐุง supervisor ุญูู
[18/03/2025, 7:11:15โฏAM] ~โฏAli Alrekaby: ุชุนุงู ุฎุงุต
[18/03/2025, 8:45:30โฏAM] ~โฏูููุฏ: *ุจุณู ุงููู ุงูุฑุญูู ุงูุฑุญูู* 

 *ุงูุณูุงู ุนูููู ูุฑุญูุฉ ุงููู ูุจุฑูุงุชู* ุ 

ูุณุฑูุง ุฏุนูุชูู ููุงูุถูุงู ุฅูู 

 *YSAG GROUPS* 

ููู ููุตุฉ ูููุฒุฉ ุชุฌูุน ุงูุทูุงุจ ูุงูููุชููู ูู ูุฎุชูู ุงูุชุฎุตุตุงุช ุงูุฃูุงุฏูููุฉ ูุงูููููุฉ.  

ูุถู ูุฐุง *ุงููุฌุชูุน* ูุฌููุนุงุช ูุชุฎุตุตุฉ ุชุชูุญ ููู ูุฑุตุฉ ุงูุชูุงุตู ูุงูุงุณุชูุงุฏุฉ ูู ุชุฌุงุฑุจ ุงูุขุฎุฑูู ูู ุงููุฌุงูุงุช ุงูุชุงููุฉ:
  

- ุงูุจุฑุฏุฌูู 

- ุงูุจุฑุฏุฌูู - ( *ูุฌูุชุน ูุณุงุฆู* )

- ุงูููุฏุณุฉ ุงูููุฑุจุงุฆูุฉ

- *ุงูููุฏุณุฉ ุงูููููุงุฆูุฉ* 

- ุงูููุฏุณุฉ ุงููููุงููููุฉ 
 
- ููุฏุณุฉ ุงูุญุงุณุจ

- ููุฏุณุฉ ุงูุจุชุฑูู  

- ุฅุฏุงุฑุฉ ุงูุฃุนูุงู (Business Management)  

- ุจุงูุฅุถุงูุฉ ุฅูู ูุฌููุนุฉ ูุฎุตุตุฉ ูุทูุงุจ ุงููุงุฌุณุชูุฑ ูุงูุฏูุชูุฑุงู (PhD & Master Students).  


ูุฏููุง ูู ุจูุงุก ูุฌุชูุน ุฃูุงุฏููู ููููู ูุชูุงูู ูุนุฒุฒ ูู ูุฑุต ุงูุชุนูู ูุงูุชุนุงูู.  


๐ก ุฅุฐุง ููุช ููุชูุงู/ููุชูุฉ ุจุงูุงูุถูุงู ุฅูู ูุฐุง ุงููุฌุชูุน ุงููููุฒุ *ูุฑุฌู ุงูุถุบุท ุนูู ุงูุฑุงุจุท* :

https://chat.whatsapp.com/Hj0GOae55iu4q2ejEilFy2


ูุณุนุฏ ุจุงูุถูุงููู ููููู ูุนูุง ุฌุฒุกูุง ูู ูุฐุง ุงููุฌุงุญ ุงููุดุชุฑู.  

 *YSAG* 
 *ISS-YEMEN*
โ[18/03/2025, 10:06:49โฏAM] ~โฏูููุฏ: โ<attached: 00003637-PHOTO-2025-03-18-10-06-49.jpg>
[18/03/2025, 1:49:46โฏPM] ~โฏMoath_Mo.dev: ุดุจุงุจ ูุงูู ุดูุก ูุดูุน ูุฏูุชูุฑู ุนุฏููู ุ ุจุฎุด ูุนุงูุง
[18/03/2025, 1:52:34โฏPM] ~โฏใ โโข โกฬฌฬฉฬะดฮฒฦกวชฦกฤยฒยบยนยณ: ุนุฏููู ุฌุงูู ูู ุงูุนุฏู ูุนูู ุญุชุฏูู ุญููู
[18/03/2025, 1:53:19โฏPM] ~โฏMoath_Mo.dev: ูุณูุงู ูุจู ุฏุงูู โ<This message was edited>
[18/03/2025, 1:53:27โฏPM] ~โฏMohamad Noureddine: ูููู ูุนูู ุฏุฎูุช ูุนูุง ูุงุฏุฉ software engineeringุ ููุงูุงูุฉ ูุงููุฉ ุงููุงุฏุฉ ุงูุซุฑ ูู ุบูุฑูุง ุจุณ ูุฑูุชูุง ุจุงูุจุฑูุฌููุช ูุฑู ูุงุชููุน ูู ุงูุง ูุด ุบูุทุงู ุงููุง ุฒูุฏุชูู ุจุงูุนูุงูุงุช ูุงูู ุฌุจุช -B ูููุช ูุชููุน ุงุฑุณุจุ ุจุณ ูููู ูุงูู ููุช ุงุดููููุง ูุซูุฑ ๐
[18/03/2025, 1:55:20โฏPM] ~โฏMoath_Mo.dev: ุงุฏููู ููุงู ุจูุฒูุชู ุจุณ ูู ุฏูู ุดุทุฉ
[18/03/2025, 1:55:36โฏPM] ~โฏMoath_Mo.dev: ุฌุฏููู ุฒุงุจุท ูุนุงูุง
[18/03/2025, 1:56:58โฏPM] ~โฏMoath_Mo.dev: ุชุฒูุฏ ูุนูู ููุงู ุฌููู
[18/03/2025, 5:54:35โฏPM] ~โฏฮKI: ุงูุณูุงู ุนูููู ูุฑุญูุฉ ุงููู ูุจุฑูุงุชู
 ูุฎูุงู ูุงุฏุฉ network communication 
ููู ุงูุถูุ
Ts. Ms. Hazinah binti Kutty Mammi (P)
ููุง 
Dr Adnan Khalid
[18/03/2025, 9:14:51โฏPM] ~โฏุฒููุจ: ุงูุณูุงู ุนูููู.
[18/03/2025, 9:16:01โฏPM] ~โฏุฒููุจ: ููู ูุนุฑู ุงูุฃููุณ ุญู ุงูุฏูุชูุฑุฉ Aida Nurul ุงููุณุคููุฉ ุนู ุชุณุฌูู ุงูููุงุฏุ โ<This message was edited>
[18/03/2025, 9:17:18โฏPM] ~โฏุฒููุจ: Nurul Aida Binti Junaidi
[18/03/2025, 11:38:36โฏPM] ~โฏูุญูุฏ: ูุนุฑู ุงูุซุงูู 
ุจุณ ุญุฒููู ุงูุตุฑุงุญู ุดุฏูุฏู ูู ุงูู ูู ูุฒุจูุท ูุนุงูุง ููู ูู ุงูู ุดุงุฏ ุญููู ููุฒุจุท ุงููุฑู ูุนุชุจุฑ ูููุณู ูุงููู

ููู ูุงุญูู ุดุฑุญ ููู ุงูุงูุถู โ<This message was edited>
[19/03/2025, 1:35:05โฏAM] ~โฏูููุฏ: ุงูุณูุงู ุนูููู ูุฑุญูุฉ ุงููู ูุจุฑูุงุชู ..

ุตุจุงุญ ุงูุฎูุฑ..

ุฃุญุฏ ูุนุฑู ุฑูู ููุชุจ ุงูุฏูุชูุฑ ุฒุงูุฏ (ุงูุฌููุฒู) ุ
[19/03/2025, 1:56:08โฏAM] Hamdan Saleh: ุงูู ูุฏุฑุณ uhlb3132? โ<This message was edited>
[19/03/2025, 1:59:16โฏAM] ~โฏูููุฏ: ูุนู
[19/03/2025, 1:59:29โฏAM] Hamdan Saleh: ูุนุงู ุฑููู
[19/03/2025, 2:08:08โฏAM] ~โฏูููุฏ: ุฌููู
[19/03/2025, 2:09:07โฏAM] ~โฏูููุฏ: ุงุฑุณูู ุงููู ูุญูุธู
[19/03/2025, 2:23:42โฏAM] ~โฏmaria: ููู ุงุญุณู ูู network communication 
dr adnan or danlami ? โ<This message was edited>
[19/03/2025, 2:24:00โฏAM] Hamdan Saleh: Danlami?
โ[19/03/2025, 2:24:38โฏAM] ~โฏmaria: โ<attached: 00003658-PHOTO-2025-03-19-02-24-38.jpg>
[19/03/2025, 2:24:43โฏAM] ~โฏmaria: ูู ุงูุดุฑุญ
[19/03/2025, 2:33:42โฏAM] Majoody: ุงุฎูุงูู ุนุฏููุฉ ุณูุฆุฉ ูุฐูู ุงูุฏุฑุฌุฉุ
[19/03/2025, 2:40:13โฏAM] ~โฏFarah~โข: ู ุงููุนุงููุฉ ูููู ุงู ูุงุญุฏ ุชูุตุญู ูููุ
[19/03/2025, 2:40:55โฏAM] ~โฏAli Elber: ุงูุดุจุงุจ ุงุญุฏ ุนูุฏู ูุฑูุฉ ุงู amendment ุชููู scanned doc
[19/03/2025, 2:41:33โฏAM] ~โฏFarah~โข: ูู ูุงุฒู ูุฑูู ุงู ููุฑู ูู ููุนูู ุงูููุฏูููุช
[19/03/2025, 2:41:35โฏAM] ~โฏFarah~โข: ุ
[19/03/2025, 2:41:57โฏAM] ~โฏAli Elber: ุจุณ ูุญุชุงุฌู ูุด ุงูุซุฑ ุจุณ ุบุงูุจุง ูุฃ
[19/03/2025, 2:43:32โฏAM] ~โฏFarah~โข: ุงููู ูุฑุถู ุนูููู
ูููู ุญุฏ ููููู ุงู ูุงุญุฏ ูููู ุงุญุณู
โ[19/03/2025, 3:06:51โฏAM] ~โฏโฆ: โ<attached: 00003667-PHOTO-2025-03-19-03-06-51.jpg>
[19/03/2025, 3:39:47โฏAM] ~โฏูุญููุฏ: โ~โฏูุญููุฏ joined from the community
[19/03/2025, 3:42:38โฏAM] ~โฏูุญููุฏ: ุงูุณูุงู ุนูููู ูุฑุญูุฉ ุงููู ูุจุฑูุงุชู 
Does anyone know who teaches IT PROJECT MANAGEMENT ? 
I need his contact (mail, number...)
[19/03/2025, 3:43:20โฏAM] ~โฏYusufZain: ุงูุงู ูุงุนุฏ ุงุฎุฏ ูุนุงูุง malay
[19/03/2025, 3:43:26โฏAM] ~โฏYusufZain: ุงูู ุงูุงู ุดุงูููุง ูููุณุฉ
[19/03/2025, 3:43:40โฏAM] ~โฏNaif: 1+
[19/03/2025, 3:51:18โฏAM] Hamdan Saleh: ูุฐูู ุฌุฏุฏ ุงุนุชูุฏ
[19/03/2025, 3:59:42โฏAM] ~โฏMohamed Abdelgawwd: ุงูุณูุงู ุนูููู ูุฑุญูุฉ ุงููู ูุจุฑูุงุชู 
ูููู ุงู ุดุฎุต ูุจุนุช ูู ุฌุฑูุจ  ุงูููุณูุฉ (ULRS1022) ุณููุดู 16
[19/03/2025, 3:59:58โฏAM] ~โฏYusufZain: ูุงููู ุดูููุง ุฌุฏูุฏุฉ ุตุญ
โ[19/03/2025, 4:08:48โฏAM] ~โฏL: โ<attached: 00003676-PHOTO-2025-03-19-04-08-48.jpg>
[19/03/2025, 4:33:06โฏAM] ~โฏMohaned: ูุนูููู ุงูุณูุงู 
Aida ุงู pang
[19/03/2025, 4:37:11โฏAM] ~โฏL: Nur Zuraifa ููุง Sarina ุงูุด ูุถุนููุ
[19/03/2025, 4:37:24โฏAM] ~โฏL: ูุงูู ุงุฎุฐุช ูุน pang ููุงู ูุด ูุซูุฑ ูููุณ
[19/03/2025, 4:38:52โฏAM] ~โฏFarah~โข: ุงูุณูุงู ุนูููู 
ูุง ุฌูุงุนุฉ ุนู ูู ุญุฏ ุนูุฏู ุฑูู ุฏูุชูุฑุฉ lzyan
[19/03/2025, 4:38:59โฏAM] ~โฏAli Elber: sarina ุฏุฑุฌุงุชูุง ูููุณุฉ ุฌุฏุง ู ุชูููููุง ููproject
[19/03/2025, 4:39:27โฏAM] ~โฏAli Elber: ูููู ูุจุชุดุฑุญุด ู ุดุฑุญูุง ููู ูุณุฌู
โ[19/03/2025, 5:06:28โฏAM] ~โฏAhmat: โ<attached: 00003683-PHOTO-2025-03-19-05-06-28.jpg>
[19/03/2025, 5:21:42โฏAM] ~โฏูุงุฑุณ ุงูุณููู: https://drive.google.com/open?id=12RsF6SFoXfkuURC6xszaJUdJecWkWv1R

ุบุงูุจุง ุฑุงุญ ุชุญุตููุง ุฌูุง ุงูุฏุฑุงูู
[19/03/2025, 8:14:19โฏAM] ~โฏใ โโข โกฬฌฬฉฬะดฮฒฦกวชฦกฤยฒยบยนยณ: ุณูุงู ุนูููู
[19/03/2025, 8:15:06โฏAM] ~โฏใ โโข โกฬฌฬฉฬะดฮฒฦกวชฦกฤยฒยบยนยณ: ูู ุทุฑููุฉ ุงุทูุน  ุงูุชุงูู ุชูุจู  ููุฏูุงุชุฑู
[19/03/2025, 8:15:49โฏAM] ~โฏMohaned: ูุนูููู ุงูุณูุงู
[19/03/2025, 8:16:25โฏAM] ~โฏMohaned: ูุตุฏู ุชุดูู ุฌุฏูู ุงูุฏูุชูุฑ ุ
[19/03/2025, 8:16:55โฏAM] ~โฏใ โโข โกฬฌฬฉฬะดฮฒฦกวชฦกฤยฒยบยนยณ: ูุจ
[19/03/2025, 8:19:36โฏAM] ~โฏMohaned: ุงูู ุจุนุฑูู ูุง ููู ูููู ุงุญุฏ ูู ุงูุฌุฑูุจ ููุฏุฑ ูููุฏู
[19/03/2025, 9:50:27โฏAM] ~โฏใ โโข โกฬฌฬฉฬะดฮฒฦกวชฦกฤยฒยบยนยณ: ุดุจุงุจ ูุตูุญุชูู ูุฏูุชูุฑ ูููุณ ุงุฎุฐ ูุนู fyp
[19/03/2025, 10:00:07โฏAM] ~โฏYusufZain: ุงูุง ุดูุช ูุงุณ ูุซูุฑูู ุฏุฎูู ูุน luqman
[19/03/2025, 10:14:48โฏAM] ~โฏRami Mohamed: ูููุงู ุฏุฑุฌุงุชู ูููุณู ุจุณ ุดุฑุญู ุนุงุฏู ุงู ุงูู
[19/03/2025, 10:15:23โฏAM] ~โฏYusufZain: ูุงูู ุดู ุงุณูู ุดุฑุญ ูู FYP
[19/03/2025, 10:15:34โฏAM] ~โฏAli Alrekaby: ุงูุฏูุชูุฑ ููุงู ุฌุฏูุฏ
[19/03/2025, 10:16:11โฏAM] ~โฏRami Mohamed: ูุงุดูุช ุงูุฑุณุงูู ุงููุฏููู ูุชุฃุณู
[19/03/2025, 10:16:23โฏAM] ~โฏYusufZain: ูุงู ูุดููุฉ
[19/03/2025, 10:16:27โฏAM] ~โฏAli Alrekaby: ุงููู ูุจุงุฑู ูู ุนูู ุณูุนุฉ ุงููููุณุฉ ุงูุนูููุง ุจุณุฑุนุฉ ุฏู
[19/03/2025, 10:17:14โฏAM] ~โฏAli Alrekaby: ุงูุง ูุง ุงูุฏุฑ ุงุฎุชุงุฑู ูู ูุดุฑูุน ุงูุชุฎุฑุฌ ููููุน๐ฅฒ
[19/03/2025, 10:17:54โฏAM] ~โฏใ โโข โกฬฌฬฉฬะดฮฒฦกวชฦกฤยฒยบยนยณ: ุฏุญูู ููุช ุนูุฏู ููู ุงูุง ูู ๐ฅฒ
[19/03/2025, 11:55:23โฏAM] ~โฏMoath_Mo.dev: ุฎุฐ ูุน ุงู ุฏูุชูุฑ ุทูุจ ูุงุชุฏูุฑ ุน ุงูู ูุงูู ูุงูู ูุญุฏ ุญูุณุงุนุฏู
[19/03/2025, 6:27:52โฏPM] ~โฏHebaโจ: ุงูุณูุงู ุนูููู
[19/03/2025, 6:28:00โฏPM] ~โฏHebaโจ: ุนุงูุฒุฉ ุฑูู ุฏูุชูุฑุฉ izyan
โ[19/03/2025, 7:03:47โฏPM] ~โฏRami: โ<attached: 00003704-PHOTO-2025-03-19-19-03-47.jpg>
[19/03/2025, 7:05:42โฏPM] ~โฏAbdullah Alyafei: ุฌูุฏู
[19/03/2025, 7:05:47โฏPM] ~โฏAbdullah Alyafei: ุนุทุชูุง A
[19/03/2025, 7:06:12โฏPM] ~โฏAbdullah Alyafei: ูุนูููู ุงูุณูุงู ูุฑุญูุฉ ุงููู ูุจุฑูุงุชู
[19/03/2025, 7:13:07โฏPM] ~โฏHebaโจ: ุฑูู ุฏูุชูุฑุฉ shahliza ุจุฑุถู ุงู ุงููู
[19/03/2025, 7:16:02โฏPM] ~โฏAbdullah: +60 13-721 1990
[19/03/2025, 7:16:22โฏPM] ~โฏHebaโจ: ุดูุฑุง
[19/03/2025, 9:39:02โฏPM] ~โฏLoai AlQadasi (LQAD): ุงูุณูุงู ุนูููู ูุง ุดุจุงุจุ ุจุงููู ูู ุญุฏ ุนุงุฑู ููู ูุณููู ุงู amendment 

ูุงุนุฏ ูุทูุน ูู ููุงุฏ ุงูุชุฑู ุงูุฃูู ูู ูุฐุง ุงูุชุฑู
[19/03/2025, 9:39:12โฏPM] ~โฏLoai AlQadasi (LQAD): ุฅุฐุง ุฃุญุฏ ุนูุฏู ุนูู ุจุงููู ูููุฏูุง
[19/03/2025, 9:40:01โฏPM] ุฃุณุงูุฉ ุงูุญุณุงู ูุงููุฏูุดู: ูุณุง ุจููุชุญ ุงูุณุงุนุฉ 9 ุงูุตุจุญ
[19/03/2025, 9:40:04โฏPM] ุฃุณุงูุฉ ุงูุญุณุงู ูุงููุฏูุดู: ูุนูููู ุงูุณูุงู ูุฑุญูุฉ ุงููู ูุจุฑูุงุชู
[19/03/2025, 9:40:44โฏPM] ~โฏ๐: ูู ูุงุฒู ููุงููู ูู ุงูุงุฏูุงูุฒุฑ ุญูู ููุง ูุง ุ
[19/03/2025, 9:40:57โฏPM] ~โฏL: ุงูุง ููุณ ุงูุดู
[19/03/2025, 9:40:58โฏPM] ุฃุณุงูุฉ ุงูุญุณุงู ูุงููุฏูุดู: ูุจ
[19/03/2025, 9:41:22โฏPM] ~โฏL: ูุนูู ุนูู ุงูุณุงุนุฉ ูฉ ุจููุชุญ ุงูAmendment ูุจูุฏุฑ ุงุนุฏู ููุชูุง ุตุญุ
[19/03/2025, 9:41:39โฏPM] ุฃุณุงูุฉ ุงูุญุณุงู ูุงููุฏูุดู: ุจุงูุถุจุท
[19/03/2025, 9:42:22โฏPM] ~โฏ๐: ูููู ุงุฎุฐ ููุงููุชูุง ุ
[19/03/2025, 9:43:01โฏPM] ุฃุณุงูุฉ ุงูุญุณุงู ูุงููุฏูุดู: ูู ูุณูู approval ูู ุงูุจูุฑุชุงู
[19/03/2025, 9:43:35โฏPM] ~โฏ๐: ูุนุทูู ุงูุนุงููู ูุงุชูุตุฑ
[19/03/2025, 9:43:46โฏPM] ุฃุณุงูุฉ ุงูุญุณุงู ูุงููุฏูุดู: ุงููู ูุนุงููู
[19/03/2025, 9:44:20โฏPM] ุฃุณุงูุฉ ุงูุญุณุงู ูุงููุฏูุดู: ุจุณ ูุงุฒู ุชูููู ุฅูู ุณููุช amendmentุ ูุฃูู ุจุนุถูู ูุง ูุฃุฎุฐ ุจุงูู
[19/03/2025, 9:46:48โฏPM] ~โฏ๐: ุจุงุฐู ุงููู ุดูุฑุง ูู
โ[19/03/2025, 10:17:12โฏPM] ~โฏฮKI: โ<attached: 00003726-PHOTO-2025-03-19-22-17-12.jpg>
[19/03/2025, 10:20:26โฏPM] ุฃุณุงูุฉ ุงูุญุณุงู ูุงููุฏูุดู: ูุนูููู ุงูุณูุงู ูุฑุญูุฉ ุงููู ูุจุฑูุงุชู 
ุฌุฑุจ ุฎุด ูู student portal
[19/03/2025, 11:31:00โฏPM] ~โฏฮKI: ููุณ ุงูุดุฆ ุจุฑุถู ูู ุดุบุงู ููุงุณู
โ[19/03/2025, 11:34:25โฏPM] ุฃุณุงูุฉ ุงูุญุณุงู ูุงููุฏูุดู: โ<attached: 00003729-STICKER-2025-03-19-23-34-25.webp>
[19/03/2025, 11:39:13โฏPM] ~โฏAmmar Abdulrahman: ูููู ุญูู ุงูAA ูุงูุจูุด
โ[19/03/2025, 11:40:12โฏPM] ~โฏฮKI: โ<attached: 00003731-PHOTO-2025-03-19-23-40-12.jpg>
[19/03/2025, 11:49:56โฏPM] ~โฏAmmar Abdulrahman: ุบุฑูุจุฉุ ุฑุณู ุงูููู ูุฑุณู ุงูุตูุฑุฉ ูุฏููู
[19/03/2025, 11:53:54โฏPM] ~โฏุงููุงุซู ุจุงููููฐู: ุฌุฑุจุช ุชุฏุฎู ูู ุงูุจูุฑุชุงู ุงูุตูุญุฉ ุงูุฑุฆูุณูุฉ ุจุนุฏูู profile
ูู ูููู ูููู ุนูุฏู ูุดููุฉ ุจุณุจุจ ุญุงููุง ูุชุฑุฉ ุงูุชุณุฌูู ูููู ุฎูุงู ุงูุงููุฏููุช ุชุตูุญ โ<This message was edited>
[20/03/2025, 12:38:54โฏAM] ~โฏฮKI: ุงุฑุณูู ู ุงู ุงูููู ุจุงูุถุจุท ูู ุนูุฏู ุจุงููู ุงุนุทููู ูู
[20/03/2025, 12:39:14โฏAM] ~โฏฮKI: ูุงูู ุทุงูุน ุจุฑุถู ุจุณ ุงู ุดุงุก ุงููู ูุชุนุฏู
[20/03/2025, 1:10:08โฏAM] ~โฏAmmar Abdulrahman: ุฑุณู ุนูู ูุฐุง nurulaida@utm.my ูุณูู cc ุนูู ูุฐุง sp-rohani@utm.my
[20/03/2025, 1:11:57โฏAM] ~โฏฮKI: ุดูุฑุง ูุนุทูู ุงูุนุงููุฉ
โ[20/03/2025, 1:14:51โฏAM] Hamdan Saleh: โ<attached: 00003738-STICKER-2025-03-20-01-14-51.webp>
[20/03/2025, 1:24:51โฏAM] ~โฏAmmar Abdulrahman: ุงููู ูุนุงููู
[20/03/2025, 3:11:15โฏAM] ~โฏmaria: ุฌูุงุนุฉ ุงุฒุงู ุงุฎูู ุงูููุงุฏ ุงููู ุธุงูุฑุฉ ูู ุงูุงููุฏููุช ููุงุฏ ุงูุชุฑู ุฏุฉุ ุฃูุง ุธุงูุฑูู ุชุจุน ุงูุชุฑู ุงููุงุช
[20/03/2025, 3:15:59โฏAM] ~โฏMohannad Jebril: ุนูู ุณุงุนุฉ ูฉ ุจูุชุนุฏู ุงูุณูุณุชู โ<This message was edited>
โ[20/03/2025, 3:16:29โฏAM] ุฃุณุงูุฉ ุงูุญุณุงู ูุงููุฏูุดู: โimage omitted
[20/03/2025, 3:26:43โฏAM] ~โฏLoai: Lol why all capital.

It's like they have a perfect system.

I couldn't do my registration until now because of their lovely system ๐
[20/03/2025, 3:28:38โฏAM] ~โฏOmar: ุงูุณูุงู ุนูููู
ุญุฏ ูุนุงู ุฑูู Dr. Noraini Binti Ibrahim
[20/03/2025, 3:31:07โฏAM] ุฃุณุงูุฉ ุงูุญุณุงู ูุงููุฏูุดู: 4 u 2 b more focused
[20/03/2025, 3:51:08โฏAM] ~โฏmaria: ูููู ุญุฏ ูุจุนุช ุฑูู ุฏูุชูุฑ mohamed shukor ุชุจุน probability and statistical data analysis
โ[20/03/2025, 3:52:17โฏAM] ~โฏHebaโจ: โ<attached: 00003747-Dr Shukor Talib.vcf>
[20/03/2025, 3:54:51โฏAM] Hamdan Saleh: ุดุจุงุจ ูููู ุงุฎุฑ ุชุงูู ุชูุจู
[20/03/2025, 3:59:57โฏAM] ~โฏKhalid: https://docs.google.com/spreadsheets/d/1PJcxNQU4TKjkFPpCKpI99cAf0Al1fP7CwQwsShHOrXk/htmlview
[20/03/2025, 4:01:47โฏAM] ~โฏmaria: ุฌูุงุนุฉ ุฃูุง ุงุฒุงู ุงุจุนุช proof ุงูู ุนูุฏู ููุงุดุ
[20/03/2025, 4:02:00โฏAM] ~โฏmaria: ุจุจุนุช ูู AA ุณูุฑูู ููุณูุงุดู ุงููู ุญุฌุฒุชูุงุ โ<This message was edited>
โ[20/03/2025, 4:03:45โฏAM] ~โฏAbdul: โ<attached: 00003752-PHOTO-2025-03-20-04-03-45.jpg>
[20/03/2025, 4:04:06โฏAM] Hamdan Saleh: ุงููุฏ ูุณุชุญูู ูุฏุฎูู
[20/03/2025, 4:04:12โฏAM] ~โฏFarah~โข: ุงููู ๐ญ๐ญ
[20/03/2025, 4:04:15โฏAM] ~โฏLeena: ูููุง
[20/03/2025, 4:04:16โฏAM] Hamdan Saleh: ูุฐุง ูุฏู ูุงุฒู ุงูุฎุจุฑ ุญููู
[20/03/2025, 4:04:22โฏAM] ~โฏ๐: ุงููู
[20/03/2025, 4:04:40โฏAM] ~โฏ๐: ุฌุงูุนุฉ ุชููููุฌูุง :
โ[20/03/2025, 4:04:49โฏAM] ~โฏOTP: โ<attached: 00003759-STICKER-2025-03-20-04-04-49.webp>
[20/03/2025, 4:05:15โฏAM] ~โฏุงููุงุซู ุจุงููููฐู: ูุง ุนุงุฏู ุทุจูุนู ุงููู ุฏุงุฎู ุงุตูุง ูููู ูุณูุญูู ุชุฏุฎู ุงูู ูุง ูุทูุน ูุงุญุฏ
[20/03/2025, 4:19:58โฏAM] ~โฏFarah~โข: ูุง ุฌูุงุนู ุงูุง ูุด ุทูุนูู ุงูsave
[20/03/2025, 4:20:20โฏAM] Nouredin: ููุณ ุงูุดูุก ุนูุฏู
[20/03/2025, 4:20:59โฏAM] ~โฏOTP: ููุด ูุจูู ุญุชู ุฒุฑ ุงูุชุนุฏูู ูุงูุญุฐู
[20/03/2025, 4:21:35โฏAM] ~โฏmaria: ุฃูุง ูุณุฉ ูุงูุชุญุด ูุนุงูุง
[20/03/2025, 4:22:55โฏAM] ~โฏOTP: ููุง ุงุญุฏ ูุงุฏุฑ ููุชุญ
[20/03/2025, 4:23:05โฏAM] ~โฏ๐๐๐๐๐ โโถโโพ: ุตุจุงุญ ุงูุฎูุฑุ

ูุง ุญุตูุช ุฎูุงุฑ ุงูAmendment ูู Student Portal
[20/03/2025, 4:23:31โฏAM] ~โฏ๐๐๐๐๐ โโถโโพ: ุญุฏ ุนูู ุฏุฑุงูุฉ ููู ูุนูู Amendment
[20/03/2025, 4:23:31โฏAM] ~โฏ๐: speak for yourself
[20/03/2025, 4:23:52โฏAM] ~โฏmaria: ููู ูุชุญ ูุนุงูุ
[20/03/2025, 4:23:59โฏAM] ~โฏ966554008374: ูุง
[20/03/2025, 4:24:09โฏAM] ~โฏOmar: ูุง
[20/03/2025, 4:24:10โฏAM] ~โฏ๐: ูุชุญ ูุนู
โ[20/03/2025, 4:24:17โฏAM] ~โฏOTP: โ<attached: 00003773-STICKER-2025-03-20-04-24-17.webp>
[20/03/2025, 4:25:05โฏAM] ~โฏOmer Haydar: ูู ููู ุจุงูุฒุจุทุ
[20/03/2025, 4:25:13โฏAM] ~โฏAbdul: ุดุจุงุจ ููู ุงูammendment
[20/03/2025, 4:25:18โฏAM] ~โฏAbdul: ุงูุง ุถุงูุน ุงูู
[20/03/2025, 4:25:30โฏAM] ~โฏ๐: utm portal
โ[20/03/2025, 4:25:38โฏAM] ~โฏูููุฏ: โ<attached: 00003778-PHOTO-2025-03-20-04-25-38.jpg>
[20/03/2025, 4:26:16โฏAM] ~โฏ๐: ุงูุง ูุชุญุชู ูู ุงูููุฑุณ ุฑูุฌุณุชุฑูุดู
โ[20/03/2025, 4:26:20โฏAM] ~โฏุงููุงุซู ุจุงููููฐู: โ<attached: 00003780-PHOTO-2025-03-20-04-26-20.jpg>
[20/03/2025, 4:26:30โฏAM] ~โฏ๐: ูุด ูู ุฎุงูู ุงูุงููุฏููุช
[20/03/2025, 4:26:51โฏAM] ~โฏFarah~โข: โThis message was deleted.
[20/03/2025, 4:28:00โฏAM] ~โฏFarah~โข: ุทูุจ ุงูุง ุจููุชุญ ุจุณ ูุด ูุฎูููู ุงุบูุฑ
[20/03/2025, 4:28:08โฏAM] ~โฏFarah~โข: ูุนูู ูุง ูู save
โ[20/03/2025, 4:28:54โฏAM] ~โฏ๐: โ<attached: 00003785-PHOTO-2025-03-20-04-28-54.jpg>
[20/03/2025, 4:29:10โฏAM] ~โฏAbdul: ููู ูุฐุงุ
[20/03/2025, 4:29:12โฏAM] ~โฏmaria: ููู ุจุงูุธุจุทุ
[20/03/2025, 4:29:23โฏAM] ~โฏTony~: Student portal
[20/03/2025, 4:29:32โฏAM] ~โฏุงููุงุซู ุจุงููููฐู: โThis message was deleted.
[20/03/2025, 4:29:38โฏAM] ~โฏ๐: Utm portal
[20/03/2025, 4:29:39โฏAM] ~โฏMohannad Jebril: ุดุจุงุจ ูุฐุง ุบูุท
[20/03/2025, 4:29:43โฏAM] ~โฏAbdul: ููู ุจุงูุธุจุท ูุงูู ูู ุงูstudent portal
[20/03/2025, 4:29:57โฏAM] ~โฏ๐: ูุงููู ุ
[20/03/2025, 4:30:00โฏAM] ~โฏTony~: Course registration 
Undergraduate
[20/03/2025, 4:30:03โฏAM] ~โฏMohannad Jebril: ุงููุฉ ุบูุท
โ[20/03/2025, 4:30:07โฏAM] ~โฏAbdul: โ<attached: 00003796-PHOTO-2025-03-20-04-30-07.jpg>
[20/03/2025, 4:30:15โฏAM] ~โฏTony~: Yep
[20/03/2025, 4:30:24โฏAM] ~โฏOmer Haydar: ุงูุตุญ ููู
[20/03/2025, 4:30:26โฏAM] ~โฏAbdul: ูุด ูุงุฏุฑ ุงุนุฏู ุดู ุงูุง
[20/03/2025, 4:30:32โฏAM] ~โฏ๐: ุทูุจ ููู ุ
โ[20/03/2025, 4:30:34โฏAM] ~โฏFarah~โข: โimage omitted
[20/03/2025, 4:30:41โฏAM] ~โฏTony~: ุงูุชุบูุฑ ูู ammendment
[20/03/2025, 4:30:47โฏAM] ~โฏTony~: ููุง
[20/03/2025, 4:30:55โฏAM] ~โฏTony~: Utm portal 
Ammendment
โ[20/03/2025, 4:30:58โฏAM] ~โฏAbdul: โ<attached: 00003805-PHOTO-2025-03-20-04-30-58.jpg>
[20/03/2025, 4:31:02โฏAM] ~โฏmaria: ููู ุงู amendment ุงูู ูู course registration ุ
[20/03/2025, 4:31:05โฏAM] ~โฏAbdulkader: You can't. Button is missing
[20/03/2025, 4:31:05โฏAM] ~โฏTony~: ูู ุงูุดูุงู
[20/03/2025, 4:31:14โฏAM] ~โฏTony~: ูุงูู ammendment ููุง
โ[20/03/2025, 4:31:16โฏAM] ~โฏMohannad Jebril: โ<attached: 00003810-VIDEO-2025-03-20-04-31-16.mp4>
[20/03/2025, 4:31:20โฏAM] ~โฏTony~: ุฏู ููุชุณุฌูู ุจุณ
[20/03/2025, 4:31:31โฏAM] ~โฏFarah~โข: ุงูุง
[20/03/2025, 4:31:48โฏAM] ~โฏTony~: ูุงุฎ ุงูุช ูุนูู
โ[20/03/2025, 4:31:49โฏAM] ~โฏ๐: โ<attached: 00003814-PHOTO-2025-03-20-04-31-49.jpg>
[20/03/2025, 4:31:55โฏAM] ~โฏOmar: ูู ูุชุญ ูุน ุญุฏุ
[20/03/2025, 4:31:57โฏAM] ~โฏTony~: ูุนูู
[20/03/2025, 4:32:00โฏAM] ~โฏTony~: ุงุตุจุฑ ุจุณ
[20/03/2025, 4:32:03โฏAM] ~โฏMohannad Jebril: ุงููุฉ ุนุดุงู ูู ุถุบุท ุจุฏู ุชุตุจุฑ
[20/03/2025, 4:32:04โฏAM] ~โฏAbdullah Alyafei: ูููุง
[20/03/2025, 4:32:12โฏAM] ~โฏ๐: ุงูุง
[20/03/2025, 4:32:13โฏAM] ~โฏTony~: ูุง ููุฑูุถ 
ูู ุฒูู ูุดุชูู
[20/03/2025, 4:35:14โฏAM] ~โฏAmar Hassan: ูุง ุดุจุงุจ ุฃูุง ุงุดุชุบู ูุนุงูุง
Student Portal - course reg - ug 
ุนุฏูุช ุณููุดู ูุณูุง save ูุญุงููุง ูุฃูู ุฏุฎูุช ุนูู utm smart ุญุตูุช ุงูุณููุดู ูุชุบูุฑุ ุงุชุฃูุฏูุง ุจุงููู
[20/03/2025, 4:35:54โฏAM] ~โฏ๐: ููุณ ุงูุดู ุนูุฏู ุงูุฏุฑ ุงุนุฏู ุงูุณูุดู ูู course reg
[20/03/2025, 4:36:16โฏAM] ~โฏmaria: ุงุฒุงูุ
[20/03/2025, 4:36:27โฏAM] ุฃุณุงูุฉ ุงูุญุณุงู ูุงููุฏูุดู: ุชุบูุฑ ูู ุงู registration slipุ
[20/03/2025, 4:36:33โฏAM] ~โฏmaria: ุฃูุง ูุชุญุช ุงู course reg ุจุณ ุงุฒุงู ุจุฑุฏู
โ[20/03/2025, 4:37:09โฏAM] ~โฏAmar Hassan: โ<attached: 00003827-PHOTO-2025-03-20-04-37-09.jpg>
[20/03/2025, 4:37:42โฏAM] ~โฏAbdul: ุชุณุฌู ูู ููุณ ุงููุงุฏู ูุฑู ุชุงููู ููุง ุงูุดุ
[20/03/2025, 4:38:03โฏAM] ~โฏAmar Hassan: ูุง ุบูุฑุช ุณููุดู
[20/03/2025, 4:38:17โฏAM] ~โฏAbdul: ุงูุง ูุง ุทุงูุน ูู
[20/03/2025, 4:38:24โฏAM] ~โฏAbdul: ุดูู ููุง
[20/03/2025, 4:38:32โฏAM] ~โฏFarah~โข: ุทูุจ ุงูุง ุนูุฏู ูุงูcourse regestration ูููุด save ูููุ
โ[20/03/2025, 4:38:38โฏAM] ~โฏAmar Hassan: โ<attached: 00003833-PHOTO-2025-03-20-04-38-38.jpg>
[20/03/2025, 4:38:53โฏAM] ~โฏAmar Hassan: ุดูู ุนูู utm smart ุฅุฐุง ุชุบูุฑ ุงูุณููุดู ููุง ูุง
[20/03/2025, 4:38:54โฏAM] ~โฏM7MD: ุฒูู
[20/03/2025, 4:41:35โฏAM] Hamdan Saleh: ุงูุด ูู ุงู ug?
[20/03/2025, 4:41:36โฏAM] ~โฏFarah~โข: ุฌูุงุนู ุฏูุชูุฑ MOHD RAZAK ูููุณ ูุงูadvanced programming
[20/03/2025, 4:41:47โฏAM] ~โฏM7MD: Undergraduate
[20/03/2025, 4:42:03โฏAM] ~โฏFarah~โข: ุุุ
[20/03/2025, 4:42:34โฏAM] Hamdan Saleh: ูู ููุฌูุฏ
[20/03/2025, 4:43:28โฏAM] ~โฏM7MD: ูู ูุซุฑ ูุง ุงููููุน ูุนูู ุฑุฌุนูู ุณูุณุชุฑ
[20/03/2025, 4:43:57โฏAM] ~โฏ.: ุตุฑุงุญู ุญููู ๐คฃ
โ[20/03/2025, 4:44:05โฏAM] ~โฏAbdul: โ<attached: 00003843-STICKER-2025-03-20-04-44-05.webp>
[20/03/2025, 4:44:08โฏAM] ~โฏAbdul: ุงููููุน ุญุงููุง
โ[20/03/2025, 4:44:53โฏAM] ~โฏ.: โ<attached: 00003845-STICKER-2025-03-20-04-44-53.webp>
[20/03/2025, 5:16:42โฏAM] ~โฏAbdulkader: ุฃูุง ูุฏููู ุณูุณุชุฑ
[20/03/2025, 5:17:00โฏAM] ~โฏAbdulkader: ุชููู ุงููููุน ุชูุชุญู ุชูุงูู ููุณู ุณููููุฑ
[20/03/2025, 5:17:11โฏAM] ~โฏ966554008374: ุฑููุจ ูุงููู
[20/03/2025, 5:20:51โฏAM] ~โฏ๐: Assalamualaikum and Good Day,

Dear staff and students,

Starting on 4th March 2025, all ICT complaints/requests/inquiries/suggestions/accolades must be made via the UTM Customer Support Portal: Sistem Pengurusan Aduan Awam (SISPAA) Universiti Teknologi Malaysia -  https://support.utm.my  and no longer using the email platform digitalcare@utm.my.

For first-time users, you will need to click "New Feedback" and complete the complaint/feedback information including the personal information โ IC No,

UTM official email: staff (@utm.my) or student (@graduate.utm.my). Then click "New Register" and enter your username & password.

When completing the complaint/feedback information form, please select the "ICT Services" Category and the relevant UTM system or infrastructure.

For assistance and inquiries related to the UTM Customer Support Portal, please get in touch with the secretariat - UTM Campus Connect Hub at 07-5333419 or email to campusconnect@utm.my

We kindly seek your cooperation in informing this matter to relevant parties.

Thank you.

 

Best regards,

DigitalCare, 
Digital Services Department (UTMDigital),
Universiti Teknologi Malaysia.
[20/03/2025, 5:20:59โฏAM] ~โฏ๐: ุงูุง ุญุทูู ูุงุฌุณุชูุฑ
[20/03/2025, 5:21:11โฏAM] ~โฏ๐: ูุง ุฌูุงุนุฉ ููู ุงุนุจู ุงูููุฑู ูุฐุง ุ
[20/03/2025, 5:21:27โฏAM] ~โฏ๐: ูุงูู ุชููู ุนุจูู ูุฏุฑูุด ููู ุงุบูุจู ุจุงููุงููุฒู
[20/03/2025, 5:22:01โฏAM] ~โฏูุงุฑุณ ุงูุณููู: ุงุฏุฎู ุนูู support.utm.my
ุงุฎุชุงุฑ ุงููุบุฉ ุงูุงูุฌููุฒูุฉ
ุจุนุฏูู ุงุฎุชุงุฑ New Feedback ูู ุฃุนูู ุงูุตูุญู
ุฑุงุญ ููุชุญ ูู ููุฑู ุชุนุจูู ุชุญุท ููู ูุดููุชู ูุจูุงูุงุชู ูููุน ุงููุดููู ูุชุนูู ุญูุธ ุฑุงุญ ูุนููู ูู ุญุงุฌู ุงุณููุง support ticket ููุตูู ุฑูููุง ููุงูููู ูุชูุฏุฑ ุชุนูููุง ูุชุงุจุนู track ูู ููุณ ุตูุญุฉ ุงู Support ุชุดูู ููู ุงู progress ูุญู ูุดููุชู
ุงูุง ุณููุชูุง ูุฑุชูู ูุฑู ุญูู ูุดููุชู ุณุฑูุน ููุฑู ุงุชุงุฎุฑู
ููู ุจุงููุณุจู ุงูู ุชุฑุณููู ููุงูููู ุฎูุงุต ูุงุนุงุฏ ูุฑุฏู ุนููู ูุงุฒู ุชุชุจุน ูุฐุง ุงููุทุงู
[20/03/2025, 5:22:13โฏAM] ~โฏAbdulkader: ูููุณุฌู ุงูุชุงุฑูุฎ ุฃู ุทูุงุจ ุงูุฌุงูุนุฉ ุฌุงุจูุง ูุณูุฑูุฑุงุชูุง ุงููุตุงู ูู ุงูุดุฎุตูุฉ โ<This message was edited>
โ[20/03/2025, 5:24:23โฏAM] ~โฏ๐: โimage omitted
[20/03/2025, 5:24:30โฏAM] ~โฏ๐: ูุงูู ุฎูุงุฑ ููุงูุฌููุฒู
[20/03/2025, 5:26:46โฏAM] ~โฏูุงุฑุณ ุงูุณููู: ุงุฏุฎู ูู ุงูุฌูุงู
โ[20/03/2025, 5:27:02โฏAM] ~โฏูุงุฑุณ ุงูุณููู: โ<attached: 00003858-PHOTO-2025-03-20-05-27-02.jpg>
[20/03/2025, 5:27:26โฏAM] ~โฏ๐: ูุทูุน ูู ุฑุณุงูู ุบูุฑ
โ[20/03/2025, 5:27:49โฏAM] ~โฏ๐: โ<attached: 00003860-PHOTO-2025-03-20-05-27-49.jpg>
[20/03/2025, 5:28:18โฏAM] ~โฏูุงุฑุณ ุงูุณููู: ุญุงูู ูุชุตูุญ ุซุงูู
[20/03/2025, 5:28:24โฏAM] ~โฏ๐: ุชูุงู
[20/03/2025, 5:28:41โฏAM] ~โฏFarah~โข: ูุง ุฌูุงุนุง ุงูุง ูุชุญ ูุนุงูุง ูู ุฎูุงู ุงูcourse regestration
[20/03/2025, 5:28:49โฏAM] ~โฏFarah~โข: ูุด ูู ุงูamendment
[20/03/2025, 5:29:39โฏAM] Majoody: ุงุณุชุฎุฏูุช easy connect?
[20/03/2025, 5:29:44โฏAM] ~โฏูุงุฑุณ ุงูุณููู: ุบุฑูุจู ุงู ุงุดุชุบู ุนูุฏู ุทุจูุนู
โ[20/03/2025, 5:30:08โฏAM] ~โฏ๐: โ<attached: 00003867-PHOTO-2025-03-20-05-30-08.jpg>
[20/03/2025, 5:30:14โฏAM] ~โฏ๐: ุงุดุชุบู ุนูุฏู
[20/03/2025, 5:30:22โฏAM] ~โฏ๐: ูุงุฒู ุชุธุบุท ุนูู ุงูุตูุฑู
[20/03/2025, 5:30:25โฏAM] ~โฏูุงุฑุณ ุงูุณููู: ุงููู ุจุณ ุฎูู ุงูุฌููุฒู
[20/03/2025, 5:30:32โฏAM] ~โฏ๐: Ok
[20/03/2025, 5:31:11โฏAM] ~โฏFarah~โข: ูุง 
Utm portal>course regestration
ุจุณ ูุฏู
[20/03/2025, 5:31:19โฏAM] ~โฏ๐: ุงูู ุดูุฑุง ูุนุทูู ุงูุนุงููู
[20/03/2025, 5:31:30โฏAM] ~โฏูุงุฑุณ ุงูุณููู: ุงููู ูุนุงููู๐
[20/03/2025, 5:33:50โฏAM] ~โฏูุงุฑุณ ุงูุณููู: ุชูุฏุฑ ุชุนุฏู ุณูุงุดู ููุงุ
[20/03/2025, 5:34:04โฏAM] ~โฏFarah~โข: ุงู ุชูุฏุฑ
[20/03/2025, 5:34:17โฏAM] ~โฏFarah~โข: ุจุณ ุนูู ุชุงูู ๐ญ
โ[20/03/2025, 5:34:35โฏAM] ~โฏูุงุฑุณ ุงูุณููู: โ<attached: 00003878-STICKER-2025-03-20-05-34-35.webp>
โ[20/03/2025, 5:47:56โฏAM] ~โฏOTP: โimage omitted
[20/03/2025, 5:48:28โฏAM] ~โฏOmar: ุดูู ุนูู utm smart
[20/03/2025, 5:49:28โฏAM] ~โฏOTP: ุทูุจ ูุด ูุงููุง ุงูู ูุงุฒู ุชุชูุธุฑ ุงูููุงููู
[20/03/2025, 5:49:32โฏAM] ~โฏูุงุฑุณ ุงูุณููู: ุงุชููุน ุงูุญูู ุชููู ุงูุงุฏููู ุงุฏูุงูุฒุฑ ููุงูู ุนูู ุงูุชุนุฏูู
โ[20/03/2025, 5:50:11โฏAM] ~โฏOmar: โimage omitted
[20/03/2025, 5:50:22โฏAM] ~โฏOmar: ุดูู ููุง ุงุฐุง ุนูุฏู approved ููุง ุจุงูู
โ[20/03/2025, 5:52:40โฏAM] ~โฏL: โ<attached: 00003885-PHOTO-2025-03-20-05-52-40.jpg>
โ[20/03/2025, 5:53:40โฏAM] ~โฏOTP: โ<attached: 00003886-PHOTO-2025-03-20-05-53-40.jpg>
[20/03/2025, 5:54:06โฏAM] Majoody: Dr. Mohd Yazid Bin Idris
[20/03/2025, 5:54:10โฏAM] Majoody: ูุฐุง ุงูุฏูุชูุฑ ููู ูุถุนู
[20/03/2025, 5:54:30โฏAM] ~โฏOmar: ุฎูุงุต ุชุนุฏููุง ุงุฐุง ุชุจุบู ุชุดูู ุฒูุงุฏู ุงุทุจุน ุงู reg slip ูุดูู ุนุงูุณูุดู
[20/03/2025, 5:55:18โฏAM] ~โฏOTP: ููุงู ุงู view slip
[20/03/2025, 5:55:42โฏAM] ~โฏOmar: ูุจ
[20/03/2025, 5:56:31โฏAM] ~โฏOTP: ูุง ูุงุชุบูุฑ ุดู
[20/03/2025, 5:56:44โฏAM] ~โฏmaria: ุทุจูุนู ุงู ุงูุงููุฏููุช ูุณุฉ ูุงูุชุญุด ูุนุงูุงุ
[20/03/2025, 5:56:57โฏAM] ~โฏGARRAH: ุงุธู ุนูุฏ ุงููู
[20/03/2025, 6:00:32โฏAM] ~โฏHebaโจ: ุงูุง ุจุฑุถู
[20/03/2025, 6:00:46โฏAM] ~โฏHebaโจ: Canโt connect to the server
[20/03/2025, 6:00:56โฏAM] ~โฏAbdul: ุงุบูุจูุง ูุง ุชุฎุงู
[20/03/2025, 6:01:20โฏAM] ~โฏAbdul: ูู ุณุงุนุชูู ูู ุงููููุน ุฏุง ู ูุงูู ุงู ุฌุฏูุฏ
[20/03/2025, 6:01:57โฏAM] ~โฏL: .
[20/03/2025, 6:03:36โฏAM] ~โฏHebaโจ: ูู ุงุดุชุบู ุงุฏููุง ุฎุจุฑ
[20/03/2025, 6:03:56โฏAM] ~โฏAbdul: ูู ุงุดุชุบู ุนูุฏ ุฃุตุญุงุจู
[20/03/2025, 6:04:08โฏAM] ~โฏAbdul: ูุง ูู ุงูู
[20/03/2025, 6:04:13โฏAM] ~โฏAbdul: ุจุณ ุญุงุฌู ุจุณูุทู
[20/03/2025, 6:06:22โฏAM] ~โฏูููุฏ: ุงูุณูุงู ุนูููู ู ุฑุญูุฉ ุงููู ู ุจุฑูุงุชู 

ุจุจุงูุบ ุงูุญุฒู ูุงูุฃุณู ูุจูุบูู ุจููุงุฉ ูุงูุฏ ุฃุญุฏ ุฒููุงุฆูุง ุงูุทุงูุจ ูุตุนุจ ุณุงูู
ุณุชูุงู ุตูุงุฉ ุงูุบุงุฆุจ ุนูู ูุงูุฏู ุฏ . ุณุงูู ุฃุฑุจุงุจ ุณุนูุฏ  ุนูุจ ุตูุงุฉ ุงูุธูุฑ ุงูููู ูู ูุณุฌุฏ ุงูุฌุงูุนุฉ 
ูุณุฃู ุงููู ุฃู ูุชุบูุฏู ุจูุงุณุน ุฑุญูุชู ููููู ุฃููู ุงูุตุจุฑ ูุงูุณููุงู

๐ ุงููููุน :
https://maps.app.goo.gl/JDeLyqCngLxezTex7
[20/03/2025, 6:06:50โฏAM] Majoody: ุงููู ูุฑุญูู ููุบูุฑ ูู ููุณููู ูุณูุญ ุฌูุงุชู
[20/03/2025, 6:07:00โฏAM] ~โฏRami Mohamed: โThis message was deleted.
[20/03/2025, 6:07:02โฏAM] ~โฏูุงุฑุณ ุงูุณููู: ุงูุง ููู ูุงูุง ุงููู ุฑุงุฌุนูู ุงููู ูุฑุญูู ููุบูุฑ ูู
[20/03/2025, 6:07:11โฏAM] ~โฏMohaned: ุงููู ูุฑุญูู ู ูุบูุฑ ูู ููุณููู ูุณูุญ ุฌูุงุชู
[20/03/2025, 6:07:28โฏAM] ~โฏุนุจุฏุงููู: ุงููู ูุฑุญูู ููุบูุฑูู ููุณููู ูุณูุญ ุฌูุงุชู
[20/03/2025, 6:07:44โฏAM] ~โฏโ: ุงููู ูุฑุญูู ููุบูุฑ ูู ููุณููู ูุณูุญ ุฌูุงุชู
[20/03/2025, 6:13:18โฏAM] ~โฏAli Elber: โThis message was deleted.
[20/03/2025, 6:14:16โฏAM] ~โฏL: ุงููู ูุฑุญูู ููุบูุฑูู ูุงุฑุจ ุนุธู ุงููู ุงุฌุฑูู
[20/03/2025, 6:14:29โฏAM] ~โฏOTP: ุงูุง ููู ูุงูุง ุงููู ุฑุงุฌุนูู 
ุฑุจูุง ูุฑุญูู ููุณููู ูุณูุญ ุฌูุงุชู
[20/03/2025, 6:15:17โฏAM] ~โฏUnkown: ุงููู ูุฑุญูู ู ูุบูุฑ ูู ูุงุฑุจ
[20/03/2025, 6:16:16โฏAM] ~โฏAhmed Abdulhafith Alkabyle: ุงูุง ููู ูุงูุง ุงููู ุฑุงุฌุนูู 
ุฑุจูุง ูุฑุญูู ููุณููู ูุณูุญ ุฌูุงุชู
[20/03/2025, 6:20:12โฏAM] ~โฏOmar: ุงููู ูุฑุญูู ููุบูุฑูู ููุฌุนู ูุซูุงู ุงูุฌูุฉ
[20/03/2025, 6:23:13โฏAM] ~โฏAM7: ุงูููู ุงุบูุฑ ูู ูุงุฑุญูู ูุนุงูู ูุงุนู ุนูู ูุงูุฑู ูุฒูู ููุณุน ูุฏุฎูู ูููู ูู ุงูุฎุทุงูุง ููุง ูููู ุงูุซูุจ ุงูุฃุจูุถ ูู ุงูุฏูุณ โ<This message was edited>
[20/03/2025, 6:32:08โฏAM] ~โฏOTP: ุญุฏ ูุนู ุฑูู DR Norsham binti idris
[20/03/2025, 6:35:50โฏAM] ~โฏRami Mohamed: โThis message was deleted.
[20/03/2025, 6:35:53โฏAM] ~โฏKhalid: ุฅูุง ููู ูุฅูุง ุงููู ุฑุงุฌุนูู
ุงููู ูุฑุญูู ููุบูุฑูู ูุงุฑุจ ุนุธู ุงููู ุงุฌุฑูู
[20/03/2025, 6:36:14โฏAM] ~โฏRami Mohamed: โThis message was deleted.
โ[20/03/2025, 6:38:05โฏAM] ~โฏKhalid: โ<attached: 00003922-PHOTO-2025-03-20-06-38-05.jpg>
โ[20/03/2025, 6:40:08โฏAM] ~โฏRami Mohamed: โ<attached: 00003923-PHOTO-2025-03-20-06-40-08.jpg>
โ[20/03/2025, 6:40:30โฏAM] ~โฏAli Elber: โ<attached: 00003924-PHOTO-2025-03-20-06-40-30.jpg>
[20/03/2025, 6:48:01โฏAM] โช+249ย12ย486ย5401โฌ: โโช+249ย12ย486ย5401โฌ joined from the community
[20/03/2025, 6:40:51โฏAM] ~โฏRami Mohamed: ูู ูู ุงุญุฏ ูุนุฑู ุงูุฏูุชูุฑู ูุฐู ูู English ู ููู ุชุนุงูููุง ู ุฏุฑุฌุงุชูุง
[20/03/2025, 6:40:57โฏAM] ~โฏAli Elber: ุดุจุงุจ ููู ูู saved ุจุณ ูุด enrolled ุงุจุฏุง
[20/03/2025, 6:43:35โฏAM] ~โฏูุงุฑุณ ุงูุณููู: ูุงุนูุงู ุฏุฎูุช e learning ูุง ูุทูุนูู ุงูุณูุดู ุงูู ุนุฏูุชู ูุด ุงูุญูุ
[20/03/2025, 6:43:52โฏAM] ~โฏ๐: ููุณ ุงููุดููุฉ
โ[20/03/2025, 6:47:22โฏAM] ~โฏM7MD: โ<attached: 00003930-PHOTO-2025-03-20-06-47-22.jpg>
[20/03/2025, 6:50:13โฏAM] ~โฏM7MD: ูู ููุง mohd foadุ
[20/03/2025, 6:50:15โฏAM] ~โฏุงููุงุซู ุจุงููููฐู: ุงูุชุธุฑ ููู ูุฏุฎูู ุงูุฏูุชูุฑ ุงู ูููู ูุฏุฎูู ุงูู ุดู ูู utm smart ููุณ ุงูุณูุดู
[20/03/2025, 6:50:59โฏAM] ~โฏูุงุฑุณ ุงูุณููู: Utm smart ุนูุฏู ุทูุน ูู ุงูุณูุงุดู ุงูู ุณุฌูุชูู
[20/03/2025, 6:53:43โฏAM] ~โฏุงููุงุซู ุจุงููููฐู: .
[20/03/2025, 6:53:56โฏAM] ~โฏุงููุงุซู ุจุงููููฐู: ุชุจุบู ุดุฑุญ ุฎุฐ ูุคุงุฏ
[20/03/2025, 6:54:24โฏAM] ~โฏุงููุงุซู ุจุงููููฐู: ุดุฑุญูุง ูุด ุณูุก
[20/03/2025, 6:59:37โฏAM] ~โฏMohamad Noureddine: ุงูุณูุงู ุนููููุ ูุง ุดุจุงุจ ููู ููุนุฏ ุงู academic office
[20/03/2025, 6:59:57โฏAM] ~โฏMohamad Noureddine: ูุชู ุงู break ุชุงุนูู
โ[20/03/2025, 7:32:28โฏAM] ~โฏ.: โ<attached: 00003939-PHOTO-2025-03-20-07-32-28.jpg>
[20/03/2025, 7:51:24โฏAM] ~โฏ๐: ูุงุชุบูุฑ ุนูุฏู
[20/03/2025, 7:56:32โฏAM] ~โฏูุงุฑุณ ุงูุณููู: ุชุงูุฏ ุงูู approved
[20/03/2025, 7:56:47โฏAM] ~โฏ๐: ุทูุน ูู ุงุจุฑููุฏ โ<This message was edited>
โ[20/03/2025, 7:57:02โฏAM] ~โฏ๐: โ<attached: 00003943-PHOTO-2025-03-20-07-57-02.jpg>
[20/03/2025, 9:03:46โฏAM] ~โฏMoath_Mo.dev: https://t.me/FCIndustrialTraining25261
[20/03/2025, 11:50:49โฏAM] ~โฏูุงุฑุณ ุงูุณููู: ุชูุงุตู ูุน AA ุนุดุงู ูุงูุฏูู ุงูููุงุฏ
[20/03/2025, 11:51:32โฏAM] ~โฏAmr Qatab: ุทูุจ  ูุงูุฐู ุนุงุฏู ูุงุธูุฑ ูู AA
[20/03/2025, 11:52:38โฏAM] ~โฏูุงุฑุณ ุงูุณููู: Nurulaida@utm.my ุชูุงุตู ูุน ุฐูุ ุญู ุงูุชุณุฌูู ุชุจุน ูููุชูุง ุงุดุฑุญููุง ุงููุดููู ูุดูู ูุด ุชุฑุฏ

ูุง ููุน ุฑูุญ ูุฑูุจ ุฑูุญุงูู ุงุดุฑุญููุง ุงููุดููู https://t.me/ugfcutm
[20/03/2025, 11:53:42โฏAM] ~โฏAmr Qatab: ุงูุตุฏ ุงุฐุง ุณููุช ุชุนุฏูู ุถุฑูุฑู ุงุฑุฌุน ุงูุฏ ูู AA
[20/03/2025, 11:54:52โฏAM] ~โฏูุงุฑุณ ุงูุณููู: ุงุฐุง ุงูุช ุฌุฏูุฏ ู ุงููููู ุชุงูุฏูู ุงูุณูุงุดู ุนูู ุญุณุจ ุนูููุ ูุง ูุญุชุงุฌ AA ุงูุงูุถู ุชุชูุงุตู ูุนุงูู ุชุดูู ุงูุณุจุจ ุงูู ูุง ุถูุฑููู
[20/03/2025, 11:56:24โฏAM] ~โฏAmr Qatab: ุงูุง ุงุฐุง ุชูุงู ูุนุทูู ุงูุนุงููู
[20/03/2025, 11:56:35โฏAM] ~โฏูุงุฑุณ ุงูุณููู: ุงููู ูุนุงููู
โ[20/03/2025, 3:19:30โฏPM] Hamdan Saleh: โ<attached: 00003952-PHOTO-2025-03-20-15-19-30.jpg>
โ[20/03/2025, 4:36:29โฏPM] ~โฏAhmed Marwan: โ<attached: 00003953-PHOTO-2025-03-20-16-36-29.jpg>
[20/03/2025, 4:36:57โฏPM] ~โฏMohannad Jebril: ูุนูู
โ[20/03/2025, 4:37:47โฏPM] ~โฏAhmed Marwan: โ<attached: 00003955-STICKER-2025-03-20-16-37-47.webp>
[20/03/2025, 4:45:53โฏPM] ~โฏุงููุงุซู ุจุงููููฐู: ุณูู ุฑูููุฏ ุนูู ููุณ ุงูุตูุญุฉ ุงูุซุฑ ูู ูุฑุฉ
[20/03/2025, 4:56:22โฏPM] ~โฏAhmed Marwan: ุจุงูู ุนูู ููุณ ุงููุถุน๐
โ[20/03/2025, 6:09:24โฏPM] ~โฏAbdul: โ<attached: 00003958-PHOTO-2025-03-20-18-09-24.jpg>
[20/03/2025, 6:09:28โฏPM] ~โฏAbdul: ูุง ูุงุถุญ ูู ุฒุฑ ุชุบููุฑ
[20/03/2025, 6:11:38โฏPM] ~โฏHebaโจ: ุฎุด ูู ุงูcourse registration
โ[20/03/2025, 6:14:50โฏPM] ~โฏAbdul: โ<attached: 00003961-PHOTO-2025-03-20-18-14-50.jpg>
[20/03/2025, 6:15:16โฏPM] ~โฏAbdullah Alyafei: ูููุง
[20/03/2025, 6:15:22โฏPM] ~โฏOTP: ุงููู ูุฐุง
[20/03/2025, 6:29:58โฏPM] ~โฏูุงุฑุณ ุงูุณููู: ุงูุณุณุชู ุนุทูุงู๐
