[17/02/2019, 5:03:10โฏAM] YSAG - Computing: โMessages and calls are end-to-end encrypted. No one outside of this chat, not even WhatsApp, can read or listen to them.
[17/02/2019, 5:03:10โฏAM] โช+60ย18โ780ย6079โฌ: โโช+60ย18โ780ย6079โฌ created this group
[21/03/2024, 4:22:01โฏPM] YSAG - Computing: โ~โฏAbdullah Yaser Alnadhari added you
[23/03/2024, 4:04:38โฏPM] ~โฏAhmed Marwan: Assalam boss
Nak minta tolong bole share dgn pelajar R tahun 3 utk hebahan latihan industri.


Telegram for Industrial Training 202420251

Hello all students in year 3,ย let's join our FC Industrial Training communication for placement application. 

See you there!
https://t.me/+qL2bxTMvCkhiYTFl

Next event: Briefing for Industrial Training Placement.

Thank you.

FC Industrial Training Coordinator
[23/03/2024, 6:09:31โฏPM] ~โฏ.: โ~โฏAhmed Marwan added ~โฏ.
[23/03/2024, 6:14:31โฏPM] ~โฏ.: ุงูุณูุงู ุนูููู
[23/03/2024, 6:16:05โฏPM] ~โฏ.: ุฃูุง ุทุงูุจุฉ ุณูุณุชุฑ ูก ุชุฎุตุตู software engineeringุ ุงุชุดุฑูุช ุจูุฌูุฏู ููุง ูุนูู๐
[23/03/2024, 6:16:13โฏPM] ~โฏ.: ุนุงูุฒุฉ ุฃุนุฑู ุฅุฐุง ูู ุฃุญุฏ ุฏุฑุณุชู Dr Nies Hui Wen ููู ุทุฑููุชูุง ูู ุงูุชุฏุฑูุณ ู ุงููุนุงููุฉุ
[23/03/2024, 6:18:22โฏPM] ~โฏูุญูุฏ: ุงุณุทูุฑูู ุฌุฏุง ูุทูุจู ุงูู ููู ูุงุญูู ุฏุฑุฌุงุช ุจุฑุถู ููุชุงุฒู 

ุจุณ ุงูุดุฑุญ ูุงููู ุชุนุจุงู ุงูุตุฑุงุญู
[23/03/2024, 6:21:52โฏPM] ~โฏ.: โThis message was deleted.
[23/03/2024, 6:25:34โฏPM] Hamdan Saleh: ููุชุงุฒู
[23/03/2024, 6:41:17โฏPM] ~โฏ๐ธSHIMAA SALAH ๐ธ: โ~โฏAhmed Marwan added ~โฏ๐ธSHIMAA SALAH ๐ธ
โ[23/03/2024, 6:46:58โฏPM] ุฃุณุงูุฉ ุงูุญุณุงู ูุงููุฏูุดู: โ<attached: 00000013-PHOTO-2024-03-23-18-46-58.jpg>
โ[23/03/2024, 7:05:21โฏPM] Ahmed Ghaleb: Borang-Pembetulan-Kursus.pdf โข โ1 page โ<attached: 00000014-Borang-Pembetulan-Kursus.pdf>
[23/03/2024, 7:05:44โฏPM] ~โฏMoqbel: ุงูุณูุงู ุนููููุ ูุง ุดุจุงุจ ุงูุงูุฏููุช ูู ุงูููุงููุ
[23/03/2024, 7:05:52โฏPM] ~โฏูุญูุฏ: ููุงุณู ูุง
[23/03/2024, 7:05:52โฏPM] ~โฏ.: ูุนูููู ุงูุณูุงู
[23/03/2024, 7:05:53โฏPM] ~โฏ.: ูุง
[23/03/2024, 7:06:10โฏPM] Ahmed Ghaleb: ูุงุ ุถุฑูุฑู ุชุนุจู ุฐู ุงููุฑูุฉ ูุชุฑูุญ ุนูู ุงูููุชุจ ุนูุฏ ุฑูุญุงูู
[23/03/2024, 7:06:42โฏPM] ~โฏAhmed Marwan: ูุชุงูุฏุ 
ูุงู ูู ูุงุณ ูููููุง ุงูู ุงูููุงูู ๐
[23/03/2024, 7:06:56โฏPM] ~โฏ.: ุชูู ูุฒู ูุงูู ูุงูู
[23/03/2024, 7:07:00โฏPM] ~โฏAbdullah Yaser Alnadhari: ููู ุนุฑูุชุ
[23/03/2024, 7:07:01โฏPM] ~โฏูุญูุฏ: ุชููู ุฏุฎูุช ูููุชูุจ ูุงุฒู ุชุฑูุญ ุงูุงูููุณ
โ[23/03/2024, 7:07:20โฏPM] Ahmed Ghaleb: โ<attached: 00000024-PHOTO-2024-03-23-19-07-20.jpg>
[23/03/2024, 7:08:08โฏPM] ุฃุณุงูุฉ ุงูุญุณุงู ูุงููุฏูุดู: ุงูููุฏุณุฉ ุงูููุงูู ูุงุญูุง ูุง
[23/03/2024, 7:12:55โฏPM] Hamdan Saleh: 1+
[23/03/2024, 7:15:29โฏPM] ~โฏAbdulkader: Dr. Pang 
ุงูุฏูุชูุฑ ุตููู ููููุณ ุจุณ ุงูู ูุฑุฉ ูุดุบูู ูุฐุง ุงูุณูุณุชุฑ + ุดููุฉ ุดุฏูุฏ ูู ุงูุฏุฑุฌุงุช
โ[23/03/2024, 7:18:35โฏPM] ~โฏAbdullah Al-Shateri: โ<attached: 00000028-PHOTO-2024-03-23-19-18-35.jpg>
[23/03/2024, 7:19:47โฏPM] ุฃุณุงูุฉ ุงูุญุณุงู ูุงููุฏูุดู: ุจุณ ููุง ุชุฏุฎู ุชูุงูู ููุณ ุงูููุงุฏ ุงููู ุฃูุช ูุณุฌููุง
[23/03/2024, 7:33:25โฏPM] ~โฏAbdullah Al-Shateri: ุดุจุงุจ ููุชูุญ
[23/03/2024, 7:33:32โฏPM] ~โฏAbdullah Al-Shateri: ุณูู ok ุจุณ
[23/03/2024, 7:41:10โฏPM] ~โฏ.: ููุฏู ูุบูุฑ ุณูุงุดู ููุง ุจุณ ุงุถุงูุฉุ
[23/03/2024, 7:41:34โฏPM] ~โฏAbdullah Al-Shateri: ูู ุดู
[23/03/2024, 7:41:57โฏPM] ~โฏูุญูุฏ: ููููุฑุจุงุก ุจุณ ๐
โ[23/03/2024, 7:42:16โฏPM] ~โฏAbdullah Al-Shateri: โ<attached: 00000035-STICKER-2024-03-23-19-42-16.webp>
[23/03/2024, 7:43:45โฏPM] Ahmed Ghaleb: ุฃูุช ููุฑุจุง ูุด ุฌุงุจู ููุง
[23/03/2024, 7:44:05โฏPM] ~โฏAbdullah Al-Shateri: ุดูู ุงูุงุฏูู
[23/03/2024, 7:44:32โฏPM] ~โฏNaif: ๐๐
[23/03/2024, 7:44:37โฏPM] ุฃุณุงูุฉ ุงูุญุณุงู ูุงููุฏูุดู: 1-0
[23/03/2024, 7:46:10โฏPM] ุฃุณุงูุฉ ุงูุญุณุงู ูุงููุฏูุดู: ุดุจุงุจ ุฃู ุชุญุฏูุซ ููุงุ
ุฏูุชูุฑ Pang ููุง ูุชููู ูุง ูููู ุดูุก ูู ุงูุงูุณูุช ุงูุฑููุจุ ุฎุตูุตูุง ููู ุงูููุงูู
[23/03/2024, 7:52:30โฏPM] ~โฏAhmed Marwan: ููุชููุจ ูุงูุญุงูุธ ุงููู
ุฎุตูุตูุง ุงููุงุฏุฉ ูุฐู ุณูู ุชูุงูู ููุง ุดุฑูุญุงุช ู ุงูููุชููุจ
[23/03/2024, 7:54:15โฏPM] ~โฏ.: ุญุงูู ุชูุดู ุงููุฑู ุฐุง ุงูุณูุณุชุฑ ุฎุงุตุฉ ูุฃู ูุงูู ุฏูุงุชุฑุฉ ูููุณูู ูุซูุฑ
[23/03/2024, 7:54:22โฏPM] ~โฏ.: ุทูุจ ุดูุฑุง๐
[23/03/2024, 7:57:20โฏPM] ุฃุณุงูุฉ ุงูุญุณุงู ูุงููุฏูุดู: ููุดูู ุงูุณูุฉ ูููุง ูู ุนูุฏ ุงููููุฏ
[23/03/2024, 8:03:52โฏPM] ~โฏMahmoud Elganzory: โ~โฏMahmoud Elganzory joined using this group's invite link
โ[23/03/2024, 8:04:17โฏPM] ~โฏOmar: โ<attached: 00000046-PHOTO-2024-03-23-20-04-17.jpg>
โ[23/03/2024, 9:14:36โฏPM] ~โฏAhmed Marwan: โ<attached: 00000047-PHOTO-2024-03-23-21-14-36.jpg>
โ[23/03/2024, 9:20:54โฏPM] Abdullah Neighbor: โ<attached: 00000048-PHOTO-2024-03-23-21-20-54.jpg>
[23/03/2024, 9:21:09โฏPM] Abdullah Neighbor: ุจุณ ูุงููุง ูุงุฏุฉ ูก ูุฑูุฏุช ูููู ูุฌูุนููู ูุน ุจุนุถ
[23/03/2024, 9:37:26โฏPM] ~โฏ๐๐๐๐๐ โโถโโพ: Dr. Pang
ุงุญุณู ูุงุญุฏ ูู ุจูู ุงูุฎูุงุฑุงุช
[23/03/2024, 9:38:12โฏPM] ~โฏ๐๐๐๐๐ โโถโโพ: โThis message was deleted.
[24/03/2024, 2:45:37โฏAM] ~โฏูุญูุฏ: ุณูุงู ุนูููู 


ุญุฏ ุนูุฏู ุฑูู ุงูุฏูุชูุฑู Raja ุงู ุงูุชููุฑุงู ุญููุงุ

ูุฑุณูู ูู ุงููู ูุณุนุฏูู
[24/03/2024, 2:48:22โฏAM] ~โฏAmar Hassan: ูุชุญุช ุงู amendment ุนูุฏูู ุดุจุงุจ ุ
โ[24/03/2024, 2:49:59โฏAM] Abdullah Neighbor: โ<attached: 00000054-Zahilah Raja.vcf>
[24/03/2024, 2:50:04โฏAM] Abdullah Neighbor: ูุนูููู ุงูุณูุงู ูุฑุญูุฉ ุงููู ูุจุฑูุงุชู
[24/03/2024, 2:50:11โฏAM] ~โฏูุญูุฏ: ุณููุช ๐ค
[24/03/2024, 2:53:00โฏAM] ~โฏSMA: ู
[24/03/2024, 2:53:18โฏAM] Majoody: ุดุบูุช Vpn ููุชุญ ูุนู
[24/03/2024, 2:53:27โฏAM] Majoody: ูุง ุงุฏุฑู ุจุฏููู ุงุฐุง ุจูุดุชุบู ุงู ูุง
[24/03/2024, 2:54:07โฏAM] ~โฏSMA: ุชุดูุฑุงุช
[24/03/2024, 2:54:14โฏAM] Majoody: ุญุจูุจ ุจุงู ููุช ๐ค
[24/03/2024, 3:07:36โฏAM] ~โฏSalem: https://scrimba.com/learn/htmlandcss
ุฏูุฑุฉ ููุชุงุฒุฉ ูุณุฑูุนู ุจุชูุฎุต ูู ุฏุฑุงุณุฉ ุงูู ุดูุฑูู ูู ุงูููุฑุณ
[24/03/2024, 3:07:38โฏAM] ~โฏAmar Hassan: ูุง ุงุดุชุบู ูุนุงูุง
[24/03/2024, 3:07:57โฏAM] ~โฏSalem: ูุฌุงููุฉ*
[24/03/2024, 3:49:56โฏAM] Majoody: ุบูุฑ vpn
[24/03/2024, 3:50:00โฏAM] Majoody: ุญุงูู ููู ูุดุชุบู ูุนู
[24/03/2024, 3:50:09โฏAM] Majoody: ุงูุง ูุงูุดุจุงุจ ูุดุช ุฃููุฑูุง ุงูุญูุฏููู
[24/03/2024, 3:50:31โฏAM] Majoody: ูู VPN ุงูุฌุงูุนุฉ
ุงู VPN ุฎุงุฑุฌู
[24/03/2024, 4:04:05โฏAM] ~โฏMahmoud Elganzory: Muhammed Aliif ููุง
Zurihati 
computational math
[24/03/2024, 4:04:42โฏAM] ~โฏOmar Ibrahim Agiza: Muhammed Aliif
[24/03/2024, 4:04:44โฏAM] Hamdan Saleh: ูุญูุฏ ุงููู๐ฃ๏ธ
[24/03/2024, 4:05:17โฏAM] ~โฏMahmoud Elganzory: ุงุฎุชุงุฑู ููุงู ูู SAD ููุง Rozliawati
[24/03/2024, 4:05:43โฏAM] ~โฏ.: ุณููุชูุง ูุถุจุทุช ููู ุงูุจุงููู ุญู ุงูุณูุดู ูุง ุงูุถุงู ูู e learning ูู ูุงุฒู ุงุฑูุญ ุงูููููุ
[24/03/2024, 4:05:51โฏAM] ~โฏNaif: ุชูุฏุญ ููุง ุงูุด๐
[24/03/2024, 4:06:10โฏAM] ~โฏNaif: ุญุฑููุง ููุง ูุฏุฑุณูุง ุจุฑุฏุฌูู ู ุณุงุญุจ ุนูููุง ููุงุณูู
[24/03/2024, 4:06:45โฏAM] Hamdan Saleh: โThis message was deleted.
[24/03/2024, 4:07:24โฏAM] Hamdan Saleh: ูู ูุณูู ูููู ุจุณ ุทูุจ
[24/03/2024, 4:08:29โฏAM] ~โฏBasel Abunada: ุฏูุชูุฑ ุฌุฏุง professional ุจุชุดุชุบู ูุนู ูููุณ ูุงุจูุตุฑ ูุนู ุจุงูุฏุฑุฌุงุช
[24/03/2024, 4:10:26โฏAM] ~โฏMahmoud Elganzory: +ูก
[24/03/2024, 4:11:58โฏAM] ~โฏMo3taz Al-Shater: ุชุฃุฎุฐ ุดููุฉ ููุช ุนูู ุจุงู ุชูุถุงู
[24/03/2024, 4:12:18โฏAM] ~โฏMahmoud Elganzory: ูุนูู ุงุญุถุฑ ุงูููู ูู ุงูุณูุงุดู ุงูุงููู ุ
[24/03/2024, 4:12:44โฏAM] ~โฏMo3taz Al-Shater: ูู ุชูุฑูุจุง ุณุงุนุฉ ุณุงุนุชูู ุจุนุฏูุง ุจุชุทูุน ูู ุจุณ ุงุฐุง ุทููุช ูููู ุชุณุงู ุงู Academic office โ<This message was edited>
โ[24/03/2024, 4:21:10โฏAM] ~โฏBasel Abunada: โ<attached: 00000083-PHOTO-2024-03-24-04-21-10.jpg>
[24/03/2024, 4:22:30โฏAM] ~โฏOmar Essam Hegazy: ูููุณู
[24/03/2024, 4:22:40โฏAM] ~โฏBasel Abunada: ุจุงูุฏุฑุฌุงุช ุ
[24/03/2024, 4:23:27โฏAM] ~โฏOmar Essam Hegazy: ุงู
โ[24/03/2024, 4:29:26โฏAM] ~โฏAhmed Abdulhafith Alkabyle: โ<attached: 00000087-PHOTO-2024-03-24-04-29-26.jpg>
โ[24/03/2024, 4:30:47โฏAM] ~โฏAhmed Abdulhafith Alkabyle: โ<attached: 00000088-PHOTO-2024-03-24-04-30-47.jpg>
[24/03/2024, 4:30:49โฏAM] ~โฏAhmed Marwan: โThis message was deleted.
โ[24/03/2024, 4:30:51โฏAM] ~โฏAhmed Abdulhafith Alkabyle: โ<attached: 00000090-PHOTO-2024-03-24-04-30-51.jpg>
[24/03/2024, 4:31:11โฏAM] Majoody: ุฌุฏูุฏ ููููุณ
[24/03/2024, 4:31:44โฏAM] ~โฏAhmed Abdulhafith Alkabyle: Dr Sarin ?
[24/03/2024, 4:33:52โฏAM] ~โฏAhmed Abdulhafith Alkabyle: ุนูุฏู clash ูู ููุชู ๐ฅฒ
โ[24/03/2024, 4:38:28โฏAM] ~โฏAhmed Marwan: โ<attached: 00000094-PHOTO-2024-03-24-04-38-28.jpg>
[24/03/2024, 4:45:53โฏAM] ~โฏูุญูุฏ: ุญุฏ ููุฒู Special topics in computer networks ุณูุดู ูกุ
[24/03/2024, 4:46:37โฏAM] ~โฏOmar ABasset: ๐๐ปโโ๏ธ
โ[24/03/2024, 5:26:05โฏAM] Hamdan Saleh: โ<attached: 00000097-PHOTO-2024-03-24-05-26-05.jpg>
โ[24/03/2024, 6:03:03โฏAM] ~โฏOmar ABasset: โ<attached: 00000098-PHOTO-2024-03-24-06-03-03.jpg>
โ[24/03/2024, 6:04:40โฏAM] ~โฏMohamad Noureddine: โ<attached: 00000099-Mohd Zamri Sarawak.vcf>
[24/03/2024, 6:11:28โฏAM] Majoody: ุงุญุฏ ูุนู ุงูููู dr dayang
[24/03/2024, 6:11:36โฏAM] Majoody: ุงุธู ุงููุง ููุตุจ ุจูููุชูุง
[24/03/2024, 6:12:44โฏAM] ุฃุณุงูุฉ ุงูุญุณุงู ูุงููุฏูุดู: dayang@utm.my
[24/03/2024, 6:12:58โฏAM] Hamdan Saleh: ูุงุนูุงู ุงูุจูุฑุชุงู ุดุบุงู ุนูุฏููุ
[24/03/2024, 6:21:19โฏAM] ~โฏ.: ุงููุง
โ[24/03/2024, 6:40:24โฏAM] Amr Al-waeli: โ<attached: 00000105-PHOTO-2024-03-24-06-40-24.jpg>
[24/03/2024, 6:51:18โฏAM] ~โฏAhmed Abdulhafith Alkabyle: maheyzah
[24/03/2024, 6:51:46โฏAM] Amr Al-waeli: ุดูุฑุง ูู
โ[24/03/2024, 6:52:49โฏAM] ~โฏMoqbel: โ<attached: 00000108-PHOTO-2024-03-24-06-52-49.jpg>
โ[24/03/2024, 7:29:34โฏAM] ~โฏ.: โ<attached: 00000109-PHOTO-2024-03-24-07-29-34.jpg>
[24/03/2024, 7:33:01โฏAM] ~โฏ.: ุงุจุนุฏ ุนู ุงุฑูุงุชู
[24/03/2024, 7:33:33โฏAM] ~โฏMohamad Noureddine: ูููู ุนุฑุจูุฉ ูููุณุฉ ุฌุฏุง
[24/03/2024, 7:33:42โฏAM] ~โฏ.: ุฃูุง ูุนุงูุง๐คก
[24/03/2024, 7:33:43โฏAM] Amr Al-waeli: ุงุจุนุฏ ุนู ุขุฎุฑ ูุงุญุฏ
[24/03/2024, 7:33:59โฏAM] ~โฏ.: ูู ุงูุดุฑุญ ูููุ
[24/03/2024, 7:34:08โฏAM] ~โฏ.: ุญุณูุช ูู ุงูุดุฑุญ ุงุฑูุงุชู ูุง ูุฑุฉ
[24/03/2024, 7:36:41โฏAM] ~โฏMohamad Noureddine: ุดุฑุญูุง ุนุงุฏู ูููุณุ ูููู ุงูุญูู ูููุง ุชูุฏุฑ ุชุชูุงูู ูุนูุง ุจุงูุนุฑุจู ููุง ุฑุญ ุชุถูุน ูุซูุฑ ุจุงูุจุฑูุฌููุช
[24/03/2024, 7:37:16โฏAM] ~โฏ.: ููุด ูู ูููู ุฃุณุฃูุ ูู ุตุนุจุฉ ูู ุงูุชุตุญูุญุ
[24/03/2024, 7:37:28โฏAM] ~โฏ.: ุฃููุงุง ูููุช ุดูุฑุง๐
[24/03/2024, 7:37:57โฏAM] ~โฏ.: ุดุฏูุฏุฉ ูู ุงูุฏุฑุฌุงุช ูุฃุณููุจ ุฒูุช
[24/03/2024, 7:42:26โฏAM] ~โฏ๐๐๐๐๐ โโถโโพ: ุจุณ ูุงููุง ุชุฏู ุนูุฏูุฉ ๐
[24/03/2024, 7:42:49โฏAM] ~โฏ.: ูฃ ุฑูุฌุช ๐
โ[24/03/2024, 7:45:50โฏAM] ~โฏMoqbel: โ<attached: 00000122-PHOTO-2024-03-24-07-45-50.jpg>
[24/03/2024, 7:47:34โฏAM] ~โฏBaraah: ุฏูุชูุฑุฉุ ูููุณุฉ ูุงูุช
[24/03/2024, 7:48:18โฏAM] ~โฏ.: ูุดููุฉ ู ุงููู
[24/03/2024, 7:48:33โฏAM] ~โฏ.: ุทูุจ ุงูุชุญููู ูู ุงูุณูุงุดู ูููุน ุฃูููุงูู ููุง ูุงุฒู ููุดู ุงูุงูููุณุ
[24/03/2024, 7:50:37โฏAM] ~โฏMohamad Noureddine: ุงูุง ููุน ูุนู ุจุณ ูุงุฒู ุชุญุงูู ูุฐุฉ ูุฑุฉ
[24/03/2024, 7:50:46โฏAM] ~โฏ.: try vpn
[24/03/2024, 7:51:35โฏAM] Amr Al-waeli: ููู ุงุญูู ุงูููุงููุ
[24/03/2024, 7:52:15โฏAM] ~โฏ.: ุจุงูุงูููู ูุตุฏู
[24/03/2024, 7:52:22โฏAM] ~โฏ.: ูููุุ
[24/03/2024, 7:52:28โฏAM] Amr Al-waeli: ุงูุง ุชูุงู
[24/03/2024, 7:52:54โฏAM] ~โฏMohamad Noureddine: ุดุบู vpn ูุงูุนุฏ ุญุงูู
[24/03/2024, 8:25:15โฏAM] ~โฏAbdo: โ~โฏAbdo joined using this group's invite link
โ[24/03/2024, 8:44:06โฏAM] ~โฏูุญูุฏ: โ<attached: 00000134-PHOTO-2024-03-24-08-44-06.jpg>
[24/03/2024, 8:45:45โฏAM] ~โฏMohaned: ุดุฑุญูุง ุณูุก ุจุณ ูููุณุฉ ูู ุงูุฏุฑุฌุงุช
โ[24/03/2024, 9:27:22โฏAM] ~โฏMohamad Noureddine: โ<attached: 00000136-PHOTO-2024-03-24-09-27-22.jpg>
[24/03/2024, 11:33:08โฏAM] ~โฏM.Bajameel: ุงูุณูุฉ ุงููู ูุงุชุช ูุงู ูุฏุฑุณ 3 ุณูุงุดู ููุฌูุนูู ูู ูุงุนุฉ ูุญุฏุฉ
[24/03/2024, 1:04:23โฏPM] ~โฏOmar Ibrahim Agiza: Dr. Nor Erne Nazira binti Bazin
ููุง  Dr. Mohamad Shukor bin Talib
[24/03/2024, 1:14:22โฏPM] ~โฏRami: ููุฑ ุดุฑุญูุง ุญููุง ุจุณ ุชุงุฎุฐ ุณูู ุนุดุงู ุชุตุญุญ ุงู ุดูุก (ูููุณู ูู ุงูุฏุฑุญุงุช) โ<This message was edited>
[24/03/2024, 1:15:01โฏPM] ~โฏOmar Ibrahim Agiza: ุชุณูู
[24/03/2024, 1:17:00โฏPM] ~โฏRami: ุงููู ูุณููู ,ูุง ุฌุฑุจุช shukor โ<This message was edited>
โ[24/03/2024, 1:22:03โฏPM] ~โฏAbdullah Al-Shateri: โ<attached: 00000142-PHOTO-2024-03-24-13-22-03.jpg>
โ[24/03/2024, 3:32:38โฏPM] ~โฏMoqbel: โ<attached: 00000143-PHOTO-2024-03-24-15-32-38.jpg>
[24/03/2024, 3:39:33โฏPM] ~โฏMoath_Mo.dev: HCI ุญูุธ ูุตุฑุงุญู ูููุงูู ูุจู ุจุณ ูู ูุนูุฏู
[24/03/2024, 3:40:10โฏPM] ~โฏMoath_Mo.dev: DSA ูุงุฏู ุจุฑูุฌู 
ุชุณุชุฎุฏู java
[24/03/2024, 3:45:14โฏPM] ~โฏMohamad Noureddine: ูุง c++
โ[24/03/2024, 3:47:13โฏPM] ~โฏMoath_Mo.dev: โ<attached: 00000147-STICKER-2024-03-24-15-47-13.webp>
[24/03/2024, 3:51:19โฏPM] ~โฏMoqbel: ูุนุทูู ุงูุนุงููู
[24/03/2024, 3:55:09โฏPM] ~โฏMoath_Mo.dev: ุงููู ูุนุงููู
[24/03/2024, 6:25:02โฏPM] ~โฏOmar Ibrahim Agiza: Dr. Aida binti Ali  
Dr. Sarina binti Sulaiman 
ุงู ุฏูุชูุฑู ุงุญุณู
[24/03/2024, 6:43:24โฏPM] Majoody: ุนุงูุฏุฉ ุฌุฏุง ููุชุงุฒุฉ
[24/03/2024, 6:43:27โฏPM] Majoody: ูุง ุงุนุฑู ุนู ุงูุซุงููุฉ
[24/03/2024, 6:43:55โฏPM] Majoody: ุนุงูุฏุฉ ุทูุจุฉ ูุฏุฑุฌุงุชูุง ุฌูููุฉ
[24/03/2024, 6:44:16โฏPM] ~โฏOmar Ibrahim Agiza: ุชุณูู ๐ซถ๐ป
[24/03/2024, 6:44:23โฏPM] Majoody: ุงููู ูุณููู ๐ค๐ค
โ[24/03/2024, 11:32:16โฏPM] ~โฏSalman Alameer: โ<attached: 00000156-PHOTO-2024-03-24-23-32-16.jpg>
[25/03/2024, 3:11:25โฏAM] ~โฏAbdulkader: ุจุณ ููู ุชุนุทููุง ุงูุทุจุงุน ูููุณ ุนูู
[25/03/2024, 4:02:10โฏAM] ~โฏSMA: Dr. Mohd. Razak bin Samingan
[25/03/2024, 4:02:18โฏAM] ~โฏSMA: ุดุจุงุจ ููู ุงูุฏูุชูุฑ ูุฐุง
[25/03/2024, 4:03:37โฏAM] ~โฏMohamad Noureddine: ุงุฎุฐุช ูุนู app dev ุดุฑุญู ุณูุก ูููู ุนูุงูุงุชู ูููุณุฉ
[25/03/2024, 4:04:11โฏAM] ~โฏAbdulkader: ูุง ุนูู ูู app dev ูููุง ุดุฑุญ ุฃุตูุงุ
[25/03/2024, 4:04:20โฏAM] ~โฏAbdulkader: ูููุง ุงููุงุฏุฉ ุนุจุงุฑุฉ ุนู ุจุฑูุฌูุช
[25/03/2024, 4:05:47โฏAM] ~โฏMohamad Noureddine: ูู ุงููู ุงุฎุชุงุฑ ููุง ุงู framework ููู ูุงู ูุดุฑุญูุง
[25/03/2024, 4:06:08โฏAM] ~โฏAbdulkader: ุงูุด ุงูframework ุงูู ุงุดุชุบูุชูุง ูููุง
[25/03/2024, 4:06:56โฏAM] ~โฏMohamad Noureddine: Mojolicious
[25/03/2024, 4:09:19โฏAM] ~โฏAbdulkader: ูุง ุฒููุฉ ูุงุนุฏูู ุจูุฌูุจูููุง frameworks ุญุชู ุงูุฌู ุงูุฃุฒุฑู ูุง ุณูุน ูููุง
[25/03/2024, 5:04:34โฏAM] Majoody: Dr. Sim Hiew Moi
[25/03/2024, 5:04:43โฏAM] Majoody: ุงูุฏูุชูุฑุฉ ุงูุทูุจุฉ ูุฐู ููุง ุฑูููุฏุง ุ
[25/03/2024, 5:05:36โฏAM] ~โฏSMA: ุฑูููุฏุง
[25/03/2024, 5:06:40โฏAM] ~โฏSalman Alameer: ุงู ูุณุงุนุฏู ูุงุงุฎูุงู๐๐
[25/03/2024, 5:13:04โฏAM] ~โฏMoath_Mo.dev: ูููู ุชุญุชุงุฌ ููุงููู ูู ุงูุฏูุชูุฑ ุ ุงุฑุณููุง ููุฏุงู ุฑูุญุงูู
[25/03/2024, 6:51:31โฏAM] ~โฏAbdulkader: ุงูุดุจุงุจ ุงูู ูุฎูุตูู fyp ุฃููุฏููุงุ
ุฃุฎุฐุชูุง research ููุง system development + ุงูุณุจุจุ
[25/03/2024, 6:53:05โฏAM] ~โฏMohamad Noureddine: Undergrad student have to register a lot of subject. And at the same time if the student choose research based during undergrad, it will take a lots of time to understand the research gap, and the research itself.

Different with doing postgrad (master or PhD), student are narrow to their research topic, and no need to other subject.

That is the challenge if u choose by research during undergrad VS postgrad.
โ[25/03/2024, 9:43:08โฏAM] ~โฏAbdullah Al-Shateri: โ<attached: 00000174-PHOTO-2024-03-25-09-43-08.jpg>
โ[25/03/2024, 2:00:02โฏPM] ~โฏRami: โ<attached: 00000175-PHOTO-2024-03-25-14-00-02.jpg>
[25/03/2024, 2:00:32โฏPM] ~โฏRami: ูู ุงุญุฏ ูุนุฑููู
[25/03/2024, 9:09:53โฏPM] Abdullah Neighbor: ุงูุณูุงู ุนูููู 
ูู ุงุญุฏ ููุง ุฏุงุฎู ูุชูุฑู ุจุฑููุฑุงููุฌ ุณูุดู ูฃ ุงู ูคุ
โ[25/03/2024, 9:19:26โฏPM] ~โฏุนุจุฏุงููู ุงููุธุงุฑู: โ<attached: 00000178-PHOTO-2024-03-25-21-19-26.jpg>
[26/03/2024, 12:41:37โฏAM] ~โฏOmar ABasset: ูุนูููู ุงูุณูุงู
ุงูุง ุณูุดู ูฃ
โ[26/03/2024, 4:10:10โฏAM] ~โฏWalid: โ<attached: 00000180-PHOTO-2024-03-26-04-10-10.jpg>
[26/03/2024, 4:10:17โฏAM] ~โฏWalid: ุงุญุฏ ุงุฎุฐ ูุนุงู ูุจู ูุฐุงุ
[26/03/2024, 6:12:17โฏAM] ~โฏAbdulkader: ุดุจุงุจ ููู ุฃุญุฏ ุบูุฑ ุชุฎุตุตู ูู ุงูุฌุงูุนุฉ ูู ูุจูุ
ุฑุฌุงุกู ูููููู ุฎุงุต
[26/03/2024, 6:25:05โฏAM] ~โฏSMA: Dr. Alif Ridzuan bin Khairuddin ุดุจุงุจ ุญุฏ ูุนุฑู ูุฐุง ุงูุฏูุชูุฑ
[26/03/2024, 6:26:38โฏAM] ~โฏAhmed Marwan: ุดุฑุญ ุนุงุฏู 
ุฏุฑุฌุงุช ูุนุทูู ุญูู
[26/03/2024, 6:47:24โฏAM] Amr Al-waeli: ุตุญูุญ
[26/03/2024, 10:51:44โฏAM] ~โฏAkram ALI: ุงูุณูุงู ุนูููู ูุงุดุจุงุจ 
ููู ูุฐู ุงูุฏูุชูุฑู Dr. Layla Rasheed Abdallah Hasan
[26/03/2024, 11:58:25โฏAM] ~โฏ.: .
[26/03/2024, 11:59:02โฏAM] ~โฏ.: @601169357499
[26/03/2024, 11:59:06โฏAM] ~โฏ.: ุงูุณูุงู ุนูููู
โ[26/03/2024, 11:59:42โฏAM] ~โฏ.: โ<attached: 00000190-PHOTO-2024-03-26-11-59-42.jpg>
โ[26/03/2024, 12:00:00โฏPM] ~โฏ.: โ<attached: 00000191-PHOTO-2024-03-26-12-00-00.jpg>
[26/03/2024, 1:36:05โฏPM] ~โฏAhmed Marwan: Rozilawati
[26/03/2024, 7:40:46โฏPM] ~โฏ.: ูููู ุฅุฌุงุจุฉ ูุง ุดุจุงุจ๐ุ
[26/03/2024, 7:41:59โฏPM] ~โฏ.: .
[26/03/2024, 8:36:48โฏPM] ~โฏ.: ุทูุจ ุดูุฑุง๐๐
โ[26/03/2024, 9:02:21โฏPM] ~โฏNaif: โ<attached: 00000196-PHOTO-2024-03-26-21-02-21.jpg>
[27/03/2024, 4:32:32โฏAM] Abdullah Neighbor: ูุนูููู ุงูุณูุงู 
ุทูุจู ุจุณ ุดุฏูุฏู ุฎุงุตู ุจุงูุจุฑูุฌูุช
[27/03/2024, 5:01:56โฏAM] ~โฏSalem: App dev: 
ุงูุฅูุฌุงุจูุงุช:โ
ูก- ุจูููู ูุนู ุจุฑูุฌููุช ูููุฏู ุจุนุฏูู ูู ุงูุณู-ูู (ุงูุถู ููู ูุงูู ูููู ูู ุณูู ุงูุนูู)

ูข- ุจูููู ุนูุฏู ููู ูุงูู ูููุดุฑูุน ูุฃูู ุงูุช ุงูู ูุงุชุจู ู ุงูุจุฑูุฒูุชูุดู ุจูููู ุณูู ุนููู

ูฃ-ุชูุฏุฑ ุชุฎุชุงุฑ ุงููุบู ุงูู ุชุญุจูุง ุชุดุชุบู ุนูููุง

ุงูุณูุจูุงุช:โ
ูก-ุจุชุดุชุบู ุนูู ุญุงุฌุชูู ูู ููุณ ุงูููุช ุงูููุฏ ู ุงูุฑูุจูุฑุช
ูข- ุงุฐุง ุงูุช ุทุงูุจ ุณููุชููุฑ ุงูุฑูุจูุฑุช ุจูููู ุทููู ุฌุฏุงู ุจุณุจุจ ุงู srs ,sdd,std

Research :
ุงูุฅูุฌุงุจูุงุช:โ
ูก-ุบุงูุจุงู ุงูุฏูุชูุฑ ุจูุนุทูู ูุณุชู ููุงุถูุน ุชุฎุชุงุฑ ูููุง

ูข- ุจุชุดุชุบู ุนูู ุงูุฑูุจูุฑุช ูู ุงูุฃุบูุจ ูุฅุฐุง ูุงู ูู ุงููุงุฏ ุจุชููู ููููุฉ 

ูฃ- ุงูุถู ูู ุงุฐุง ุญุงุจุจ ุชููู ุงูุงุฏููู(ุฏุฑุงุณุงุช ุนููุง)

ูค-(chatgpt) ุจูุณุงุนุฏู ูุซูุฑ ูู ุชูุฎูุต ุงูุฃุจุญุงุซ ุงูู ุจุชูุฑุฃูุง

ุณูุจูุงุช:โ
ูก- ุงูููุงุถูุน ุงูู ุจูุนุฑุถูุง ุงูุฏูุชูุฑ ูููู ูุง ุชูุงุณุจู ูุตุนุจ ููุจู ููุถูุน ูู ุนูุฏู(ูุนุชูุฏ ุนูู ุงูุฏูุชูุฑ)

ูข-ูู ุงูููุงูุดุฉ ุงุญุชูุงู ุงูุฏูุงุชุฑุฉ ูููู ุนูุฏูู ุฎูููุฉ ูู ููุถูุน ุจุญุซู ูุฅุญุชูุงู ูุณุชูุนุฏูู ูู ุงูุซุฑ ูู ุงู app dev

ูฃ- ุงูุฑูุณูุฑุด ุฎุตูุตุงู ููุถู ุงูุณูุจุฑูุงูุฒุฑ ูููู ูุชุงุจุน ูุนู ุงูู ุจุฃูู(ุงูุฏูุงุชุฑุฉ ุงูู ูุณูููู ุจูุฌูุจูู ููู ุงูุนูุฏ)

ูค- ูุงุฒู ุชูุฑุฃ ุงุจุญุงุซ ูุซูุฑ ูุฅุฐุง ุงูุช ูู ุงููุงุณ ุงูู ุชูู ุจุณุฑุนุฉ ูููู ูุง ููุงุณุจู โ<This message was edited>
[27/03/2024, 5:03:10โฏAM] ~โฏAbdulkader: ูุนุทูู ุงูุนุงููุฉ ุดุฑุญ ูุงูู ููุงูู
[27/03/2024, 5:03:55โฏAM] ~โฏAbdulkader: ุณูุจูุฉ ุฑูู 2 ูู ุงูdevelopmentุ
ูู ุทููู ูุนูู ุชูุฑูุจุง ุจูููู
[27/03/2024, 5:04:24โฏAM] ~โฏYousef Khaled: 100+ ุตูุญู
[27/03/2024, 5:04:31โฏAM] ~โฏSalem: ูุงุจูู ูกูฃู ุงูู ูขูฅู ุตูุญุฉ โ<This message was edited>
โ[27/03/2024, 5:05:24โฏAM] ~โฏูุญูุฏ: โ<attached: 00000203-STICKER-2024-03-27-05-05-24.webp>
[27/03/2024, 5:05:40โฏAM] ~โฏSalem: ุงูุด ูุฒุนูู ุงูุช ููุชููุฑู๐
[27/03/2024, 5:05:59โฏAM] ~โฏูุญูุฏ: ูุนูู ุงุญูุง ุงูู ู ูุฌูู ุตูุญุงุชุ โ<This message was edited>
[27/03/2024, 5:06:04โฏAM] ~โฏSalem: ูุจ
[27/03/2024, 5:31:26โฏAM] ~โฏLoai: ูุฃูู ุณูุนุช ุฏูุชูุฑุฉ hazina ุชููู around 60 pages?
[27/03/2024, 5:31:46โฏAM] ~โฏLoai: ููู ุงู briefing
[27/03/2024, 5:34:20โฏAM] ~โฏAbdulkader: ุฃุชููุน ุฐุง ุงูุฌุฒุก ุงูุฃูู ๐
[27/03/2024, 5:35:52โฏAM] ~โฏLoai: ุฎูู ุงูุณููููุฑุฒ ุงููุชุฎุฑุฌูู ูููุฏููุง ุญุงุณุณ ููุณู ุจููุจุฏ๐
[27/03/2024, 6:18:19โฏAM] Hamdan Saleh: ุงูุณูุงู ุนูููู ูุงุฑุฌุงู 
Dr. Nur Zuraifah Syazrah binti Othman 
ููู ุฐู ุงูุฏูุชูุฑูุ
[27/03/2024, 6:41:16โฏAM] ~โฏAbdulkader: ูุนูููู ุงูุณูุงู ูุฑุญูุฉ ุงููู ูุจุฑูุงุชูุ
ุงูุฏูุชูุฑุฉ ุชููููุง ูููุง ูุซูุฑ ููู ููุชุงุฒุฉ ูู ููุงุฏ ุงูweb ูุงูHCI
[27/03/2024, 6:41:25โฏAM] ~โฏAbdulkader: ุชุฎุตุตูุง ูู ุงูููุจ
[27/03/2024, 6:41:55โฏAM] Hamdan Saleh: ุจุดุฑู ุงููู ุจุงูุฎูุฑ๐ป
[27/03/2024, 6:43:13โฏAM] ~โฏAbdulkader: ุฃุฌูุนูู ุฅู ุดุงุก ุงููู
[27/03/2024, 6:43:44โฏAM] ~โฏAbdulkader: ูู ุณูุงุก ุงูุฏูุชูุฑ ูููุณ ููุง ุณูุฆ ุงูุช ูุงุฒู ุชุฏุฑุณ ุงููุงุฏุฉ ุจููุณู
[27/03/2024, 6:44:31โฏAM] ~โฏAbdulkader: ุงูููู ุงููุงุญุฏ ูุจุบู ุงูุฏูุชูุฑ ุงูู ููุณูุชู ูููุณุฉ ููุชูุจู ุจุนุถ ุงูุฃุฎุทุงุก ุงูุจุณูุทุฉ ููุง ูุนูุฏูุง ุนูู ุงูุทูุงุจ ููู ูุง ูู ูุนูุฏุฉุ 
ูุฐุง ูุนูุงุฑ ุงุฎุชูุงุฑ ุงูุฏูุงุชุฑุฉ
[27/03/2024, 8:25:27โฏAM] ~โฏNaif: ูู ุงุญุฏ ููุฏุฑ ูููุฏูู ุนู ุฐุงุ
[27/03/2024, 9:50:42โฏAM] ~โฏYousef Khaled: ููุงู ุณุงูู ูุง ุนุฌุจู ูุนูู ๐
[27/03/2024, 9:51:38โฏAM] ~โฏAhmed Marwan: Assalamualaikum and have a nice day,

Dear students,

Kindly please be informed that the Deputy Dean has decided to maintain only 5 sections for the course Technopreneurship Seminar (SECD3761). So sections 01-05 will be available this semester. If you are registered section 06 until 11, please change your section in the system. Only this can be done by the student UTM Portal as the system now blocks us in the Academic Office from helping students manually.

Thank you.

"MALAYSIA MADANI"
 โBERKHIDMAT UNTUK NEGARA KERANA ALLAHโ

I, who uphold trust,

Rohani binti Mohd Zain (Ms. Hanie)
Faculty of Computing
[27/03/2024, 10:37:03โฏAM] ~โฏAmmar Khaled: ุจุฎุตูุต ุงูููุชููุฑู 100 ูุญุฏ ุงูุตู
[27/03/2024, 10:46:55โฏAM] ~โฏM.Alkhatib: PSM 1 80 max
PSM 2 100 max
[27/03/2024, 10:52:49โฏAM] ~โฏLoai: ูุง ููุช ุนุงุฑู ุงูู ุณููููุฑ ุงููุนุฐุฑุฉ๐
[27/03/2024, 10:57:27โฏAM] ~โฏYousef Khaled: ุงูููู
[27/03/2024, 10:57:49โฏAM] ~โฏYousef Khaled: @971561089911 ูู ููุงูู ู ุจูุดููุง ูู
โ[27/03/2024, 10:57:58โฏAM] ~โฏYousef Khaled: โ<attached: 00000226-STICKER-2024-03-27-10-57-58.webp>
[27/03/2024, 10:58:08โฏAM] ~โฏLoai: ุฑูุถุงู ูุง ููุณู๐
[27/03/2024, 10:58:24โฏAM] ~โฏYousef Khaled: ๐๐
[27/03/2024, 11:00:03โฏAM] ~โฏMo3taz Al-Shater: ุงุญุญุญุญุญุญุญุญุญ ูุบูุท ุนูู ุงูุณููููุฑ ุฐุง
โ[27/03/2024, 11:00:51โฏAM] ~โฏLoai: โ<attached: 00000230-STICKER-2024-03-27-11-00-51.webp>
[27/03/2024, 11:14:00โฏAM] ~โฏAbdulkader: ูู ูุงูุชุตุนูุฏ
โ[27/03/2024, 12:17:30โฏPM] ~โฏSalem: โ<attached: 00000232-STICKER-2024-03-27-12-17-30.webp>
[27/03/2024, 12:18:30โฏPM] ~โฏSalem: ูู ุตุฏู ุงูุง ูุงูู ููุง ุงูู ูุทูุงุจ ุงูุณููุชููุฑ
[27/03/2024, 12:18:44โฏPM] ~โฏSalem: ููู ุงุฐุง ููุชููุฑู ุงู ุบูุฑุฉ ุจูููู ุงูู
[27/03/2024, 1:00:22โฏPM] ~โฏRami: ุงูุณูุงู ุนูููู ุ ุฏุงูุฑ ุฃุณุฃู ูู ูุงุญุฏ ุฃุฎุฐ credits ูุซูุฑ ูู ุณูุณุชุฑ ู ุงุฎุฏ ุดูุฑุช ุณูุณุชุฑ ูู ูููู ุชุฎูุต ูู ุงูู ูู ุงุฑุจุนู ุณููุงุช ููุง ูุณุชุญูู .
[27/03/2024, 1:38:39โฏPM] ~โฏAhmed Marwan: ุงูููุถูุน ุตุนุจ ูุงู ููุงุฏ ุงู short semester  ุชุชุญุฏุฏ ุนุดูุงุฆูุงู ุญุณุจ ุนุฏุฏ ุงูุทูุงุจ ููู ูุงุฏู
+ูู ูุฑู ุณูุนุช ุงูู ูู ูุงุณ ุชูุงุฌู ูุดุงูู ูู ุณูู ุงูุนูู ุงุฐุง ูุงูุช ุฏุฑุงุณุชูู ุงูุฌุงูุนูู ุงูู ูู 4 ุณููุงุช
[27/03/2024, 4:04:09โฏPM] ~โฏAbdulkader: ุฃุญุจ ุฃูุฌู ุฑุณุงูุฉ ููjuniors ุงููุณุชูุจูููู ุงูู ุฑุงุญ ูุงุฎุฐูุง ุนููู ุญุงุณุจ ูู ุงูุฌุงูุนุฉ.

ูุฐุง ุงูููุงู ุจุนุฏ ูุง ูุฑูุช ูู ุณูุณุชุฑ 5 ูุงูุญูู ูู ุงูุณุงุฏุณ ูุดูุช ุงูุจูุฆุฉ ูู ุญููู.

ูุง ุชุถูุนูุง ููุชูู ููููุณูู ูุชุฏุฎููุง ุชุฎุตุต
 Graphics & Multimedia.

โข ุงูุบุงูุจูุฉ ุงูุนุธูู ููู ุทูุงุจ localุ ูุญุถุฑุงุชูู ูุฑูุถูุง ููุจููุง ุทุงูุจ international ูุฏุฑุณ ูุนุงูู ุฃู ูุฏุฎู ูุฌููุนุชูู ุนุดุงููู ูููุฑููุง ูููุง ูุณูุงููู ููุง ูุดุชุบูุ ูุงููุฌููุนุงุช ูู ุฃูู ุดู ูููู ุงููุงุญุฏ ูุญุชุงุฌู ูู ุงูุฑุญูุฉ ุงูุฏุฑุงุณูุฉุ ุฎุตูุตูุง ูู ุชุฎุตุต ูุณุจุฉ ุฏุฑุฌุฉ ุงูุจุฑูุฌูุช ููู ุฃุญูุงููุง ุฃูุซุฑ ูู ูุณุจุฉ ุงููุงููู. 
ุนุฏุฏ ุงูุทูุงุจ ุงูinternational ูู ุฏูุนุชู ูุง ูุง ูุฒูุฏ ุนู ุนุฏุฏ ุฃุตุงุจุน ุงููุฏูู.

โข ุดูุนูุจ ุงูููุงุฏ ุนุฏุฏูุง ุฃููุ ููููู ูุญุธูุธูู ูู ุฌุฏูู ุงูุณูุณุชุฑ ูุงู ูุญุชุฑู

โข ุงูุงุฎุชุจุงุฑุงุช ุงูููุงุฆูุฉ ูููุงุฏูุง ูุญุทููุง ุบุงูุจูุง ุขุฎุฑ ููู ูู ุดูุฑ ุงููุงูููุฒุ ูุงุญูุง ุขุฎุฑ ูุงุณ ุชุฎูุต.

โข ููุงุถูุน ุงูfyp ุฃุบูุจูุง ุจุญุซูุฉุ ูุงูdevelopment ููู ุนุจุงุฑุฉ ุนู ูุฌุงูุงุช ูframeworks ุฃูู ูุฑุฉ ุชุณูุน ูููุง ููููู ูุง ุฑุงุญ ุชุณุชุฎุฏููุง ูุฑุฉ ุซุงููุฉ.

ูุง ุฃุนุฑู ููู ูุฐู ุงูุฑุณุงูุฉ ุจุชูุตูููุ ุจุณ ุงุญูุง ุฌุฑุจูุง ุงูุณูุฆ ูุฌููุง ูุชููู ุนูู ุนูู ุฃุณุงุณ ุงูู ุจุนุฏูุง ูุตูุฑ ุนูุฏูู ุฎุจุฑ. 

ุดูุฑูุงุ ููุงู ุงููู ูู ุนูู ุงูุฌููุน. โ<This message was edited>
[27/03/2024, 4:06:38โฏPM] ~โฏ.: ูุนุทูู ุงูุนุงููุฉ ุนูู ุงููุนูููุฉ ุงููููุฉ ๐ซก
[27/03/2024, 4:07:51โฏPM] ~โฏAbdulkader: ูู ุงูุฎุฏูุฉ.
[27/03/2024, 4:15:31โฏPM] ~โฏNaif: ุจูุถ ุงููู ูุฌูู
[27/03/2024, 4:15:50โฏPM] ~โฏAbdulkader: ูุฌูู ุฃุจูุถ
[27/03/2024, 5:31:25โฏPM] Majoody: ุดุจุงุจ ููุงุฏ psc ุถุฑูุฑู ุงุณุฌููุง ูุฐุง ุงูุณูุณุชุฑุ
[27/03/2024, 5:31:29โฏPM] Majoody: ููุง ุงูุฏุฑ ุงูุณูุฉ ุงูุฌุงูุฉ ุ
[27/03/2024, 5:31:42โฏPM] Majoody: ุงูุง ุณูุณุชุฑ ุฎุงูุณ ุญุงููุง
[27/03/2024, 5:34:27โฏPM] ~โฏLoai: ูู ุนูุฏู ูุฌุงู ุชุฃุฎุฐ ูู ูุงุฏุฉ ุฎุฐูู.

ุจุนุถ ููุงุฏ ูุชุงุญุฉ ููุท ูุขุฎุฑ ุณูุฉ ุฃู ุขุฎุฑ ุณูุณุชุฑ. ููููู ุชุฃุฎุฐ ูุฐุง ุงูุณูุณุฑ ูุงุฏุฉ ุฃู ูุงุฏุชููุ ู ุงูุณูุชุณุฑุงุช ุงููู ุจุนุฏูุง ููุณ ุงูุดู ููู ุชุฎูุต ุงู 5 ููุงุฏ.
[27/03/2024, 5:35:37โฏPM] Majoody: ูู ูุง ุฃุฎุฐุช ููุง ูุงุญุฏุฉ ุญุงููุง
[27/03/2024, 5:35:42โฏPM] Majoody: ูู ุจูุงุฌู ูุดุงูู ูุณุชูุจูุง ุ
[27/03/2024, 5:35:54โฏPM] ~โฏM.Bajameel: ูุง
[27/03/2024, 5:36:07โฏPM] ~โฏM.Bajameel: ุงูุง ูุง ุงุฎุฐุชูุง ุงูุง ูู ุณูุณุชุฑ 7
[27/03/2024, 5:36:41โฏPM] ~โฏLoai: ุฃูุง ุณูุณุชุฑ ุณุงุฏุณ ู ูุง ููุช ุนุงุฑู ุนู ููุถูุน ุงู psc. ุฐูุญูู ุฃุฎุฐุช 3 ููุงุฏ ู ุจุงูู ูุงุฏุชูู ุจูุฏุฑ ุฃุฎูุตูู ุจุณูุณุชุฑ ุณุงุจุน ู ุซุงูู ูุงูู ูุดููุฉ
[27/03/2024, 5:36:57โฏPM] Majoody: ุชูุงู ุญูููู ุฌุฒุงูู ุงููู ุฎูุฑ ุงุฎูุงูู ๐ค
[27/03/2024, 5:37:20โฏPM] ~โฏLoai: ุขููู ู ุฅูุงูู
[27/03/2024, 5:37:35โฏPM] ~โฏM.Bajameel: ุนูุฏู talent ุงูููุฑูุถ ูุงุชุงุฎุฐูุง ุฅูุง ูู ุณูุณุชุฑ 8 โ<This message was edited>
[27/03/2024, 5:38:01โฏPM] ~โฏAmar Hassan: ูุตุฏู Talent
[27/03/2024, 5:38:14โฏPM] ~โฏM.Bajameel: ูุจ ูุนููุด ุบูุทุช
[27/03/2024, 6:08:35โฏPM] ~โฏ.: ุงูุด ูู ููุงุฏ ุงู psc?
[27/03/2024, 6:08:43โฏPM] ~โฏ.: ุฃูุตุฏ ูุนูุงูุง ุดูู
[27/03/2024, 6:21:29โฏPM] ~โฏLoai: Professional skills courses
[28/03/2024, 3:00:40โฏAM] ~โฏSMA: ุงูุณูุงู ูุนูููู ุดุจุงุจ ุญุฏ ูุงุฎุฐ web technology ุณูุดู 5 ?
[28/03/2024, 6:41:09โฏAM] ~โฏAbdulkader: ุงูamendment ูุงุชุญ ุงูุฃุณุจูุน ุงูุฌุงูุ
[28/03/2024, 6:41:28โฏAM] ~โฏOmar ABasset: ูุจ
[28/03/2024, 6:41:32โฏAM] ~โฏOmar ABasset: ุงููู 6 ุงุจุฑูู
[28/03/2024, 6:41:45โฏAM] ~โฏAbdulkader: ุชูุงู ุดูุฑูุง
[28/03/2024, 6:53:23โฏAM] ~โฏA.: ุณูุงู ุดุจุงุจ

ุจุงููู ุงุญุฏ ูุฏ ุงุฎุฐ ุงู ุณุฌู excel ุญู ุงูpscุ
[28/03/2024, 6:57:19โฏAM] ~โฏ.: โThis message was deleted.
[28/03/2024, 6:57:21โฏAM] ~โฏ.: ุงูุณูุงู ุนูููู
[28/03/2024, 6:58:12โฏAM] ~โฏ.: ุงู ุฏูุชูุฑ ุฃูุถู ูู ุงู digital?
AHMAD FARIZ BIN ALI
NORFAZRINA
[28/03/2024, 7:32:13โฏAM] ~โฏMoqbel: ูุนูููู ุงูุณูุงู
[28/03/2024, 7:32:57โฏAM] ~โฏMoqbel: Ahmed Fariz ุงุฎุฐุช ูุนุงู ุทูุจ ูุดุฑุญู ุนุงุฏู ูุงูุฏุฑุฌุงุช ูููุณู
[28/03/2024, 7:33:52โฏAM] ~โฏ.: ุทูุจ ุดูุฑุง ูู๐
[28/03/2024, 10:47:57โฏAM] Abdullah Neighbor: ุงูุณูุงู ุนูููู
[28/03/2024, 10:48:15โฏAM] Abdullah Neighbor: ูุงุดุจุงุจ ูููู ุงุญุฏ ูุฑุณู ุฌุฏูู ุงูููุงุฏ ุงูู ูุฏุฑุณูุง ุงูุทุงูุจ ุฎูุงู ุงููค ุณููุงุช
[28/03/2024, 10:49:24โฏAM] ~โฏAbdulkader: ุงูุชุจ 
[X] Course Menu - UTM

ุบููุฑ X ุจุงุณู ุชุฎุตุตู ุงูุฑุณูู
โ[28/03/2024, 11:08:05โฏAM] ุฃุณุงูุฉ ุงูุญุณุงู ูุงููุฏูุดู: โ<attached: 00000274-PHOTO-2024-03-28-11-08-05.jpg>
โ[02/04/2024, 6:45:14โฏAM] ~โฏAhmed Marwan: โ<attached: 00000275-PHOTO-2024-04-02-06-45-14.jpg>
โ[02/04/2024, 6:46:32โฏAM] ~โฏAhmed Marwan: โ<attached: 00000276-PHOTO-2024-04-02-06-46-32.jpg>
[02/04/2024, 6:47:03โฏAM] ~โฏYousef Khaled: ุจุฑู ูุชุฃูุฏ ูุฐุง ุฏูุชูุฑ ๐
[02/04/2024, 6:47:26โฏAM] ~โฏSMA: ุดููู ูุทููุจ ๐ฟ
โ[02/04/2024, 6:49:55โฏAM] ~โฏAhmed Marwan: โ<attached: 00000279-PHOTO-2024-04-02-06-49-55.jpg>
[02/04/2024, 7:01:13โฏAM] ~โฏAbdullah Yaser Alnadhari: ๐
[03/04/2024, 1:54:19โฏAM] ~โฏSalman Alameer: ุณูุงู ุนูููู 
ุงูุงูุฏูููุช ุณูุฑุ ูุด ุงูููุฑูุถ ูููู ููุชูุญ ูููู ูคุ
[03/04/2024, 2:13:45โฏAM] ~โฏM.Bajameel: ุชูุฏุฑ ุชุฑูุญ ูู ุงูุงูููุณ ูุชุนุจู ุงูููุฑู
[04/04/2024, 2:57:36โฏAM] ~โฏAbdulkader: ุงูุณูุงู ุนููููุ ููู ุนูุฏู ุทุงุจุนุฉุ  ุฃุญุชุงุฌ ุฃุทุจุน ูุฑูุฉ ูุงุญุฏุฉ ูุจู ุงูุณุงุนุฉ 9 ููุงูู ููุง ููุชุจุฉ ูุงุชุญุฉ.

ุฃู ุงูู ูุนุฑู ููุชุจุฉ ุชูุชุญ 8 ุงูุตุจุงุญ ูุงููุช ูุนุทููู ุฎุจุฑ
[04/04/2024, 3:03:26โฏAM] ~โฏA.: ูู ุทุงุจุนู self service ูู ุงููููู ุงูุฏูุฑ ุงูุงูู ููู ุชูุฏุฑ ุชุทุจุน ููุงู ุฏุงุฆูุง ุดุบุงูู
[04/04/2024, 3:07:28โฏAM] ~โฏAbdulkader: ูู N28ุ
[04/04/2024, 3:08:07โฏAM] ~โฏmotu: yup, it's like a kiosk machine, you download an app and connect to it
[04/04/2024, 3:08:15โฏAM] ~โฏMo3taz Al-Shater: ูุจ student lounge
โ[04/04/2024, 3:10:24โฏAM] ~โฏA.: โ<attached: 00000288-PHOTO-2024-04-04-03-10-24.jpg>
[04/04/2024, 3:23:59โฏAM] ~โฏAbdulkader: ุนุฌูุจ
[04/04/2024, 3:24:01โฏAM] ~โฏAbdulkader: ูุง ูุงูุช ูุจู
[04/04/2024, 3:24:06โฏAM] ~โฏAbdulkader: ูุนุทููู ุงูุนุงููุฉ
[04/04/2024, 3:29:22โฏAM] ~โฏYoussey Tahoon: ุงูุณูุงู ุนูููู ูุง ุดุจุงุจ ูู ุงุญุฏ ูุนุฑู ููู ูุธุงู ุงูattendence report ุงูุฌุฏูุฏ ุงููู ูุงุฎุฏู ุนุดุงู ุชุฌุฏูุฏ ุงูููุฒุงุุ
[04/04/2024, 3:32:27โฏAM] ~โฏใ โโข โกฬฌฬฉฬะดฮฒฦกวชฦกฤยฒยบยนยณ: ุชุฑูุญ ุชุงุฎุฐ ูุฑูู ูุชุฑูุญ ุนูุฏ ูู ูููุดุฑ ูุชุฎููู ูููุน ูู ุจุนุฏูู ุชุฑุฌุน ุนูุฏ ุฑูุญุงูู ููู ุชุนุทูู ุงูุฑูุจูุฑุช
[04/04/2024, 3:33:27โฏAM] ~โฏใ โโข โกฬฌฬฉฬะดฮฒฦกวชฦกฤยฒยบยนยณ: ูุฐุง ุงููุธุงู ุงูุฌุฏูุฏ ุงูู ุงุนุฑูู ุจุงูู ุงุชุงูุฏ ๐
[04/04/2024, 3:55:23โฏAM] ~โฏYoussey Tahoon: ูุงููู ูุทูู๐
ุทูุจ ุงูุง ุญุงููุง ุจุฑุง ูุงููุฒูุง ูุง ูู ุงู ุทุฑููู ุงุฌูุจู ูุงูุง ุจุฑุงุ
[04/04/2024, 3:55:43โฏAM] ~โฏYoussey Tahoon: ุฌุฑุจุช ุงุฑุณู ุงูููู ูุฑูุญุงูู ุจุณ ูุง ูู ุงู ุฑุฏ ูููุง๐
[04/04/2024, 4:07:04โฏAM] ~โฏSalman Alameer: ุฑุณู ุงูููุฑู ููุฏูุงุชุฑู ููู ูุงุญุฏ ุจูููุนูุง ูุด ุถุฑูุฑู ุชุฑูุญ ููู
[04/04/2024, 4:22:23โฏAM] ~โฏMohamad Noureddine: ุดุจุงุจ ููู ุงูุฌุฑูุจ ุจุงููู
[04/04/2024, 5:16:21โฏAM] ~โฏSalman Alameer: ุณูุงู ุนูููู

ุงุญุฏ ุนูุฏู ุงูููู ุงูู ุดุบุงููู ุจุงูุงูุงุฏูู ุงูููุณุ
[04/04/2024, 5:17:03โฏAM] ~โฏ.: nurulaida@utm.my
[04/04/2024, 5:17:22โฏAM] ~โฏSalman Alameer: ูุนุทูู ุงูุนุงููู
โ[04/04/2024, 5:17:35โฏAM] ~โฏMohamad Noureddine: โ<attached: 00000302-PHOTO-2024-04-04-05-17-35.jpg>
[04/04/2024, 5:17:54โฏAM] ~โฏ.: ุจุณ ุงูููู ุงูุฏูุงู ุจุฎูุต ุจุฏุฑูุ ุญุงูู ุฃุฑุณููู ุงูุขู
[04/04/2024, 5:17:59โฏAM] ~โฏ.: ุงููู ูุนุงููู
[04/04/2024, 5:18:12โฏAM] ~โฏM.Bajameel: โThis message was deleted.
[04/04/2024, 5:18:19โฏAM] ~โฏAhmed Marwan: โThis message was deleted.
[04/04/2024, 5:19:44โฏAM] ~โฏM.Bajameel: ุดุจุงุจ ุงุญุฏ ูุฑุณู ุงุฎุฑ ุฌุฏูู ููุณูุงุดู
[04/04/2024, 5:20:18โฏAM] ~โฏAhmed Marwan: https://docs.google.com/spreadsheets/d/1xgW-jcamGvHqhjpjssYxIIjwpONtvdEP/edit#gid=316224423
[04/04/2024, 5:20:34โฏAM] ~โฏM.Bajameel: ุดูุฑุงู ๐น
[04/04/2024, 5:21:21โฏAM] ~โฏAhmed Marwan: ุญุจูุจ
[04/04/2024, 6:16:58โฏAM] ~โฏM.Bajameel: Radziah binti Mohammed 
ููููุง ุ
[04/04/2024, 6:25:31โฏAM] Abdullah Neighbor: โThis message was deleted.
[04/04/2024, 6:26:27โฏAM] Majoody: ุงูุฏูุชูุฑุฉ ููุชุงุฒุฉ ูุชุดุฑุญ ูููุณ ูุงูู ุจุชุชุนุจู ุดููุฉ ูุนูุง ุ ุงููุงุฏุฉ ูู ุจุชุงุฎุฐูุง ูุนูุง ุชุญุทูุง ุชุญุช ุงูุชูุงูู ุนุดุงู ุชุงุฎุฐ ุฏุฑุฌุฉ ุทูุจุฉ
[04/04/2024, 7:56:44โฏAM] ~โฏYousef Khaled: best lecturer in the software department
[04/04/2024, 7:57:05โฏAM] ~โฏYousef Khaled: but u have to pay attention in her classes because she is a bit strict
[04/04/2024, 9:00:08โฏAM] ~โฏAbdulkader: ุดุจุงุจ
[04/04/2024, 9:00:22โฏAM] ~โฏAbdulkader: ุจุงูู ููุฏู ุงููุงุญุฏ ูุณุฌู ูุงุฏุฉ ุจุนุฏ ูุง ููุชูู ุงูamendmentุ
[04/04/2024, 9:14:41โฏAM] ~โฏMohamad Noureddine: ูุจ ุจุณ ุชุฏูุน 50 ุฑูุฌุช ุนูู ูู ูุงุฏุฉ
[04/04/2024, 9:28:13โฏAM] ~โฏAbdulkader: ูุญุฏ ุฃู ุชุงุฑูุฎุ
[04/04/2024, 1:44:49โฏPM] ~โฏM.Bajameel: ุงูููู ุณุฃูุช ุงูุฃูููุณ ูุงููุง ููุณุจุช ุงูุฌุงู
[04/04/2024, 2:14:17โฏPM] ~โฏAbdulkader: ูุนุทูู ุงูุนุงููุฉ
[04/04/2024, 2:20:43โฏPM] ~โฏHamza: โ~โฏSalman Alameer added ~โฏHamza
[07/04/2024, 10:09:32โฏPM] ~โฏOmar ABasset: ุงูุณูุงู ุนูููู
ุงูุงุฏูููู ุงูููุณ ููุชูุญ ุงููููุ
[07/04/2024, 10:28:53โฏPM] ~โฏAbdulkader: ุงููุฉุ
ููู ูุงููุง ุจูุชูููุ
[07/04/2024, 10:29:09โฏPM] ~โฏOmar ABasset: ูุงุ ุจุณ ุงุชุงูุฏ ุนุดุงู ุงูุนูุฏ
[07/04/2024, 10:29:28โฏPM] ~โฏAbdulkader: ุจุงูุนูุฏ ุจูุชููู ุฃููุฏ
[09/04/2024, 5:24:25โฏAM] ~โฏOmar ABasset: ุงูุณูุงู ุนูููู
ูู ุงุญุฏ ูุนุงู ุงูattendance form ูุงุถูุฉุ ุญู ุงูููุฒุง
[09/04/2024, 12:15:53โฏPM] ~โฏYoussey Tahoon: ุชูุฏุฑ ุชุจุนุช ุฅูููู ูุฑูุญุงูู ุชููููุง ุชุจุนุชูู ุงูููุฑูุ ูู ุจุชุฑุณููููู ุฌุงูุฒ ูุน ุงูููุงุฏ ุชุจุนู ูุงููุงุฏูู
[09/04/2024, 12:20:07โฏPM] ~โฏOmar ABasset: ูููุชูุงุ ูุงูุช ุงููุธุงู ุงูุงู ูุฏูู
[09/04/2024, 12:46:27โฏPM] ~โฏYoussey Tahoon: ุฎูุงุต ุงุธู ูุงุฒู ุชุฑูุญ ุชุณุฃููู ููุงู
[09/04/2024, 12:46:49โฏPM] ~โฏOmar ABasset: ูุจ
[09/04/2024, 1:37:26โฏPM] โช+60ย14โ721ย1804โฌ: โ~โฏSalman Alameer added โช+60ย14โ721ย1804โฌ
[12/04/2024, 2:55:48โฏAM] Ahmed Ghaleb: ุงูุณูุงู ุนูููู ูุฑุญูุฉ ุงููู ูุจุฑูุงุชู 

ูุง ุดุจุงุจ ููู ูููุง ุจุงููููุฉ ุนูุฏู ุฎุจุฑุฉ ุฃู ููุชู ุจุชุทููุฑ ุงูุฃูุนุงุจ๐๐พ

ูู ุนูุฏูุง ูุดุฑูุน open-source ุชุนุงููู ููุชุงุฒ ุจูุญุฑู Godot ููู ุญุงุจ ูุตูู ููุงุฑุงุชู ููุจุฑุฒูุง ูู ุงูCV. 

ุงููู ููุชู ูุฑุงุณููู ุฎุงุต๐ฅ
[13/04/2024, 5:26:16โฏPM] ~โฏM.Bajameel: ูุถูุงู ูู ููู ุงุญุฏ ุฑุงูุญ ุงูุงูุงุฏููู ุงูููุณ ุจูุฑุฉ ูุชูุงุตู ูุนู ุนูู ุงูุฎุงุต
[14/04/2024, 5:53:22โฏAM] ~โฏMoath_Mo.dev: ุณูุงู ุนูููู ุ ูู ุงุญุฏ ูุฏู ุน ุงูุชุฑุดูุจ ููุฎุจุฑูุ ูุงููุช ูููู ูุฑุณู ุชูุงุตูู
[14/04/2024, 6:00:53โฏAM] ~โฏMoath_Mo.dev: ูู ุงูุดุฑูุงุช ุงุตูุง ููุจูู ุงููุงุญุฏ ูุฏุฑุจ ูุจุนุฏูู ูุฏูุง ุดูุงุฏุฉ ุ
[14/04/2024, 7:04:46โฏAM] Amr Al-waeli: ูุนูููู ุงูุณูุงู ูุฑุญูุฉ ุงููู ูุจุฑูุงุชู 
ุงูุง ูุง ูุฏูุช ุนูู ุงูุชุฑุดูุจ ุจุณ ุงุดุชุนูุช ูุน ูุฐุง ุดุฑูู ูุฌุงุจูุง ูู ุดูุงุฏู ุฎุจุฑู 
ูุงููุธุงู ููุณู ุงูู ุชุชุฏุฑุจ ูุชุดุชุบู ูุนุงูู ูุจุนุฏูู ูุฌูุจูุง ูู ุงูุดูุงุฏู ููุง ุชุฎูุต
[15/04/2024, 11:30:12โฏAM] ~โฏุนูู ุจุงูุนููุจ: ุงูุณูุงู ุนูููู ูุฑุญูุฉ ุงููู ูุจุฑูุงุชู 
ูู ุงุญุฏ ูุณุชุฎุฏู ูุงุจุชูุจ asus ูู ุงูุจุฑูุฌุฉ ูููู ุงุฏุงุก ุงูุฌูุงุฒ ูุนุงู
[15/04/2024, 11:35:52โฏAM] ~โฏSalem: ุงูุฃุฏุงุก ุงููุฑ ูุซูุฑุฉ ุชุญููุฉ ุบูุฑ ุดุฑูุฉ ุงูุฌูุงุฒ ูุซู (ุงููุนุงูุฌ ุ ูุฑุช ุงูุดุงุดุฉ ุ ุงูุชุฎุฒูู ูู ูู ssd ุงู hdd) ุจุณ ุจุดูู ุนุงู ุงุฌูุฒุฉ asus ููุชุงุฒุฉ ูุชุทูู ูุนู ุจุณ ุงุชุฃูุฏ ูู ุงูููุงุตูุงุช ูุจู ุชุดุชุฑู
[15/04/2024, 11:45:43โฏAM] Majoody: ูุนู ูููุชุงุฒ ุฌุฏุง 
ูุงูู ูุซู ูุง ุฐูุฑ ุงูุงุฎ ูู ุจุณ ุชุทูุน ููุดุฑูุฉ.
ุงุณูุณ ุนูุฏูุง ูุซูุฑ ููุฏููุงุช ูููุง ุญูุช ุฃุฏุงุก ุงูุนุงุจ ููููุง ููุท ููุชุตุงููู ูููุฐุง
[15/04/2024, 11:46:47โฏAM] Majoody: ูุฎุฐ ูู ูุธุฑุฉ ุนูู ุณูุณูุฉ Asus Tuf Gaming 
ุงููุงุจ ุชูุจ ูุตูู ููุฃูุนุงุจ ูุณุนุฑู ููุจูู ู ูู ูุงุญูุฉ ุฏุฑุงุณุฉ ูุจุฑูุฌุฉ ูุง ูุงุฌูุช ููู ุงู ูุดุงูู
[15/04/2024, 12:10:23โฏPM] ~โฏYoussey Tahoon: ุญุงูู ุชุดูู Asus tuf ุฃุญุฏุซ ูุณุฎู
ุญุงููุง ุงูุถู ูุณุฎู budget ุชูุฏุฑ ุชุดุชุฑููุง ูุนุงูุฌ ููุฑุช ุดุงุดู ูููุณูู
[15/04/2024, 1:13:30โฏPM] ~โฏุนูู ุจุงูุนููุจ: ุงููู ูุนุทููู ุงูุนุงููู
[16/04/2024, 9:51:52โฏAM] ~โฏMoqbel: ุงูุณูุงู ุนูููู
โ[16/04/2024, 9:51:55โฏAM] ~โฏMoqbel: โ<attached: 00000345-PHOTO-2024-04-16-09-51-55.jpg>
[16/04/2024, 9:52:05โฏAM] ~โฏMoqbel: ุงุญุฏ ุนูุฏู ุฑูู ุงูุฏูุชูุฑู ูุฐู ุ
[16/04/2024, 9:52:07โฏAM] ~โฏMoqbel: ุงุณููุง DR. ARYATI BINTI BAKRI
[16/04/2024, 9:52:15โฏAM] ~โฏMoqbel: ูููุงู ุงูุงูููุณ ุญููุง ุจุงููู
[16/04/2024, 10:02:43โฏAM] ~โฏ.: ุงููู ูููู ูู ุนููู ุงุฎู ูู ุงููู
[16/04/2024, 10:05:00โฏAM] ~โฏ.: โThis message was deleted.
โ[16/04/2024, 10:05:50โฏAM] ~โฏ.: โ<attached: 00000351-PHOTO-2024-04-16-10-05-50.jpg>
[16/04/2024, 10:05:56โฏAM] ~โฏ.: ูุฐุง ุฑูููุง
[16/04/2024, 10:08:06โฏAM] ~โฏMoqbel: ูุนุทูู ุงูุนุงููู
[16/04/2024, 10:08:28โฏAM] ุฃุณุงูุฉ ุงูุญุณุงู ูุงููุฏูุดู: ูุนูู ูุงูู ูููุณูุ
[16/04/2024, 10:08:35โฏAM] ~โฏ.: ุงููู ูุนุงููู
[16/04/2024, 10:08:44โฏAM] ~โฏ.: ูู
[16/04/2024, 10:09:36โฏAM] ~โฏ.: ุงุณููุจ ุฌุฏุง ุณูุฆ ูุดุฑุญ ุชูุฑุง ุงูุณูุงูุฏุงุช
[16/04/2024, 10:10:03โฏAM] ุฃุณุงูุฉ ุงูุญุณุงู ูุงููุฏูุดู: ูุฃุฎุฐ ุญุฐุฑูุง ุนุดุงู ูู ูุงุจููุงูุง ูู ุงููุณุชูุจู
[16/04/2024, 10:10:43โฏAM] ~โฏ.: ูุฏ ุฑุญุช ูููุง ุฃูุง ูุชูุจุฉ ุงุฎุด ูุนูุง ุซุงูู ูู ุงู ูุงุฏุฉ
[16/04/2024, 10:11:06โฏAM] ุฃุณุงูุฉ ุงูุญุณุงู ูุงููุฏูุดู: ๐๐
[16/04/2024, 12:14:29โฏPM] ~โฏA.: ูุงููู ุจุงูุนูุณ ุงูุณูุณุชุฑ ุงููู ูุงุช ุงุฎุฐุช ูุนุงูุง ููุงูุช ูููุณู ูุทูุจู ูุฑู ุจุงูุชุนุงูู ูุงูุฏุฑุฌุงุช ูุงุฐุง ุดุงูุช ูุณุชูุงู ูู ุนููู ุชุฏููู ุงุณุงูู ุงููุงููุงู
[16/04/2024, 12:16:22โฏPM] ~โฏ.: ุณุจุญุงู ุงููู ูุงู ููุจูุง ุนูููู๐
[16/04/2024, 12:21:53โฏPM] ~โฏA.: ุจุณ ุตุฑุงุญู ููุช ุงูุง ุงููุญูุฏ ุงูุงูุชุฑูุงุดููุงู ุจุงูููุงุณ ุญููุง ููููู ุนูุดุงู ูุฐุง๐
[16/04/2024, 3:54:40โฏPM] ~โฏAmmar Abdulrahman: ุงูุณูุงู ุนูููู
โ[16/04/2024, 3:55:03โฏPM] ~โฏAmmar Abdulrahman: โ<attached: 00000365-PHOTO-2024-04-16-15-55-03.jpg>
โ[16/04/2024, 3:58:06โฏPM] Majoody: โ<attached: 00000366-PHOTO-2024-04-16-15-58-06.jpg>
[16/04/2024, 3:58:38โฏPM] ~โฏAmmar Abdulrahman: ุดูุฑุข ูุงูุตุฑุช
[16/04/2024, 3:58:48โฏPM] Majoody: ุนููุง
[16/04/2024, 5:10:16โฏPM] ~โฏRami: โThis message was deleted.
[16/04/2024, 6:22:50โฏPM] ~โฏYoussey Tahoon: ุงูุณูุงู ุนูููู ูู ุงูุฏูุงุชุฑู ูุฑุฏู ุนูู ุงูุงูููู ุจุฎุตูุต ุชุนุจุฆุฉ ุงูattendance ููุง ูุงุฒู ุงุฑุณููู ุฎุงุตุ
[17/04/2024, 7:12:11โฏAM] ~โฏBasel Abunada: ุนูู ุญุณุจ ุงูุฏูุชูุฑุ ูุจุฏุฆูุง ุงุฑุณู ุงูุงูููู ูุงุนุทูู ูฃ ุงูุงู ุนูู ุงุฐุง ูุงูุตูู ุงูุฑุฏ ุชูุงุตู ูุนู ุฎุงุต ุงุฐุง ูุงุนุจุฑู ุชูุงุตู ูุน ุงูุงูููุณ ูููููู ุงูู ุญุงููุช ุชูุตู ููุฏูุชูุฑ ุจูู ุงูุทุฑู ูู ุฑุญ ููุตูููู
[17/04/2024, 7:13:18โฏAM] Majoody: ุดูู ููู ููุชุจู ูุทุจ ุนููู ูุฎุงูุตูู  
ุจูุทูููุง ุญุชู ูุฑุฏูู
[17/04/2024, 6:41:35โฏPM] ~โฏM.Bajameel: ุงูุณูุงู ุนูููู 
ุงุญุฏ ูุนุงู ุงูููู Dr. Shahliza binti Abd. Halim
[17/04/2024, 6:44:46โฏPM] ~โฏAhmed Abdulhafith Alkabyle: shahliza@utm.my
[17/04/2024, 6:45:14โฏPM] ~โฏM.Bajameel: ูุดููุฑ
[18/04/2024, 7:07:18โฏAM] ~โฏOmar ABasset: ุงูุณูุงู ุนูููู
ูู ุงุญุฏ ูุนุงู ุฑูู Dr Norafidaุ
[19/04/2024, 8:20:31โฏAM] ~โฏ๐ธSHIMAA SALAH ๐ธ: ุงูุณูุงู ุนูููู
ุจุณุฃู ุนู ุงุญุณู ูุญู ูููู ุงุดุชุฑู ููู ูุงุจุชูุจ
[19/04/2024, 8:22:30โฏAM] Majoody: ูุฐุง ุงูููู ูุตูู ูุญูุงุช ููุจููุชุฑ ููุงุจ ุชูุจ
[19/04/2024, 8:22:32โฏAM] Majoody: https://maps.app.goo.gl/6a8KN7xqbyZxo9sd9
[19/04/2024, 8:40:31โฏAM] ~โฏ๐ธSHIMAA SALAH ๐ธ: ุชูุงู ุดูุฑุงู
[19/04/2024, 5:16:38โฏPM] โช+60ย14โ721ย1804โฌ: โโโช+60ย14โ721ย1804โฌ changed their phone number to a new number. โTap to message or add the new number.
[21/04/2024, 4:22:34โฏAM] ~โฏAbdullah Yaser Alnadhari: MOHD ADHAM BIN ISA
Dr. Nor Azizah โ<This message was edited>
[21/04/2024, 4:22:51โฏAM] ~โฏAbdullah Yaser Alnadhari: ุงุญุฏ ุนูุฏู ุงุฑูุงููู ุงู ุชูุฌุฑุงูุ
[21/04/2024, 5:29:41โฏAM] ~โฏYoussey Tahoon: ุงูุณูุงู ุนูููู
ุญุฏ ูุนู ุฌุฏูู ุงูุจุงุตุงุชุ โ<This message was edited>
[21/04/2024, 7:26:18โฏAM] ~โฏAkram ALI: ุงูุณูุงู ุนูููู 
ููู ุงููุงุญุฏ ูุญุฐู ูุงุฏู
[21/04/2024, 7:30:59โฏAM] ~โฏAhmed Marwan: ูุนูููู ุงูุณูุงู 
ุฑูุญ ุงู academic office ููููู ุงุจุบู ุงุณูู drop ูููุงุฏุฉ
โ[21/04/2024, 7:41:27โฏAM] ~โฏMoath_Mo.dev: โ<attached: 00000387-PHOTO-2024-04-21-07-41-27.jpg>
[21/04/2024, 7:41:43โฏAM] ~โฏMoath_Mo.dev: ุงุญุฏ ูุนุงู ุงูุชููู ุงู ุงููุงุชุณ ุชุจุนูุงุ
โ[21/04/2024, 7:46:14โฏAM] ~โฏAhmed Marwan: โ<attached: 00000389-Dr. Nur Haliza.vcf>
[21/04/2024, 7:47:58โฏAM] ~โฏMoath_Mo.dev: ุซูููู
โ[21/04/2024, 9:55:03โฏAM] ~โฏAhmed Marwan: โ<attached: 00000391-PHOTO-2024-04-21-09-55-03.jpg>
[22/04/2024, 5:58:47โฏAM] ~โฏใ โโข โกฬฌฬฉฬะดฮฒฦกวชฦกฤยฒยบยนยณ: ุณูุงู ุนูููู
[22/04/2024, 5:58:58โฏAM] ~โฏใ โโข โกฬฌฬฉฬะดฮฒฦกวชฦกฤยฒยบยนยณ: ุงุญุฏ ุนูุฏู ุงูุชุงูู ุชูุจู ุจุงููู ูุฑุณูู
[22/04/2024, 6:02:47โฏAM] ~โฏAhmed Marwan: ูุนูููู ุงูุณูุงู 

https://docs.google.com/spreadsheets/d/1xgW-jcamGvHqhjpjssYxIIjwpONtvdEP/edit#gid=316224423
[22/04/2024, 6:02:53โฏAM] ~โฏใ โโข โกฬฌฬฉฬะดฮฒฦกวชฦกฤยฒยบยนยณ: ูุดููุฑ โค๏ธ
[22/04/2024, 2:36:17โฏPM] ~โฏRami: ๐ฝ Hey UTM Students! ๐ฒ

As part of our SECI1143 course project, we're conducting a survey to enhance the dining experience on campus. Your feedback is crucial!

Could you spare just 3 minutes to complete this survey? Your input will help us to complete our project and is highly appreciated

Survey Link: https://docs.google.com/forms/d/e/1FAIpQLSf2UoYxr4nVcbDExoes00YULo0BTEILZYyPHMHjSG3rc1AgjA/viewform?usp=sf_link โ<This message was edited>
โ[24/04/2024, 6:43:09โฏAM] ~โฏAhmed Marwan: โ<attached: 00000397-PHOTO-2024-04-24-06-43-09.jpg>
[24/04/2024, 11:20:10โฏAM] ~โฏMoqbel: ุงูุณูุงู ุนูููู
[24/04/2024, 11:20:45โฏAM] ~โฏMoqbel: ุงุญุฏ ูุนุฑู ููู ููุชุจ Dr.Muhammad Alif โ<This message was edited>
โ[24/04/2024, 11:21:27โฏAM] ~โฏMohamad Noureddine: โ<attached: 00000400-PHOTO-2024-04-24-11-21-27.jpg>
[24/04/2024, 11:23:15โฏAM] ~โฏMoqbel: ูุฐู ุงูุตูุฑู ูููุง ูู ุงูุฏูุงุชุฑูุ
[24/04/2024, 11:23:37โฏAM] ~โฏMohamad Noureddine: ูุจ ุงูููุฑูุถ โ<This message was edited>
[24/04/2024, 11:24:01โฏAM] ~โฏOmar ABasset: ูุณู ูู ูุงุญุฏุฉ ุซุงููุฉ
[24/04/2024, 11:24:08โฏAM] ~โฏOmar ABasset: ูุฐูู ุงูุงุฎูุฑุฉ
โ[24/04/2024, 11:24:18โฏAM] ~โฏOmar ABasset: โ<attached: 00000405-PHOTO-2024-04-24-11-24-18.jpg>
โ[24/04/2024, 11:24:19โฏAM] ~โฏOmar ABasset: โ<attached: 00000406-PHOTO-2024-04-24-11-24-19.jpg>
[24/04/2024, 11:36:15โฏAM] ~โฏmotu: https://forms.gle/1wKZsbwcPwgE5v996
[24/04/2024, 11:36:59โฏAM] ~โฏmotu: ุงูุณูุงู ุนููููุ ูู ุณูุญุชู ุงููู ุฏู ุนุง ุงูุณุฑูุน. ูููุง ุฏูููุฉ. ุงููู ูููููู ๐
[24/04/2024, 11:38:41โฏAM] ~โฏ.: ุชู
โ[24/04/2024, 8:44:44โฏPM] Ahmed Ghaleb: โ<attached: 00000410-PHOTO-2024-04-24-20-44-44.jpg>
[24/04/2024, 8:46:29โฏPM] ุฃุณุงูุฉ ุงูุญุณุงู ูุงููุฏูุดู: ุงูุญุฑูู ูู ุงูุฃูุงู
ูุงูุงุฑูุงู ูู ุงูููุช
Hari ููู
Masa ููุช
๐
โ[24/04/2024, 8:57:13โฏPM] Ahmed Ghaleb: โ<attached: 00000412-PHOTO-2024-04-24-20-57-13.jpg>
[24/04/2024, 9:01:06โฏPM] ุฃุณุงูุฉ ุงูุญุณุงู ูุงููุฏูุดู: Selasa 11:00-1:00
ุงูุซูุงุซุงุก ูกูก:ูู-ูก:ูู
[24/04/2024, 9:03:07โฏPM] Ahmed Ghaleb: ุฃูุงุง ูููุชุ ุนุฏุฏ ุงูุณุงุนุงุช ุฐุง. ุฃุจุดุฑ ุทุงู ุนูุฑู๐ซก
[24/04/2024, 11:39:25โฏPM] ~โฏM.Bajameel: *10-1
โ[24/04/2024, 11:42:10โฏPM] ~โฏM.Bajameel: โ<attached: 00000416-PHOTO-2024-04-24-23-42-10.jpg>
[25/04/2024, 5:06:05โฏAM] ~โฏRami: ๐ฝ Hey UTM Students! ๐ฒ

As part of our SECI1143 course project, we're conducting a survey to enhance the dining experience on campus. Your feedback is crucial!

Could you spare just 3 minutes to complete this survey? Your input will help us to complete our project and is highly appreciated

Survey Link: https://docs.google.com/forms/d/e/1FAIpQLSf2UoYxr4nVcbDExoes00YULo0BTEILZYyPHMHjSG3rc1AgjA/viewform?usp=sf_link
โ[25/04/2024, 9:52:01โฏAM] ุฃุณุงูุฉ ุงูุญุณุงู ูุงููุฏูุดู: โ<attached: 00000418-PHOTO-2024-04-25-09-52-01.jpg>
[25/04/2024, 3:10:17โฏPM] Ahmed Ghaleb: โThis message was deleted.
[26/04/2024, 10:44:30โฏAM] ~โฏ.: ุงูุณูุงู ุนูููู
[26/04/2024, 10:44:51โฏAM] ~โฏ.: ูุงู ุงุชุฑุณู ูููู ุฏุฑุงูู ููู ูู ููุงุฏ ูููุจููุชูู ูููู ุชุฑุณููู ูุฑุฉ ุซุงููุฉ ูุง ูุงููุงู
[26/04/2024, 10:45:23โฏAM] ~โฏAbdulkader: https://docs.google.com/spreadsheets/d/1xgW-jcamGvHqhjpjssYxIIjwpONtvdEP/edit#gid=316224423
[26/04/2024, 10:45:52โฏAM] ~โฏ.: ูุง ูุตุฏู ููู ุงูุชุญุงูุงุช ู ุณูุงูุฏุงุช ู ูุฏุง
[26/04/2024, 10:46:21โฏAM] ~โฏAbdulkader: https://drive.google.com/open?id=12RsF6SFoXfkuURC6xszaJUdJecWkWv1R

ุฏุฑุงูู ุงูYSAG ูุตุฏูุ
[26/04/2024, 10:52:02โฏAM] ~โฏ.: ุฃููุง ุดูุฑุงุง๐๐
[26/04/2024, 10:52:41โฏAM] ~โฏAbdulkader: ูุง ุฃููุงู
[27/04/2024, 6:11:02โฏAM] ~โฏFares Hamid: ุงูุณูุงู ุนูููู ูุง ุดุจุงุจ ูู ุงุฎุฐ ูุงุฏู SAD ุงูุณูุณุชุฑ ุงูุงูู
[27/04/2024, 6:12:06โฏAM] ~โฏFares Hamid: ุจุงููู ูุฌููู ุฎุงุตุ ุญุชุง ุงูู ุงุฎุฐูุง ุงูุณูุณุชุฑ ุงูู ูุจู ูุญุชุงุฌ ุงุณุงูู ุดู ุถุฑูุฑู
[27/04/2024, 6:57:54โฏAM] Hamdan Saleh: @60182921708
[27/04/2024, 8:22:20โฏAM] ~โฏ.: Greetings! We are students from SEC1143 conducting *survey* on future goals and aspirations after graduating college. We are interested in understanding how individuals envision their future and what aspirations they hold dear.

Would you kindly take a moment to share your thoughts with us by completing this survey? Your insights will contribute significantly to our study. Thank you in advance for your participation! ๐๐

https://forms.gle/a9pw9ND46WUw1CWC6
[27/04/2024, 8:22:47โฏAM] ~โฏ.: ุดุจุงุจ ูู ุณูุญุชู ุชููู ูุฐุง ุงูููุฑู๐ ู ุจูุงุฎุฏ ูฅ ุฏูุงูู ู ุดูุฑุง ูููุชูู ููุฏูุง
[27/04/2024, 4:37:30โฏPM] ~โฏAbdulkader: ูู ููู ุฃุญุฏ ุฌุฑุจ ูุดุญู ุนู ุทุฑูู DHL ุฅูู ุงูุณุนูุฏูุฉ (ุฃู ุฃู ุดุญู ุฏููู)ุ
[27/04/2024, 4:38:25โฏPM] ~โฏFares Hamid: ูู ุงูุณุนูุฏูู ุงูู ูุงููุฒูุง ุดุญูุช ูุฑู
[27/04/2024, 4:38:40โฏPM] ~โฏFares Hamid: ูุด ุงูุนูุณ ููุฆุณู
โ[29/04/2024, 7:32:38โฏAM] ุฃุณุงูุฉ ุงูุญุณุงู ูุงููุฏูุดู: โ<attached: 00000435-PHOTO-2024-04-29-07-32-38.jpg>
โ[29/04/2024, 7:32:38โฏAM] ุฃุณุงูุฉ ุงูุญุณุงู ูุงููุฏูุดู: โ<attached: 00000436-PHOTO-2024-04-29-07-32-38.jpg>
[29/04/2024, 8:47:28โฏAM] ~โฏVclm.: Rozeela Zain
[29/04/2024, 8:47:31โฏAM] ~โฏVclm.: ุงูุณูุงู ุนูููู
[29/04/2024, 8:47:37โฏAM] ~โฏVclm.: ุดุจุงุจ ุญุฏ ูุนุฑู ููุชุจูุง
[29/04/2024, 8:47:39โฏAM] ~โฏVclm.: ุถุฑูุฑู
[29/04/2024, 8:49:42โฏAM] ~โฏMohamad Noureddine: .
[29/04/2024, 2:09:58โฏPM] ~โฏFares Hamid: ุงูุณูุงู ุนูููู ูุง ุนูุงู ูู ููู previous quizs computational mathmatrics
[29/04/2024, 2:11:24โฏPM] Hamdan Saleh: ุดูุช ุงู ysagุ
[29/04/2024, 2:12:01โฏPM] ~โฏFares Hamid: ูุจ ูุง ุญุตูุช ูููุง tests ู ูุฏููู ุฌุฏุง
[29/04/2024, 2:12:36โฏPM] ~โฏFares Hamid: 215 2017tests

ูุงูู ูููุฒุณ ูุงูู
[29/04/2024, 2:12:49โฏPM] Hamdan Saleh: ุจุดูู ุงุฐุง ุญุตูุช ุญูู
[29/04/2024, 3:14:46โฏPM] ~โฏVclm.: ุดุจุงุจ ุงู ุญุฏ ุนูุฏู ูุชุงุจ ุฏุฌุชุงู ููุฌูู ุ guys anyone have digital logic book
[29/04/2024, 3:14:51โฏPM] ~โฏVclm.: ุถุฑูุฑู ุฌุฏุง
[29/04/2024, 3:44:57โฏPM] ~โฏAhmed Marwan: ุงุชุฐูุฑ ุงูู ุญุทูุชู ู ุงูููุชุจู
[29/04/2024, 3:45:11โฏPM] ~โฏAhmed Marwan: https://drive.google.com/file/d/1_f7ZjUtfpIrGN4gixWGu1uCAOVHV8ahZ/view?usp=sharing
[29/04/2024, 3:53:01โฏPM] ~โฏVclm.: ุงููููููู ุณููููุฑุฑุฑ๐ฅ๐ฅ๐ฅ
[29/04/2024, 3:57:37โฏPM] ~โฏ.: ูุงุฎู ุฑุจูุง ูุฏูู ุงูุนุงููุฉ
[29/04/2024, 3:58:49โฏPM] ~โฏLoai: ุฃุชูู ู ุจููุฉ
[29/04/2024, 4:00:27โฏPM] ~โฏAhmed Marwan: Paid actor
โ[29/04/2024, 4:00:56โฏPM] ~โฏLoai: โ<attached: 00000455-STICKER-2024-04-29-16-00-56.webp>
โ[30/04/2024, 6:38:43โฏAM] ~โฏVclm.: โ<attached: 00000456-PHOTO-2024-04-30-06-38-43.jpg>
โ[30/04/2024, 6:38:44โฏAM] ~โฏVclm.: โ<attached: 00000457-PHOTO-2024-04-30-06-38-44.jpg>
[30/04/2024, 6:39:04โฏAM] ~โฏVclm.: ุดุจุงุจ ูููู ุญู ูุงุฐูู ุงูุณูุงููู ุถุฑูุฑู ุฌุฏุง ุฌุฏุง
[30/04/2024, 6:44:12โฏAM] ~โฏOmar: ุงุดุชุบู ุนูู ุงูุฑูู (u+v)+w ููุง ููุณูุง u+(v+w)
[30/04/2024, 9:10:16โฏAM] ~โฏVclm.: ุทูุจ ุญููุช ุงูุณูุงู ุงูุงูู ุจุณ ูุง ุนุฑูุช ุงุญู ุงูุซุงูู ูููู ุญุฏ ูุจุนุซูู ุงูุญู
[30/04/2024, 9:20:15โฏAM] ~โฏูููุงู ุณูุทุงู: ูุฐุง ูุงู ูู quiz 

ููุงู ุฎุงุฑุฌ ุงูููุฑุฑ ููุง
[01/05/2024, 8:51:01โฏAM] ~โฏAhmed Marwan: ุงูุณูุงู ุนูููู 
ูู ุทุงูุจ ูุชูุฑู ุงุฎุฐ system development ุงูุณูุณุชุฑ ุงูู ูุงุชุ
ุนูุฏู ุงุณุชูุณุงุฑ ุฎููู ูุทูู
[01/05/2024, 1:07:09โฏPM] ~โฏAbdulkader: ุณูุงูุ
ูููู ุชุฑุณูููู ุฑูู ููุชุจ ุจุงููููุฑ
โ[01/05/2024, 1:07:38โฏPM] Majoody: โ<attached: 00000464-Pioneer Education Service Malaysia.vcf>
[01/05/2024, 1:21:12โฏPM] ~โฏAbdulkader: ูุณูููุง ุงูุฃูุงุฏู
[01/05/2024, 1:21:34โฏPM] Majoody: ุงููู ูุณููู
โ[02/05/2024, 10:01:16โฏAM] ~โฏMoath_Mo.dev: โ<attached: 00000467-PHOTO-2024-05-02-10-01-16.jpg>
[02/05/2024, 10:03:29โฏAM] ~โฏMohamad Noureddine: rashidah@utm.my
[02/05/2024, 10:03:53โฏAM] ~โฏMohamad Noureddine: +60 13-344 9925
[02/05/2024, 10:03:53โฏAM] ~โฏMoath_Mo.dev: ุชุณูู
[02/05/2024, 10:04:09โฏAM] ~โฏMohamad Noureddine: ุงููู ูุณููู
[02/05/2024, 10:32:03โฏAM] ~โฏMoqbel: ุงูุณูุงู ุนูููู
[02/05/2024, 10:32:03โฏAM] ~โฏMoqbel: https://tinyurl.com/b9f4tptb

Hello everyone,
We are computer Network and Security students, as part of our project in Probability and Statistical Data Analysis, we conducted a survey aims to investigate the screen time usage patterns among universities' students.
We will appreciate your participation.
thank you.
[02/05/2024, 10:32:03โฏAM] ~โฏMoqbel: ุงููู ูุงุถู ูููู ุงูููุฑู ููุง ุนูููู ุงูุฑ
[03/05/2024, 5:36:02โฏAM] ~โฏA.: ุดุจุงุจ ุงุญุฏ ุนูุฏู ุงุฑูุงู ูุงุณ ุชุฃุฌุฑ ุณูุงุฑุงุชุ
[03/05/2024, 9:37:00โฏAM] ~โฏูููุงู ุณูุทุงู: https://forms.gle/oyDJGMaaJpfTCWpo9

ูู ูุถูู 5 ุฏูุงูู ูู ููุชู ๐

ุงุฐุง ูู ุชูุนูุ ุงุนูู ุจุฃู ุงูุดูุทุงู ูุฏ ููุนู๐
[03/05/2024, 11:24:03โฏAM] ~โฏVclm.: ุงูุณูุง ุนูููู
[03/05/2024, 11:24:21โฏAM] ~โฏVclm.: ุดุจุงุจ ูู ุญุฏ ุนูุฏู ูุชุงุจ ุงูุฏุฌุชู ููุฌูู
[03/05/2024, 11:40:34โฏAM] ~โฏูููุงู ุณูุทุงู: https://drive.google.com/file/d/1_f7ZjUtfpIrGN4gixWGu1uCAOVHV8ahZ/view?usp=sharing
[03/05/2024, 11:51:09โฏAM] ~โฏAhmed Abdulhafith Alkabyle: Greetings everyone! Weโre students from SECI1143 conducting a survey on โThe impact of digital advertising on consumer purchaseโ 
Would you kindly spare a minute of your time to fill in this form, it only takes 1 minute. Thank you!

https://forms.gle/wdD8EdqeAyraSXqq8
[03/05/2024, 11:51:51โฏAM] ~โฏAhmed Abdulhafith Alkabyle: ุงูุณูุงู ุนูููู ุงูู ูุงุถู ูุงุฑูุช ูุนุจู ุงูููุฑู.
[04/05/2024, 7:46:21โฏAM] ~โฏMoath_Mo.dev: https://docs.google.com/forms/d/e/1FAIpQLSd6KQkKgJDWMa3iDv9OcfUsYzeIPE-dfzw3juFi_ANRS8PKZQ/viewform?usp=pp_url

Hello and happy day to you.
We are computer science students, and we performed a survey to look into the use of the internet for learning during the pandemic of COVID-19 as part of our research in probability and statistical data analysis.
Thank you for your time.
[04/05/2024, 7:46:46โฏAM] ~โฏMoath_Mo.dev: ุงูู ูุงุถู ูุงููุช ูุนุจู ูุดูุฑุง ููุฏูุง ๐น
[04/05/2024, 8:45:22โฏAM] ~โฏVclm.: It would be fantastic if you could take a few minutes to fill out the survey. ๐๐
 
https://forms.gle/k6z5zHjBFA9NJmFC7
 
Please feel free to share the survey link with your groups and encourage them to participate. I genuinely appreciate your support
[04/05/2024, 8:45:52โฏAM] ~โฏVclm.: ุงูุณูุงู ุนูููู ุงูู ูุงุถู ูุงุฑูุช ูุนุจู ุงูููุฑู.
[05/05/2024, 8:49:08โฏAM] ~โฏWalid: https://forms.gle/Vbje4nRUTXE84nje7 

Welcome to Our Social Media Influence Survey!
Purpose of This Survey
We are conducting a study to understand how social media influences consumer purchasing decisions. Your participation will provide valuable insights into the impact of social media platforms on shopping behaviors and advertising effectiveness.

Who Should Participate?
This survey is open to anyone who uses social media. Whether you frequently shop online or occasionally browse through social media platforms, your responses are crucial to our study.

What Will You Be Asked?
You will be asked questions about:

Your general social media usage.
How often you discover new products through social media.
The influence of social media advertisements on your purchasing decisions.
Your trust in advertisements on these platforms.
How Long Will It Take?
The survey will take approximately 3-5 minutes to complete.

Confidentiality
Your responses will be kept confidential and anonymous. Data collected will only be used for academic purposes and will not be shared with third parties.

Consent
By continuing with this survey, you consent to participate voluntarily, understanding you can withdraw at any time without any consequences.

Thank you for your valuable time and insights!
[05/05/2024, 8:49:13โฏAM] ~โฏWalid: ู ุงุฎูุงู ุจุงููู ุนุจู ุงูููุฑู ุฐุง
[05/05/2024, 1:35:49โฏPM] Majoody: Welcome to our Digital Marketing and Consumer Behavior Survey. We're studying changes in online shopping since the pandemic, focusing on spending habits, platform choices, and the influence of social media.

Survey Link: https://forms.gle/M5An6mdMAcw2pbJ86

Your responses are confidential and will take about 3-6 minutes to complete. Thank you for yourยparticipation!
[05/05/2024, 1:36:25โฏPM] Majoody: 2 min form guys 
Thanks in advance ๐ค
[05/05/2024, 3:30:23โฏPM] ุฃุณุงูุฉ ุงูุญุณุงู ูุงููุฏูุดู: [Unlocking the Path to AI: Your Guide to Entering the World of Artificial Intelligence]

๐ Exciting Announcement! ๐

Join us for a career talk as we unlock the path to AI with Dr. Lee Mei Sin, your guide to entering the world of Artificial Intelligence! ๐ค 

Dr. Lee, a Women in AI advocate and AI research fellow at Monash University, shares insights into NLP, finance, economics, and more. With over a decade of IT project management experience, Dr. Lee brings practical wisdom to the table. 

Donโt miss this opportunity to learn from her and discover how AI can empower us to achieve greater things! ๐ง๐

๐ค Featuring:
Dr. Lee Mei Sin - AI Research Fellow
Natural Language Processing, PhD
Monash University
Women in AI

Save the date and join us on:
๐ Date: Tuesday, 7th May 2024
โ๏ธ Time: 07:00 PM (MYT)
๐ Platform: Google Meet

๐ RSVP Link:
https://gdsc.community.dev/e/mvnkq3/

WhatsApp Link:
https://chat.whatsapp.com/FcWX3LMWbrD8RkJz8TiT7S

Subscribe to our telegram channel for more updates:
https://t.me/GDSCUTM

Google Developer Student Clubs
Universiti Teknologi Malaysia
[05/05/2024, 6:25:07โฏPM] ~โฏSalman Alameer: ุณูุงู ุนูููู ูุงุดุจุงุจ
[05/05/2024, 6:25:16โฏPM] ~โฏSalman Alameer: ุงุญุฏ ุนูุฏู ุฑูู ูุฒูุงุชูุ
[05/05/2024, 6:50:31โฏPM] Abdullah Neighbor: ูุนูููู ุงูุณูุงู ูุฑุญูุฉ ุงููู ูุจุฑูุงุชู
โ[05/05/2024, 6:50:39โฏPM] Abdullah Neighbor: โ<attached: 00000494-Dr. Lazawati.vcf>
[05/05/2024, 6:51:09โฏPM] Abdullah Neighbor: ูุฐุง ูู ูฃ ุณููู ูููู ุดูู ุนุงุฏูุง ุชุณุชุฎุฏูู
[06/05/2024, 9:18:59โฏAM] ~โฏMohannad Jebril: Hey there! ๐ Calling all students! ๐ด We're on a mission to crack the code of college sleeping habits. If you've ever napped through lectures or pulled an all-nighter, we need your input! Take our survey and help us uncover the secrets of student sleepiness.

https://docs.google.com/forms/d/e/1FAIpQLSc3_TmCx_nUy9DK79sTt32sp8144I-dZyaaXOXbfHZVuH6jdw/viewform?usp=sf_link
[06/05/2024, 9:19:28โฏAM] ~โฏMohannad Jebril: ููู ููุฏุฑ ูุนุจู ุฌุฒุงู ุงููู ุฎูุฑ
[07/05/2024, 12:17:33โฏPM] ~โฏMoqbel: ุงูุณูุงู ุนูููู
[07/05/2024, 12:17:36โฏPM] ~โฏMoqbel: ุงูุฏุฑุงูุช ุญู ุฌุฏูู ุงููุงููู ุจุงูู ูุง ูุฒู ุนูุฏูุงุ
[08/05/2024, 9:40:35โฏAM] ~โฏAli Alrekaby: โ~โฏSalman Alameer added ~โฏAli Alrekaby
โ[08/05/2024, 5:37:08โฏPM] ~โฏAbdullah Al-Shateri: โ<attached: 00000501-PHOTO-2024-05-08-17-37-08.jpg>
โ[11/05/2024, 7:43:13โฏAM] ~โฏAbdullah Al-Shateri: โ<attached: 00000502-PHOTO-2024-05-11-07-43-13.jpg>
[11/05/2024, 12:31:03โฏPM] ~โฏFares Hamid: ุงูุณูุงู ุนูููู ูุง ุงุฎูุงู

ุงุญุฏ ุนูุฏู 2023 ููุง ุงูุฑุจ ุชุงุฑูุฎ Comutational mathamatic test 1 โ<This message was edited>
โ[11/05/2024, 12:36:03โฏPM] ~โฏใ โโข โกฬฌฬฉฬะดฮฒฦกวชฦกฤยฒยบยนยณ: TEST 1-2021.zip โ<attached: 00000504-TEST 1-2021.zip>
[11/05/2024, 12:37:07โฏPM] ~โฏFares Hamid: ูุณุนุฏ ูุณุงู ุจุงูุฎูุฑ ูุงูุนุงููู
[11/05/2024, 12:37:18โฏPM] ~โฏFares Hamid: ูุง ูุตุฑุช
[11/05/2024, 3:56:31โฏPM] ~โฏLeena: ุงูุณูุงู ุนูููู ู ุงุญุฏ ุนูุฏู ุชุณุช ููุงุฏุฉ probability and statistical data analysis PSDA ูู ุงูุฑุจ ุชุงุฑูุฎุุ
[11/05/2024, 3:57:12โฏPM] ~โฏYoussey Tahoon: ุนูุฏู ูุงุญุฏ 16/2
[11/05/2024, 4:00:52โฏPM] ~โฏLeena: ูููู ุชุฑุณูู ูู ุณูุญุช
โ[11/05/2024, 4:09:25โฏPM] ~โฏูููุงู ุณูุทุงู: Midterm 2016_2017 with solution.pdf โข โ15 pages โ<attached: 00000510-Midterm 2016_2017 with solution.pdf>
[11/05/2024, 4:15:07โฏPM] ~โฏYoussey Tahoon: ุงูู ูุตุฏู past year๐
[11/05/2024, 4:15:18โฏPM] ~โฏYoussey Tahoon: 16/5
ูุฎุจุทุช
โ[11/05/2024, 4:32:34โฏPM] ~โฏใ โโข โกฬฌฬฉฬะดฮฒฦกวชฦกฤยฒยบยนยณ: Test 20182019-2 (set 1).pdf โข โ4 pages โ<attached: 00000513-Test 20182019-2 (set 1).pdf>
[11/05/2024, 6:06:33โฏPM] ~โฏLeena: ุดูุฑุงุง ููููู
[11/05/2024, 6:06:36โฏPM] ~โฏLeena: ุงููุง
โ[12/05/2024, 5:46:19โฏAM] ~โฏ.: โ<attached: 00000516-PHOTO-2024-05-12-05-46-19.jpg>
[12/05/2024, 7:25:06โฏAM] ~โฏAbdulkader: ููู ูุฌู ูุฑูุจ ูุนุงูุ
[12/05/2024, 7:25:30โฏAM] ~โฏAbdulkader: @601121224029 
@966535707162 
@601111716337 
@966509473092 
@966556825219
[12/05/2024, 7:25:46โฏAM] ~โฏMohamad Noureddine: how many members per group?
[12/05/2024, 7:26:18โฏAM] ~โฏAbdulkader: 4
[12/05/2024, 7:32:36โฏAM] ~โฏAbdulkader: ุดุจุงุจ ุทุงูุจูู ููู ุดู ุงุณูู 
Study plan 
ุนุดุงู ุชุฌุฏูุฏ ุงูููุฒุงุ ูู ููู ุฃุฌูุจูุ
[12/05/2024, 7:34:03โฏAM] ~โฏYousef Khaled: ุบุฑูุจู ุงูู ูุฑู ุงุณูุน ุนูู
[12/05/2024, 7:44:32โฏAM] ~โฏSalman Alameer: ุณูู
[12/05/2024, 7:46:06โฏAM] ุฃุณุงูุฉ ุงูุญุณุงู ูุงููุฏูุดู: ุฃุนุชูุฏ ูุฐุง ููู ูู ุณูุณุชุฑ 7 ุฃู 8ุ ุนุดุงู ูุง ููุฏููู ูุฌุฏุฏูุง ุณูุฉ ูุงููุฉ 

ููู ุชุฌูุจูุงุ ุฏููุช ูู
[12/05/2024, 7:47:41โฏAM] ุฃุณุงูุฉ ุงูุญุณุงู ูุงููุฏูุดู: ูู ุจุนุถ ุงูุดุจุงุจ ูุญุทูุง ุฎุทุท ููููุฉ ูููุฏูููุง ุจุณ ูููู ูุง ุชุถุจุทุ ูุฃูู ูุธุงู ุงูุฌุงูุนุฉ ุฃูู ูุง ุชุฎูุต ุณูุณุชุฑ 8 ูุง ุชูุฏุฑ ุชุฌูุณ ุฃู ุชุฌุฏุฏ
[12/05/2024, 7:56:29โฏAM] ~โฏMo3taz Al-Shater: What is a Study Plan? 

Subjects that you need to register in the upcoming semester. If you have another 2 semesters, please list all the subjects for 2 upcoming semesters and so on. I need the course code and course name.
โ[12/05/2024, 7:57:21โฏAM] ~โฏMo3taz Al-Shater: Study Plan Template.docx โข โ1 page โ<attached: 00000527-Study Plan Template.docx>
[12/05/2024, 7:58:20โฏAM] ~โฏMo3taz Al-Shater: an example
[12/05/2024, 7:58:35โฏAM] ~โฏMo3taz Al-Shater: ู ุชุฌูุจู ูู ุงู Academic office
[12/05/2024, 8:06:27โฏAM] ~โฏAbdulkader: ุดูุฑูุง ุฌุฒููุงู
[12/05/2024, 8:14:42โฏAM] ~โฏMo3taz Al-Shater: ุงูุนูู โค
[12/05/2024, 8:18:00โฏAM] ~โฏM.Alkhatib: ุชุงุฎุฐ ูู ุฑูุญุงูู ุงุฑุณููุง ุงูููู ุจุชุนุทูู ุชูุจูุช ุฌุฏูู ุชุนุจู ููู ุจุงูู ุงูููุงุฏ ุงูู ุจุชุงุฎุฐูุง ุงู ุงูู ุจุชุนูุฏููุง
[12/05/2024, 8:18:33โฏAM] ~โฏAbdulkader: ุฃูุง ุจุฃุณุฃู ุนุดุงููุง ูู ูู ุฑุงุถูุฉ ุชุนุทูููุ
ุชููู ูู ุดูู ุนูู ุงูุงูููู ุงูู ุฑุณูุชูู ุงูุงู ูู ุนุงู ุงูููู
[12/05/2024, 8:19:09โฏAM] ~โฏAbdulkader: ุฃูุง ุณูุณุชุฑ 6 ุทุงูุจูู ููู study plan ุจุฑุถู ุดู ุบุฑูุจ
โ[12/05/2024, 8:32:07โฏAM] ~โฏM.Alkhatib: โ<attached: 00000535-PHOTO-2024-05-12-08-32-07.jpg>
โ[12/05/2024, 10:33:40โฏAM] ~โฏAbdullah Al-Shateri: โ<attached: 00000536-PHOTO-2024-05-12-10-33-40.jpg>
[12/05/2024, 3:43:42โฏPM] ุญูุฒุฉ ุจุฌุจูุฌ: ุงูููุงูู ููุง ุญุถูุฑู ุงูุชุทูุนุ
[12/05/2024, 4:09:16โฏPM] ุฃุณุงูุฉ ุงูุญุณุงู ูุงููุฏูุดู: ุญุถูุฑู
[12/05/2024, 4:15:21โฏPM] ุญูุฒุฉ ุจุฌุจูุฌ: ููู ุงูููุงูุ
[12/05/2024, 4:18:14โฏPM] ุฃุณุงูุฉ ุงูุญุณุงู ูุงููุฏูุดู: ุจุฌุงูุจ D'summit
[14/05/2024, 6:39:30โฏAM] ~โฏAbdulkader: ุงูุด ุงูุจุงุต ุงูู ูุงุฎุฐ ูู ุงูุณูุชุฑ ุจูููุช ููููุชุจุฉ ุงูุฌุฏูุฏุฉุ โ<This message was edited>
[14/05/2024, 6:39:54โฏAM] Hamdan Saleh: E
[14/05/2024, 2:04:43โฏPM] ~โฏLoai: Assalamualaikom / hi everyone. Hope you are doing well.

I am doing a survey for current system analysis in my final year project.

Kindly can you take 1 minute the fill up the form below. Thank you in advance.๐

https://forms.gle/dgGVeaTXaybRuFsF9
[14/05/2024, 2:05:43โฏPM] ~โฏLoai: ุงูุณูุงู ุนูููู ุดุจุงุจุ ูู ุณูุญุชู ูููู ุชุนุจูุง ูุฐุง ุงูููุฑู ู ูุดููุฑูู ููุฏูุง.๐ซก
ุฌุฒุงูู ุงููู ุฎูุฑ
[15/05/2024, 7:39:00โฏAM] ~โฏMuhammad Adham ๐ช๐ฌ: โโ~โฏMuhammad Adham ๐ช๐ฌ changed their phone number to a new number. โTap to message or add the new number.
[15/05/2024, 8:05:39โฏAM] ~โฏFares Hamid: ุงูุณูุงู ุนูููู ูุง ุงุฎูุงู ูุจุง ุชูููู ูู ูุงุฏู PSDA.. ุงู SAD ุงูุฏูุงุชุฑู ุดุฑุญูู ูุด ุชูุงู โ<This message was edited>
[15/05/2024, 8:07:27โฏAM] Hamdan Saleh: ุญุงูู ุชุชุนูู ูู ุงูููุชููุจ
[15/05/2024, 8:07:40โฏAM] Hamdan Saleh: ุงูุฏูุชูุฑ ูุงุจูุนููู ูู ุดูุก
[15/05/2024, 8:07:54โฏAM] ~โฏFares Hamid: ุงูุชุจ ูุงุฏู PSDA
[15/05/2024, 8:08:01โฏAM] ~โฏFares Hamid: ูุทูุนููุ
[15/05/2024, 8:08:36โฏAM] Hamdan Saleh: ุงูุชุจ ุงูููุถูุน ุงูู ูุง ุงูุชูููู ูุงูุดุงุก ุงููู ุจูุทูุน
[15/05/2024, 8:09:09โฏAM] Majoody: ุญุงูู ุชุจุญุซ ุนู ุงูููุถูุน ุจุงูููุชููุจ ูุด ุงูููุงุถูุน ูุงููุฉ
[15/05/2024, 8:09:48โฏAM] Hamdan Saleh: ุงูุง ููุช ุงููู ูุต ูู ุงูุฏูุชูุฑ ููุต ูู ุงูููุชููุจ
[15/05/2024, 8:10:29โฏAM] Majoody: ูุงูู ุงุฐูุฑ ุงู SAD ูุงูููุช ุดุฑูุญุงุช ููุณ ููุณ ุงูุณูุงูุฏ ูููุช ุงุญุงูู ุงุฏูุฌ ุจูููู ุงููู ูู ุงูุณูุงูุฏ ุงูุซุฑ โ<This message was edited>
[15/05/2024, 9:05:45โฏAM] ~โฏLoai: SAD is mostly theory except for one chapter that requires calculations, you can type the topic on YouTube and you'll get good explanation
[15/05/2024, 9:06:20โฏAM] ~โฏLoai: Type the chapter topic, not the subject.
[15/05/2024, 9:14:36โฏAM] ~โฏFares Hamid: ูุดูููู ูุง ุดุจุงุจ ุงููู ูุนุทููู ุงูุนุงููู ุฌููุนุง
[15/05/2024, 9:20:33โฏAM] ~โฏLoai: ุงููู ูุนุงููู
[15/05/2024, 9:41:29โฏAM] ~โฏAbdulkader: ุงูSAD ุงููุทููุจ ูููู ุชุณููุง ุชุญููู ูููุธุงู ุงูููุนุทู + ุฑุณู Diagrams ูููุธุงู ุงูุฌุฏูุฏ
[15/05/2024, 9:42:30โฏAM] ~โฏAbdulkader: ุณูุงูุฏุงุช ุงููุงุฏุฉ ููุชุงุฒุฉ ูุญุชู ูู ุงูุดุฑุญ ูุงู ูู ูููุณุ ุงููุงุญุฏ ููุฏุฑ ููุดู ุงููุถุน
[15/05/2024, 12:43:42โฏPM] ~โฏๅ ุญููููุฒูุฉก: โ~โฏๅ ุญููููุฒูุฉก joined using this group's invite link
[15/05/2024, 5:35:59โฏPM] ~โฏAhmed Abdulhafith Alkabyle: https://www.opportunitiescircle.com/kaust-international-internship/?utm_medium=paid&utm_source=ig&utm_id=23847701581500611&utm_content=120210667831140612&utm_term=23857451155120611&utm_campaign=23847701581500611&fbclid=PAAaaU_vXt2OoUAu-dxx32HVTbk4p8euDgbWLyloPkMeRmpVtUyuy4srftu44_aem_Aam-6ff5JxN-UAiI_grlinHa8_RAzlFPc1-o05yYQrIJcNecp5EfDwKuAOqtngWZ0PEXssFIL-vG-qLBRJiMT3IY
[16/05/2024, 6:52:59โฏPM] Amr Al-waeli: ุงูุณูุงู ุนูููู ูุฑุญูุฉ ุงููู ูุจุฑูุงุชู 
ูุณุงุก ุงูุฎูุฑ 
ูู ูุฒู ุฌุฏูู ุงููุงูููุงุช ุงู ูุณูุ
[16/05/2024, 7:24:37โฏPM] ~โฏ.: ูุนูููู ุงูุณูุงู ูุฑุญูุฉ ุงููู ูุจุฑูุงุชู
[16/05/2024, 7:24:42โฏPM] ~โฏ.: ูููุชูุง ูุณุง
[17/05/2024, 11:48:09โฏAM] Alaa Albashier: โ~โฏSalman Alameer added Alaa Albashier
[17/05/2024, 4:46:24โฏPM] ~โฏFares Hamid: ูุงุนูุงู ุงุญุฏ ุนูุฏู PT1 test 1 past year 2023 ุงู ุญุชู 2024 ุญูููููุง
[18/05/2024, 2:36:01โฏAM] ~โฏูููุงู ุณูุทุงู: https://drive.google.com/drive/folders/1UnzOkAKJKkOOuMGfOM_-URXRnqVkkouT?usp=drive_link
โ[19/05/2024, 3:05:43โฏPM] ~โฏุนุจุฏุงููู ุงููุธุงุฑู: โ<attached: 00000569-PHOTO-2024-05-19-15-05-43.jpg>
[19/05/2024, 5:51:34โฏPM] ุฃุณุงูุฉ ุงูุญุณุงู ูุงููุฏูุดู: ุงูุณูุงู ุนูููู
ุฃุญุฏ ุนูุฏู ุงุฎุชุจุงุฑุงุช ุณุงุจูุฉ ููุงุฏุฉ Software Engineering ุ
[19/05/2024, 6:06:33โฏPM] ~โฏใ โโข โกฬฌฬฉฬะดฮฒฦกวชฦกฤยฒยบยนยณ: ูุนูููู ุงูุณูุงู
[19/05/2024, 6:06:38โฏPM] ~โฏใ โโข โกฬฌฬฉฬะดฮฒฦกวชฦกฤยฒยบยนยณ: Wait yaaa
โ[19/05/2024, 6:08:19โฏPM] ~โฏใ โโข โกฬฌฬฉฬะดฮฒฦกวชฦกฤยฒยบยนยณ: 5_6237674264900667672.pdf โข โ26 pages โ<attached: 00000573-5_6237674264900667672.pdf>
โ[19/05/2024, 6:08:19โฏPM] ~โฏใ โโข โกฬฌฬฉฬะดฮฒฦกวชฦกฤยฒยบยนยณ: 5_6237674264900667673.pdf โข โ9 pages โ<attached: 00000574-5_6237674264900667673.pdf>
โ[19/05/2024, 6:08:19โฏPM] ~โฏใ โโข โกฬฌฬฉฬะดฮฒฦกวชฦกฤยฒยบยนยณ: 5_6237674264900667675.pdf โข โ16 pages โ<attached: 00000575-5_6237674264900667675.pdf>
[19/05/2024, 6:29:55โฏPM] ุฃุณุงูุฉ ุงูุญุณุงู ูุงููุฏูุดู: ุณููุช ูุง ุญุจูุจ ๐ค
[19/05/2024, 6:33:07โฏPM] ~โฏใ โโข โกฬฌฬฉฬะดฮฒฦกวชฦกฤยฒยบยนยณ: โThis message was deleted.
[19/05/2024, 6:33:13โฏPM] ~โฏใ โโข โกฬฌฬฉฬะดฮฒฦกวชฦกฤยฒยบยนยณ: Welcome
โ[20/05/2024, 6:40:44โฏAM] ~โฏAbdullah Al-Shateri: โ<attached: 00000579-PHOTO-2024-05-20-06-40-44.jpg>
[20/05/2024, 6:41:10โฏAM] ~โฏAbdullah Al-Shateri: ุงูุณูุงู ุนูููู ู ุฑุญูุฉ ุงููู ูุจุฑูุงุชูุ 
ุดุจุงุจ ุงุญุฏ ูุนุงู ุฑูู ูุฐู ุฏูุชูุฑุฉุ
โ[20/05/2024, 6:43:36โฏAM] ~โฏAhmed Abdulhafith Alkabyle: โ<attached: 00000581-Dr Farkhana.vcf>
[20/05/2024, 6:43:57โฏAM] ~โฏAbdullah Al-Shateri: ุชุณูู
[20/05/2024, 6:58:05โฏAM] ~โฏBaraah: ุงูุณูุงู ุนูููู ูุฑุญูุฉ ุงููู
ูู ุงุญุฏ ุนูุฏู ุงุฎุชุจุงุฑ ููุงุฏุฉ High Performance Parallel Computing ุ
โ[20/05/2024, 7:07:58โฏAM] ~โฏMohannad Jebril: 2022-2023-02-hppc-midterm-PartB-and-PartC-structured-questions.pdf โข โ2 pages โ<attached: 00000584-2022-2023-02-hppc-midterm-PartB-and-PartC-structured-questions.pdf>
[20/05/2024, 7:30:42โฏAM] ~โฏYoussey Tahoon: ุงูุณูุงู ุนูููู
ููู ุญุฏ ุนูุฏู ุทุฑููู ุงุฌูุน ุงูุชูููุน ูุฐุง ููู pdf ุงุฌูุนูู ูู ููู pdf ูุงุญุฏุ โ<This message was edited>
[21/05/2024, 5:04:52โฏAM] ~โฏๅ ุญููููุฒูุฉก: ูุด ุงูุตูุฑู ุฏู ๐๐๐๐
[21/05/2024, 5:10:25โฏAM] Majoody: ุงูุฏูุชูุฑุฉ ุทูุจุฉ ุฌุฏุง
[21/05/2024, 5:16:02โฏAM] ~โฏAbdullah Al-Shateri: ูุฐุง ุงูููุฌูุฏ ูู ูููู๐
[21/05/2024, 8:07:14โฏAM] ~โฏๅ ุญููููุฒูุฉก: ูุง ููุช ุดู ๐
[21/05/2024, 8:07:19โฏAM] ~โฏๅ ุญููููุฒูุฉก: ุงูุตูุฑุฉ ุบุฑูุจู ุจุณ
โ[21/05/2024, 9:20:28โฏAM] Alaa Albashier: โ<attached: 00000591-STICKER-2024-05-21-09-20-28.webp>
โ[21/05/2024, 1:13:29โฏPM] ~โฏMohamad Noureddine: โ<attached: 00000592-PHOTO-2024-05-21-13-13-29.jpg>
[21/05/2024, 1:57:32โฏPM] ~โฏFares Hamid: ูุนูุงู ุนูุฏูุง ุฏูุชูุฑู ุงุณููุง aryati ูู ุชุนุงูู ูุนุงูุง
[21/05/2024, 1:57:44โฏPM] ~โฏFares Hamid: Aryati binti bakri
โ[21/05/2024, 2:15:52โฏPM] ~โฏ.: โ<attached: 00000595-STICKER-2024-05-21-14-15-52.webp>
[21/05/2024, 2:33:49โฏPM] ~โฏAbdullah Yaser Alnadhari: ุงูุณูุงู ุนูููู ูุฑุญูุฉ ุงููู ูุจุฑูุงุชูุ
ูู ุจูุฑุฉ ุงุฌุงุฒุฉุ
[21/05/2024, 2:34:10โฏPM] ุฃุณุงูุฉ ุงูุญุณุงู ูุงููุฏูุดู: ูุนูููู ุงูุณูุงู ูุฑุญูุฉ ุงููู ูุจุฑูุงุชู
[21/05/2024, 2:34:14โฏPM] ุฃุณุงูุฉ ุงูุญุณุงู ูุงููุฏูุดู: ูุนูุ ุฅุฌุงุฒุฉ
[21/05/2024, 2:34:15โฏPM] ~โฏAhmed Marwan: ูุนูููู ุงูุณูุงู 
ูุจ
[21/05/2024, 2:34:33โฏPM] ~โฏAbdullah Yaser Alnadhari: ุชูุงู ุดูุฑุง ๐น
โ[22/05/2024, 11:21:22โฏAM] ~โฏAmr Al-wafi: Final Exam Sem 2 2023 2024  First Draft.pdf โข โ4 pages โ<attached: 00000601-Final Exam Sem 2 2023 2024  First Draft.pdf>
โ[22/05/2024, 11:24:34โฏAM] ~โฏYoussey Tahoon: Final Exam Sem 2 2023 2024  First Draft.pdf โข โ4 pages โ<attached: 00000602-Final Exam Sem 2 2023 2024  First Draft.pdf>
[22/05/2024, 3:16:44โฏPM] ~โฏOmar ABasset: ุงูุณูุงู ุนูููู
ูุชู ุงุฎุชุจุงุฑ ุงูscience and Technology thinking
ูุด ูุฐููุฑ ููุง
[22/05/2024, 3:20:21โฏPM] ~โฏAhmed Marwan: ูุนูููู ุงูุณูุงู 
ูุงููุง ุงุฎุชุจุงุฑ ููุงุฆู
[22/05/2024, 3:26:11โฏPM] ~โฏOmar ABasset: ุงูุงุุชุณูู
[24/05/2024, 8:56:30โฏAM] ~โฏAbdulkader: ุฌูุนุชูู ุทูุจุฉุ
ุฃุญุชุงุฌ ูุญู ุฎูุงุท ุฃุตูุญ ุนูุฏู ุฃุฒุฑุงุฑ ุฌุงููุช ุฅุฐุง ุฃุญุฏ ูุนุฑู
[24/05/2024, 9:02:01โฏAM] ~โฏM.Bajameel: U mall 
ุงูุฏูุฑ ุงูุซุงูู ููู ุฎูุงุท
[24/05/2024, 9:03:13โฏAM] ~โฏAbdulkader: ุดูุฑูุง
โ[26/05/2024, 6:31:52โฏAM] ~โฏFouad: โimage omitted
[26/05/2024, 6:35:01โฏAM] ~โฏMohaned: +60 12 740 9224
[26/05/2024, 6:35:17โฏAM] ~โฏMohaned: ูุนูููู ุงูุณูุงู
โ[27/05/2024, 4:12:03โฏPM] ~โฏAbdullah Al-Shateri: โ<attached: 00000612-GIF-2024-05-27-16-12-03.mp4>
โ[28/05/2024, 10:05:24โฏAM] ~โฏM.Alkhatib: โ<attached: 00000613-PHOTO-2024-05-28-10-05-24.jpg>
โ[28/05/2024, 10:05:25โฏAM] ~โฏM.Alkhatib: โ<attached: 00000614-PHOTO-2024-05-28-10-05-25.jpg>
[28/05/2024, 10:27:13โฏAM] Hamdan Saleh: ูุงุดุจุงุจ ุงู attendance report ู ุงู status verification letter ุงุฎุฑุฌูู ูู ููุชุจ ุงูููููุ
โ[28/05/2024, 10:31:34โฏAM] ~โฏFares Hamid: โ<attached: 00000616-PHOTO-2024-05-28-10-31-34.jpg>
[28/05/2024, 10:31:42โฏAM] ~โฏFares Hamid: https://admission.utm.my/
[28/05/2024, 10:32:04โฏAM] Hamdan Saleh: ูุงู attendance
[28/05/2024, 10:32:30โฏAM] ~โฏFares Hamid: ูุฏุฑู ูุงููู
[28/05/2024, 10:34:54โฏAM] ~โฏใ โโข โกฬฌฬฉฬะดฮฒฦกวชฦกฤยฒยบยนยณ: ุงููุธุงู ุงูุฌุฏูุฏ ุชุงุฎุฐ ููุฑู ุงูุงุชูุฏุณ ูู ุงูุงูุงุฏููู ุงูููุณ ุจุนุฏูู ุชุฎูู ูู ุฏูุชูุฑ ูููุน ุนููู
[28/05/2024, 10:35:11โฏAM] Hamdan Saleh: ูุงููู
[28/05/2024, 10:35:23โฏAM] Hamdan Saleh: ุงูู ุดูุฑโค๏ธ
[28/05/2024, 10:35:50โฏAM] ~โฏใ โโข โกฬฌฬฉฬะดฮฒฦกวชฦกฤยฒยบยนยณ: ุงููู ูุนูู ุงูุง ุจุนุฏู ุจุดูุฑ ุญุฑูุญ ุงุฏูุฑ ููู ๐
[28/05/2024, 10:35:53โฏAM] ~โฏใ โโข โกฬฌฬฉฬะดฮฒฦกวชฦกฤยฒยบยนยณ: ุงูุนูู
[28/05/2024, 10:36:04โฏAM] ~โฏAbdulkader: ุณูููุง ูู ุงูุญูู ูุตูุญุฉ
[28/05/2024, 10:36:19โฏAM] ~โฏใ โโข โกฬฌฬฉฬะดฮฒฦกวชฦกฤยฒยบยนยณ: ูุงูุชุงุฑูุฎ ุนุงุฏู ุ
[28/05/2024, 10:39:06โฏAM] ~โฏAbdulkader: ูู ุงูattendance report ุฑุงุญ ูููู ุนูู ุขุฎุฑ ุณูุณุชุฑ ุงูุช ุฎูุตุชู
[28/05/2024, 8:33:54โฏPM] ~โฏMohamad Noureddine: foad 100%
[30/05/2024, 7:51:27โฏAM] ~โฏMoath_Mo.dev: ูุนูุงู ููู ุชูุชุฑุญูุง ุฏูุชูุฑ ู PSM -SE?
[30/05/2024, 9:20:34โฏAM] ~โฏSalem: Siti zaiton
[30/05/2024, 9:21:01โฏAM] ~โฏSalem: ุงุฐุง ูุง ุชูุงุนุฏุช ๐
[30/05/2024, 9:21:28โฏAM] ~โฏSalem: ุงู ุฑูููุฏุง
[30/05/2024, 9:22:41โฏAM] ~โฏMoath_Mo.dev: ุงูุง ููุฌูุฏู ุ ุงู AA ุชุจุนู ุงุตูุง
[30/05/2024, 9:23:46โฏAM] ~โฏMoath_Mo.dev: ุจุณ ูุฎู ุณูุนุช ุงูู ูุงุฒู ุงูุฏูุชูุฑ ูููู ูุงูู ู ุงูููุฑุฉ ุงูู ุจุชุฎุชุงุฑูุง ุ ูุซูุง ููุจุ ุงุจ ..ููุง ูู ุดุฑุทุ โ<This message was edited>
[30/05/2024, 9:25:57โฏAM] ~โฏSalem: ููุถู ุงุฐุง ุจุชุดุชุบู ููุจ ูุงููู ูู ุตุญ ูุด ูุซูุฑ ุจุณ ุจุชููุฏู ุงูุง ุนุทุชูู ูุฐุง ูุตูุญุฉ ูู ุงูุฃุจูููุดู ุงูู ุณููุชู ูุงุฏุชูู ููุช ุงูุชูุฏูู
[30/05/2024, 9:26:12โฏAM] ~โฏSalem: ุจุณ ุนูุจูุง ูููู ุงููุง ูุง ุชุชุงุจุน ูุซูุฑ ูุน ุงูุทุงูุจ
[30/05/2024, 9:26:27โฏAM] ~โฏSalem: ุฑูููุฏุง ุฎูุงุฑ ุงูุถู
[30/05/2024, 9:26:36โฏAM] ~โฏMoath_Mo.dev: ุฒุฑุงูููุง ุชุนุฑููุง ุ
[30/05/2024, 9:26:48โฏAM] ~โฏMoath_Mo.dev: ุงุญุณูุง ุงุญุณู ุดูุก ุงุฐุง ุจุณูู ููุจ
[30/05/2024, 9:27:23โฏAM] ~โฏSalem: ุงุชุฃูุฏ ูููุง ูุฃูู ุงุชูุงุตูุช ูุนูุง ููุงูุช ูุง ุชูุฏุฑ ุชุงุฎุฐ ุทูุงุจ ุณููุชููุฑ
โ[30/05/2024, 9:28:21โฏAM] ~โฏSalem: โ<attached: 00000641-PHOTO-2024-05-30-09-28-21.jpg>
[30/05/2024, 9:28:21โฏAM] ~โฏMoath_Mo.dev: ุดูุช ุตุญ ููุง ูุชูุฑู ูุณูุช ๐ถ โ<This message was edited>
[30/05/2024, 9:29:06โฏAM] ~โฏMoath_Mo.dev: ุณูุชู ุชููู ู ุงูููุจ ุจูุงู ๐ุ
[30/05/2024, 9:29:42โฏAM] ~โฏMoath_Mo.dev: ุจููุนูุง ูุนููู
[30/05/2024, 9:29:54โฏAM] ~โฏSalem: ูุด ูุซูุฑ ุงูุตุฑุงุญุฉ ุงูุง ููุช ุดุบุงู ููุงุชุฑ ุงูููุฏ ูุง ุณูุช ุนููู ุงู ุฑููู ุจุณ ุนุทุชูู features ุงุถูููุง ููุชุทุจูู
[30/05/2024, 9:30:19โฏAM] ~โฏSalem: ุงููู ููููู
[30/05/2024, 9:31:06โฏAM] ~โฏMoath_Mo.dev: ุฑุงุฏุฒูุงู ุ ุดุงุฑููุ  ุฌููุงูุง ููู ู ุงูููุจ ูู ุนูุฏู ุฎูููู ุ
[30/05/2024, 9:34:21โฏAM] ~โฏSalem: ุฑุงุฏุฒูุงู ุฎุฐุช ูุนูุง sqa ูุฏุฑู ูุถุนูุง ูู ุงูููุจ ุจุณ ุชุฏูู ูุซูุฑ ุตุญ ุจุชููุฏู ุจุณ ูููู ุชููุตู

ุดุงุฑูู ูุนุฑู ุดูุถุนูุง ุงูุตุฑุงุญุฉ

ุฌููุงูุง ููุชุงุฒุฉ ูุงูุช ุงู evaluator ูู ุนุฑุถ ูุดุฑูุน ุงูุชุฎุฑุฌ ููุงููู ูู ุงูููุจ ู ุงูุชุทุจููุงุช.
[30/05/2024, 9:35:14โฏAM] ~โฏMoath_Mo.dev: ุชุณูู ุญุจู
[30/05/2024, 9:35:24โฏAM] ~โฏSalem: ุงููู ูุณููู
[30/05/2024, 9:39:20โฏAM] ~โฏYoussey Tahoon: ุงุฐุง ูุงุญุฏ ุจูุดุชุบู ุจููุงุชุฑ ูุฎุชุงุฑ ุณูุชู ุฒุงูุชูู ููุง ุฑููุงูุฏูุ
[30/05/2024, 10:42:36โฏAM] ~โฏSalem: ุงุฐุง ุชุจู ูุงุญุฏ ูุฎุชุต ูู ููุงุชุฑ ุนูุฏู ุฌูููู ุชูุฑูุจุงู ุงูุถู ุฏูุชูุฑ ูุงูู ูููุง ูู ุงูุฌุงูุนู
[30/05/2024, 10:42:51โฏAM] ~โฏSalem: ุงุฐุง ุชุจู ูู ูุงุญูุฉ ููู ููุบู โ<This message was edited>
[30/05/2024, 10:43:39โฏAM] ~โฏSalem: ุฒูุชูู ู ุฑูููุฏุง ุชุฑุดูุญ ูู ูุงุญูุฉ ุชุนุงูููู ูุน ุงูุทุงูุจ ูู ุงูููุงู ุงูุฃูู
[30/05/2024, 11:50:40โฏAM] ~โฏYoussey Tahoon: ูู ููุณุงุนุฏ ูุชูุฑ ุฌุฏุง ุฌูููู ุจุณ ุงูุฏุฑุฌู ูุชููู ุชุญุช ูุนุงู ููู
[30/05/2024, 11:50:51โฏAM] ~โฏYoussey Tahoon: ูุฑุฏูุง ุงูู ุจุงูู ุนูู ุงูุทูุจูุ
[30/05/2024, 12:32:16โฏPM] ~โฏSalem: ุฑูููุฏุง ูุนู
[31/05/2024, 5:52:59โฏAM] ~โฏMoath_Mo.dev: ุงุญุฏ ุนูุฏู ุฑูู ุงู ุชูููุฑุงู ุฏูุชูุฑ ุดุงุฑูู ุ
โ[31/05/2024, 6:14:40โฏAM] ~โฏM.Bajameel: โ<attached: 00000659-PHOTO-2024-05-31-06-14-40.jpg>
[03/06/2024, 1:54:56โฏPM] ~โฏ๐๐๐๐๐ โโถโโพ: [Youth Speak Forum Roadshow] 
Panel Discussion: Workforce and Technology

We're glad to have the Ex-Marketing Lead of UTM AIROST Club, Hoh Chew Wen to be our speaker today!๐๐

Let's discover what are the topics they would like to share ๐ฅฐ  
 
Date: Saturday, 8 June 2024    
Time: 9.30 AM -  5 PM    
Location: DK8,  N24  
Fee: FREE    
*UTM Merit will be provided     
      
Register nowโผ๏ธ        
https://shorturl.at/auIR8    
 
For more inquiries, do contact us at:            
OC Delegate Service: Ong Hong Yao           
Telegram: https://t.me/ONGHONGYAO        
WhatsApp: https://wa.me/60183680023                                                                                      
  
#YouthSpeak2024 
#EmpowerYouth 
#PositiveChange 
#Roadshow
โ[03/06/2024, 6:00:08โฏPM] ุฃุณุงูุฉ ุงูุญุณุงู ูุงููุฏูุดู: Final Exam Sem 2 2023 2024 Second Draft.pdf โข โ4 pages โ<attached: 00000661-Final Exam Sem 2 2023 2024 Second Draft.pdf>
[03/06/2024, 6:36:55โฏPM] ~โฏ๐๐๐๐๐ โโถโโพ: Final Draft?
[03/06/2024, 6:37:16โฏPM] ~โฏMustafa: no 2nd
[03/06/2024, 6:37:32โฏPM] Hamdan Saleh: ูุชู ูุชุซุจุช ุงูุฌุฏูู
[03/06/2024, 6:57:42โฏPM] ~โฏAhmed Abdulhafith Alkabyle: ุงุฎุฑ ููู ููุชุนุฏูู  6/6 โ<This message was edited>
โ[04/06/2024, 3:18:33โฏAM] Alaa Albashier: โ<attached: 00000666-PHOTO-2024-06-04-03-18-33.jpg>
[04/06/2024, 3:18:40โฏAM] Alaa Albashier: ุงูุณูุงู ุนูููู ุงูุด ูู mykad
[04/06/2024, 3:29:33โฏAM] ~โฏ.: ูุนูููู ุงูุณูุงู
[04/06/2024, 3:30:15โฏAM] ~โฏ.: ุจุทุงูุฉ ุงููููุฉ
[04/06/2024, 3:33:21โฏAM] ~โฏ.: ูุนุทูู ุฅูุงู ุจุนุฏ ูุง ุชุณุชูู ุงูุฌูุงุฒ
[04/06/2024, 3:41:56โฏAM] Alaa Albashier: ูุนุทูู ุงูู ุนุงููุฉ
[04/06/2024, 4:04:23โฏAM] ~โฏๅ ุญููููุฒูุฉก: ุงูุณูุงู ุนูููู
[04/06/2024, 4:05:28โฏAM] ~โฏๅ ุญููููุฒูุฉก: ุงู international office ููุชุญ ูู ูุชู ุ
[04/06/2024, 6:18:52โฏAM] ~โฏ.: ูจ ุฃู ูฉ ุชูุฑูุจุง ู ูกูข:ูฃู 
ูกูข:ูฃู ู ูข:ูฃู ุจุฑูู
ุซุงูู ูู ูข:ูฃู ู ูค ูุณุงุก
[04/06/2024, 6:19:05โฏAM] ~โฏ.: ุญุงูู ุฃูุดู ุงูุขู ุฃู ุงูุณุงุนุฉ ูฃ ูุฏุง ููุถูุงู
[04/06/2024, 8:12:23โฏAM] ~โฏAli Elber: ุดุจุงุจ ุงุญุฏ ูุนุฑู email ุงู ุฏูุชูุฑู Dayan 
ุชุดุชุบู ูู ุงู academic office
[04/06/2024, 8:12:37โฏAM] ~โฏAli Elber: ุฃู ุงู head of academic office
[04/06/2024, 8:13:40โฏAM] ุฃุณุงูุฉ ุงูุญุณุงู ูุงููุฏูุดู: dayang@utm.my
[04/06/2024, 8:13:55โฏAM] ุฃุณุงูุฉ ุงูุญุณุงู ูุงููุฏูุดู: ูู ูุงุฆุจ ุงูุนููุฏ ุฃุนุชูุฏ
[04/06/2024, 8:14:21โฏAM] ~โฏAli Elber: ุชุณูู ุงูุฏู ุณูุนุช ุงูู ููุงู ูู ุฏูุชูุฑุฉ ููุงู ููุง ุงู head
[04/06/2024, 8:14:30โฏAM] ~โฏAli Elber: ุงูู ุชูุงู
[04/06/2024, 8:14:51โฏAM] ุฃุณุงูุฉ ุงูุญุณุงู ูุงููุฏูุดู: ุงููู ูุณููู
[05/06/2024, 7:17:53โฏAM] Hamdan Saleh: ุงูุณูุงู ุนูููู ูุงุนูููู
โ[05/06/2024, 7:18:04โฏAM] Hamdan Saleh: โ<attached: 00000684-PHOTO-2024-06-05-07-18-04.jpg>
โ[05/06/2024, 7:20:35โฏAM] ~โฏ3mar..: โ<attached: 00000685-Azurah AS.vcf>
[05/06/2024, 7:22:53โฏAM] Hamdan Saleh: ุนุงุงุงุงุด
[05/06/2024, 7:24:09โฏAM] Hamdan Saleh: ูุฐุง ุญููุง ุงูุชูููุฌุฑุงู
[05/06/2024, 7:24:17โฏAM] Hamdan Saleh: ูุง ูุนู ุฑูููุง
[05/06/2024, 7:24:22โฏAM] Hamdan Saleh: ูุงููุง ูุงุชุฑุฏ ุชูุฌุฑุงู
[05/06/2024, 7:24:30โฏAM] ~โฏ3mar..: ูุง
[09/06/2024, 7:50:02โฏPM] Abdullah Neighbor: ุงูุณูุงู ุนูููู 
ุงุฐุง ูู ุงุญุฏ ุณููุชููุฑ ูุงุฎุฐ fyp 1 
ูุงุญุฏ ูู ุงูุดุจุงุจ ูุญุชุงุฌ ุฑุงุจุท ุงููุฑูุจ
[10/06/2024, 2:54:11โฏPM] ~โฏ๐๐๐๐๐ โโถโโพ: ูุณุงุก ุงูุฎูุฑุ
ูู ุฏูุน ุฑุณูู ุงููุตู ููุชูุญ ุญุงููุงุ ู ุดูุฑุงู.
[10/06/2024, 2:55:15โฏPM] ุฃุณุงูุฉ ุงูุญุณุงู ูุงููุฏูุดู: ูุณุงุก ุงูููุฑ
ูุนูุ ูุนูููุง ๐
[11/06/2024, 7:51:17โฏAM] ~โฏYoussey Tahoon: ุงูุณูุงู ุนูููู
ุญุฏ ุนูุฏู ุนูู ูุชู ุงูcourse registration ููุชุญุ
โ[11/06/2024, 7:56:17โฏAM] ุฃุณุงูุฉ ุงูุญุณุงู ูุงููุฏูุดู: โ<attached: 00000695-PHOTO-2024-06-11-07-56-17.jpg>
[11/06/2024, 7:56:29โฏAM] ุฃุณุงูุฉ ุงูุญุณุงู ูุงููุฏูุดู: ูุนูููู ุงูุณูุงู ูุฑุญูุฉ ุงููู ูุจุฑูุงุชู
[11/06/2024, 11:51:10โฏAM] ~โฏMoath_Mo.dev: ุดุจุงุจ ุงุญุฏ ูุนุง ุฑูููุง /ุชููู Dr. Noraini Ibrahimุ
[11/06/2024, 12:25:37โฏPM] ~โฏ.: ูุฐู ูุง ุชุนุทู ุญุณุงุจูุง ุงู ุฑูููุง ูุงุญุฏ
ูุงุฒู ุชุฑูุญ ููุชุจูุง
[11/06/2024, 12:25:56โฏPM] ~โฏ.: ุงู ุฌุฑุจ ูู utm staff
โ[12/06/2024, 3:15:26โฏPM] ~โฏ๐๐๐๐๐ โโถโโพ: โ<attached: 00000700-PHOTO-2024-06-12-15-15-26.jpg>
โ[12/06/2024, 3:15:26โฏPM] ~โฏ๐๐๐๐๐ โโถโโพ: โ<attached: 00000701-PHOTO-2024-06-12-15-15-26.jpg>
[12/06/2024, 3:15:53โฏPM] Hamdan Saleh: ุงุชููุน ุนุงุฏู ุชุงุฑูุฎ ูกูฆ
[12/06/2024, 3:16:15โฏPM] ~โฏ๐๐๐๐๐ โโถโโพ: ุฑูุญุงูู ุฑุณูุช ุงูููู ูุงูุช ุงูู ูกูข...
โ[12/06/2024, 3:16:48โฏPM] ~โฏ๐๐๐๐๐ โโถโโพ: โ<attached: 00000704-PHOTO-2024-06-12-15-16-48.jpg>
[12/06/2024, 3:17:13โฏPM] Hamdan Saleh: ูููู ุจุนุฏ ุงูุณุงุนู ูกูข
โ[12/06/2024, 3:17:55โฏPM] ุฃุณุงูุฉ ุงูุญุณุงู ูุงููุฏูุดู: โ<attached: 00000706-PHOTO-2024-06-12-15-17-55.jpg>
[12/06/2024, 3:18:10โฏPM] ุฃุณุงูุฉ ุงูุญุณุงู ูุงููุฏูุดู: ุชูุตุฏ ุงูุฅุฌุชูุงุน
[12/06/2024, 3:20:02โฏPM] ~โฏ๐๐๐๐๐ โโถโโพ: ุงูุงุ ุณูุก ููู ูู ุนูุฏู. ุชุณูููุง ุนูุชูุถูุญ
[12/06/2024, 3:21:10โฏPM] ~โฏ.: ุดุจุงุจ ููู ุจููุง ุงู course list?
[12/06/2024, 3:21:20โฏPM] ~โฏ.: ุชูุฑูุจุง ุงู list ุญุชูุฒู ููู ูกูข ู ุงูุชุณุฌูู ูุจุฏุฃ ููู ูกูฆ ุตุญุ
[12/06/2024, 3:28:28โฏPM] Hamdan Saleh: ุฑูุญุงูู ูุงูุช ุจุชุณูู ุงุฌุชูุงุน ุนูู ุงูููุฑุณ ููุณุช ุชุงุฑูุฎ ูกูข ุงูู ูู ุงูููู
[12/06/2024, 3:28:35โฏPM] Hamdan Saleh: ุจุณ ูุงุญุฏุฏุช ูุชู ุจููุฒู
[12/06/2024, 3:31:04โฏPM] ~โฏ.: ุงูุงุงุง ุทูุจ ูุดูููุฑ
[12/06/2024, 5:30:11โฏPM] ~โฏ.: ุงูุณูุงู ุนูููู
[12/06/2024, 5:30:29โฏPM] ~โฏ.: ูู ููู ุจุนูู ุงู evaluation ููุฏูุงุชุฑุฉุ
[12/06/2024, 5:39:10โฏPM] ุฃุณุงูุฉ ุงูุญุณุงู ูุงููุฏูุดู: ูุนูููู ุงูุณูุงู ูุฑุญูุฉ ุงููู ูุจุฑูุงุชู 
utm portal > student portal > ePPPK
[15/06/2024, 2:04:14โฏPM] Hamdan Saleh: ุงูุณูุงู ุนูููู
[15/06/2024, 2:04:29โฏPM] Hamdan Saleh: ูุงุดุจุงุจ ูุงููุด ุงุฎุจุงุฑ ุนูู timetable?
[15/06/2024, 4:33:54โฏPM] ~โฏA.: ุดุจุงุจ ูู ูู ุงุญุฏ ูุฏ ุงุฎุฐ OOP ูุน ูุฒูุงุชู ููุณุง ูุฎุชูุธ ุจุงูุจุฑูุฌูุช ูุงููุช ูููุฏูุง๐ฅฒ๐๐ป
[15/06/2024, 4:35:42โฏPM] ~โฏ.: ++++
[15/06/2024, 4:35:53โฏPM] ~โฏ.: ูุงูู ุดู ูุฒู ุนูุฏู ููุขู
[15/06/2024, 7:11:19โฏPM] Hamdan Saleh: https://bit.ly/Timetable202420251
[15/06/2024, 7:11:24โฏPM] Hamdan Saleh: ูุฒูููููู๐ฅณ๐ฅณ๐ฅณ๐ฅณ๐ฅณ
[15/06/2024, 7:16:41โฏPM] ~โฏ๐๐๐๐๐ โโถโโพ: ูุงูู ูุง ุงุณูุงุก ุงูุฏูุงุชุฑุฉ ููุง ุงูููุช ๐
[15/06/2024, 7:32:44โฏPM] Majoody: ุญุงููุช ุงุณุฌู ุงุตูุง ููุง ูุฏุฑุช
[15/06/2024, 7:32:48โฏPM] Majoody: ุงุญุฏ ูุฏุฑ ูุณุฌู ููุงุฏ ุ
โ[15/06/2024, 7:33:22โฏPM] Hamdan Saleh: โ<attached: 00000727-STICKER-2024-06-15-19-33-22.webp>
[15/06/2024, 7:44:02โฏPM] ~โฏ.: ูููุชูุง ูู ุณูุณุชุฑ ูุจุฏุนูู
[15/06/2024, 7:44:27โฏPM] ~โฏ.: ุงูุณูุณุชุฑ ุงูุฌุงู ุจูุณุฌููู ุฃุณู ุงููุงุฏุฉ ูุงูุช ุฎูู ุงูุณูุงุดู
[15/06/2024, 7:45:36โฏPM] ~โฏAhmed Marwan: ุตุงุฑุช
โ[15/06/2024, 7:46:02โฏPM] Hamdan Saleh: โ<attached: 00000731-STICKER-2024-06-15-19-46-02.webp>
โ[16/06/2024, 6:03:04โฏAM] ~โฏ.: โ<attached: 00000732-PHOTO-2024-06-16-06-03-04.jpg>
[16/06/2024, 6:03:43โฏAM] Hamdan Saleh: ูู ููู ุฌุจุช ุงูุงุณูุงุกุุุุ
[16/06/2024, 6:07:27โฏAM] ~โฏ.: ู ุงููู ูู ูุญุฏุฉ ูุงูุช ููุชูุง attached ูุน ุงูููู ุงูุงุชุฑุณู ูู ุงูุงูููู
[16/06/2024, 6:07:42โฏAM] ~โฏ.: ุจุณ ุฃูุง ู ูู ุดุฎุต ูุง ููููุงูุง ุจุฑุถู
[16/06/2024, 6:09:37โฏAM] Hamdan Saleh: ุงูุง
โ[16/06/2024, 6:10:19โฏAM] ~โฏ.: โ<attached: 00000737-PHOTO-2024-06-16-06-10-19.jpg>
[16/06/2024, 6:10:49โฏAM] Hamdan Saleh: ูุงูุถูุฑูู๐ข
[16/06/2024, 6:10:56โฏAM] ~โฏ.: ุฃูุง ููุงู ู ุงููู
[16/06/2024, 6:11:08โฏAM] ~โฏ.: ุจุณ ูุง ุนูููุง ูููู ุฃุญุฏ ููุฑููู๐ญ
[16/06/2024, 6:11:37โฏAM] Hamdan Saleh: Nurfazrina ุฏุฑุณุช ุนูุฏูุง ูู ูุจู ุทูุจู
โ[16/06/2024, 6:12:15โฏAM] ~โฏProffessor: โ<attached: 00000742-PHOTO-2024-06-16-06-12-15.jpg>
[16/06/2024, 6:12:36โฏAM] ~โฏProffessor: ููุง ูู ุงูุถู ููdatabase
[16/06/2024, 6:12:52โฏAM] Hamdan Saleh: Izyaaaaan๐ฆ๐ฆ๐ฆ๐ฆ๐ฆ๐ฆ
[16/06/2024, 6:14:32โฏAM] ~โฏProffessor: ุจุนุถูู ูุงููุง ูููููุง nies ุงูุถู ูุงุญุฏุฉุ
โ[16/06/2024, 6:15:56โฏAM] ~โฏ.: Timetable Semester I, Session of 2024_2025.xlsx โข โ4 sheets โ<attached: 00000746-Timetable Semester I, Session of 2024_2025.xlsx>
โ[16/06/2024, 6:18:21โฏAM] ~โฏProffessor: โ<attached: 00000747-PHOTO-2024-06-16-06-18-21.jpg>
[16/06/2024, 6:18:45โฏAM] ~โฏProffessor: ูุงูsoftware ููู
[16/06/2024, 6:18:45โฏAM] ~โฏYoussey Tahoon: Johanna
[16/06/2024, 6:19:40โฏAM] ~โฏAhmed Marwan: ูุฏุฑุฌุงุช ููู ุดุฑุญูุง ุณูุก ุฌุฏุงู
[16/06/2024, 6:21:09โฏAM] Hamdan Saleh: NIES ุจุฑุถู ุชูุงู ุจุณ ุงูุตุฑุงุญู IZYAN ุทูุจู
[16/06/2024, 6:21:12โฏAM] ~โฏProffessor: ูizyana ุงูุฏุฑุฌุงุช ุดุฏูุฏุฉ ููุง ููู โ<This message was edited>
โ[16/06/2024, 6:21:22โฏAM] ~โฏAbdullah: โ<attached: 00000753-PHOTO-2024-06-16-06-21-22.jpg>
[16/06/2024, 6:21:50โฏAM] Hamdan Saleh: ุทูุจู
โ[16/06/2024, 6:22:11โฏAM] ~โฏAbdullah: โ<attached: 00000755-PHOTO-2024-06-16-06-22-11.jpg>
[16/06/2024, 6:22:35โฏAM] ~โฏAhmed Marwan: ุฑููุฏูุง ููุฏุญููุง 
Sim ูููุณู ู ุงูุดุฑุญ ูุชุนุทูู ุญูู โ<This message was edited>
[16/06/2024, 6:22:57โฏAM] ~โฏAbdullah: ุงูุง ุนุงุฑู ุจุณ ูุงูุช ูุชุงุฎุฏ ุงุฌุงุฒู ุงูุชุฑู ุงูุฌู ุจูุณุจุฉ ูุจูุฑู
[16/06/2024, 6:23:14โฏAM] Hamdan Saleh: Johana
[16/06/2024, 6:23:18โฏAM] ~โฏAhmed Marwan: Zalmiyah ุดุฑุญูุง ูููุณ ู ุชุนุทูู ุญูู
[16/06/2024, 6:23:23โฏAM] ~โฏAbdullah: Sim? ูููุณุ
โ[16/06/2024, 6:27:22โฏAM] ~โฏMahmoud Elganzory: โ<attached: 00000761-PHOTO-2024-06-16-06-27-22.jpg>
[16/06/2024, 6:27:37โฏAM] Hamdan Saleh: ุฌูููู
โ[16/06/2024, 6:28:36โฏAM] ~โฏProffessor: โ<attached: 00000763-PHOTO-2024-06-16-06-28-36.jpg>
[16/06/2024, 6:29:10โฏAM] ~โฏProffessor: ูู ุงูุถู ููDSA โ<This message was edited>
[16/06/2024, 6:30:29โฏAM] ~โฏAhmed Marwan: ุฑุฒุงู ุทูุจ ููู ุดุฑุญู ุณูุก
โ[16/06/2024, 6:30:48โฏAM] Hamdan Saleh: โ<attached: 00000766-PHOTO-2024-06-16-06-30-48.jpg>
[16/06/2024, 6:31:42โฏAM] ~โฏAhmed Marwan: ูุง ูุนุทู ููุงุณุงุช ุงูุง ูุงุฏุฑ ูุงูุช ูุญุธู ู ุงูุฏุฑุฌุงุช ูุญุทูุง randomly
[16/06/2024, 6:31:57โฏAM] Hamdan Saleh: ูู ุงูุงูุถู ุจูููู
[16/06/2024, 6:32:38โฏAM] ~โฏAhmed Marwan: ููุงู ุณูู ุฏุฑูุจ ูููุงุฏู ููุง ุชุงุฎุฐ ุนูุฏู
ุนุตุฑู ูุฏุฑู ููู ูุถุนู
[16/06/2024, 6:33:01โฏAM] Hamdan Saleh: ูุงุณุงุชุฑ
โ[16/06/2024, 6:33:44โฏAM] ~โฏMahmoud Elganzory: โ<attached: 00000771-PHOTO-2024-06-16-06-33-44.jpg>
โ[16/06/2024, 6:34:44โฏAM] ~โฏProffessor: โ<attached: 00000772-PHOTO-2024-06-16-06-34-44.jpg>
[16/06/2024, 6:36:30โฏAM] ~โฏAhmed Marwan: Aida ูููุณู
โ[16/06/2024, 6:36:53โฏAM] Hamdan Saleh: โ<attached: 00000774-PHOTO-2024-06-16-06-36-53.jpg>
[16/06/2024, 6:37:00โฏAM] Hamdan Saleh: ูู ุงูุงูุถู
โ[16/06/2024, 6:40:36โฏAM] Hamdan Saleh: โ<attached: 00000776-PHOTO-2024-06-16-06-40-36.jpg>
[16/06/2024, 6:41:30โฏAM] ~โฏYoussey Tahoon: ุดุจุงุจ ุญุฏ ุนูุฏู ููุงุฏ ุงูelective ุงููู ูู UKQF2XX2
[16/06/2024, 6:45:17โฏAM] Majoody: ุนุงููุฏุฉ
[16/06/2024, 6:46:02โฏAM] ~โฏProffessor: ูุงูdsa ุงููู ุงูุถู ุจุงูุฏุฑุฌุงุช
[16/06/2024, 6:46:03โฏAM] Majoody: Norizam ุณูุนุช ุงูู ูููุณ
[16/06/2024, 6:46:13โฏAM] Majoody: ุงุชููู ุงูุดุจุงุจ ูุงูุฏูู
[16/06/2024, 6:46:37โฏAM] Majoody: ูุง ุนูุฏู ุนูู ูููู
ุฌุงูุณ ุงุฎุฐ ูุน ุฑุฒุงู ุญุงููุง ุดุฑุญ ูุงูู ูุฏุฑุฌุงุช ุงููู ุงุนูู
[16/06/2024, 6:47:19โฏAM] ~โฏ.: ุญุฏ ุฌุฑุจ Dr Seah ูุจู ูุฏุงุ
[16/06/2024, 6:47:26โฏAM] ~โฏ.: ููู ูู ุงูุดุฑุญ ู ุงูุฏุฑุฌุงุช ู ุงูุชุนุงูู
[16/06/2024, 6:47:30โฏAM] Majoody: ุดุฑุญ ุฌููู
[16/06/2024, 6:47:51โฏAM] Majoody: ุฏุฑุฌุงุช ุงู ุดุงุกุงููู ุงูู ุทูุจ ูุง ุดูุช ุงูู ูููู ุดุฏูุฏ ุงุจุฏุง
[16/06/2024, 6:48:01โฏAM] Majoody: ุฏูุชูุฑ ุฌุฏูุฏ ููุญุฏ ุฌุฑุจ ุฏุฑุฌุงุชู ููุงู
[16/06/2024, 6:48:25โฏAM] Majoody: ุงูุชุนุงูู ูุนู ุจูููู ููุชุงุฒ ุฏุงุฎู ุงูููุงุณ
ุจุฑุง ุงูููุงุณ ูุงุฏุฑ ูุฑุฏ ุนูู ุงูุฑุณุงูู
[16/06/2024, 6:49:25โฏAM] ~โฏ.: ุงูุงุง
[16/06/2024, 6:49:28โฏAM] ~โฏ.: ุทูุจ ุดูุฑุง ูู
[16/06/2024, 6:49:33โฏAM] Majoody: ุนููุง ุจุงู ููุช
โ[16/06/2024, 6:50:19โฏAM] ~โฏMahmoud Elganzory: โ<attached: 00000792-PHOTO-2024-06-16-06-50-19.jpg>
[16/06/2024, 6:50:46โฏAM] Hamdan Saleh: ๐
[16/06/2024, 6:50:56โฏAM] Majoody: Dr nor azman is good but a lot of work
[16/06/2024, 6:50:57โฏAM] Majoody: Heโs kind
[16/06/2024, 6:50:59โฏAM] Majoody: โThis message was deleted.
[16/06/2024, 6:51:42โฏAM] Majoody: He's a bit too serious about HCI
[16/06/2024, 6:52:30โฏAM] ~โฏMahmoud Elganzory: ูู ููุง ุญุฏ ูู ุงูุชุงููููุ
[16/06/2024, 6:52:39โฏAM] Majoody: he didnโt really give me a good grade also
[16/06/2024, 6:52:49โฏAM] Majoody: ูููู nor azman
โ[16/06/2024, 6:52:49โฏAM] ~โฏ๐ธSHIMAA SALAH ๐ธ: โ<attached: 00000801-PHOTO-2024-06-16-06-52-49.jpg>
[16/06/2024, 6:53:41โฏAM] Majoody: ุดูู ุงูุซุงููู ูุงุณุฃู ุนููู ุงุฐุง ูู ุฃูุถู ุฎูู ูุนู
โ[16/06/2024, 6:55:22โฏAM] ~โฏLeena: โ<attached: 00000803-PHOTO-2024-06-16-06-55-22.jpg>
[16/06/2024, 6:55:42โฏAM] Hamdan Saleh: Izyan
[16/06/2024, 6:56:07โฏAM] ~โฏ.: ุดุจุงุจ ูู KOQ 
What is the timetable and what are the available courses?
[16/06/2024, 6:58:31โฏAM] ~โฏ๐๐๐๐๐ โโถโโพ: ุงูุณูุงู ุนูููู,
ูู ูุดุงู ุงูุฏูู ุฃู Mohd Razak ุงูุถู application development ุ โ<This message was edited>
[16/06/2024, 7:01:34โฏAM] Majoody: ูุดุงู ุงูุฏูู
[16/06/2024, 7:01:47โฏAM] Majoody: ูุซูุฑ ููุฏุญููู ูู
[16/06/2024, 7:04:53โฏAM] ~โฏ๐๐๐๐๐ โโถโโพ: ููู ุงูุถู ููInternet Programming:

Norizam bin katmon
Nor Azizah Binti Sa'adon
[16/06/2024, 7:07:18โฏAM] Majoody: Norizam ูุงูู ุจุงูููุฏููุฌ
[16/06/2024, 7:12:23โฏAM] ~โฏ.: ุดุจุงุจ ูู 
Human computer interaction 

Dr sarina binti suliman 
Or 
Dr Aida binti Ali??
[16/06/2024, 7:12:38โฏAM] Majoody: ุนุงูุฏุฉ
[16/06/2024, 7:12:41โฏAM] ~โฏAhmed Marwan: ุนุงูุฏู
[16/06/2024, 7:34:37โฏAM] ~โฏYoussey Tahoon: ุดุจุงุจ Nies Hui Wen ูููุณู ููdatabase ุญุฏ ูุนุฑู ุนููุง ุงู ุดูุกุ โ<This message was edited>
[16/06/2024, 7:35:07โฏAM] Hamdan Saleh: ุงููู ููุชุงุฒู
[16/06/2024, 7:35:30โฏAM] ~โฏ๐๐๐๐๐ โโถโโพ: 10/10
[16/06/2024, 8:04:59โฏAM] ~โฏMoath_Mo.dev: Introduction to Entrepreneurship
ูู ุฏูู ูุงููู ุฐู ุตุญุ
[16/06/2024, 8:09:47โฏAM] ~โฏAhmed Abdulhafith Alkabyle: ุตุญ
[16/06/2024, 8:16:56โฏAM] ~โฏMoath_Mo.dev: ูู ูู ุงุญุฏ ุงูุณูุณุชุฑ ุงูู ุฑุงุญ ุงู ุงููุชุฑุฉ ุงูุงุฎูุฑุฉ ุณุฌู ููุฑุณ ุจูุณู ูุฎุชูู ุนู ุชุฎุตุตู ููุฏุฑ ูููู ุ
[16/06/2024, 8:17:05โฏAM] ~โฏMoath_Mo.dev: ููุง ููุทุฑุฏ ๐
[16/06/2024, 8:17:30โฏAM] ~โฏAhmed Marwan: ุญุณุจ ุงูุฏูุชูุฑ ูู ุงูู ููุฑุฑ
[16/06/2024, 8:18:29โฏAM] ~โฏMoath_Mo.dev: ูุญุชุงุฌ ุชูููุน ููุง ุจุณ ุงุฎุฐ ุงุฐู ููู
[16/06/2024, 8:18:48โฏAM] ~โฏMohamad Noureddine: ุจุณ ุงุฐู
[16/06/2024, 8:18:51โฏAM] ~โฏAhmed Marwan: โThis message was deleted.
[16/06/2024, 8:42:24โฏAM] ~โฏๅ ุญููููุฒูุฉก: ุงุญุฏ ูุนุงู ุงููุงูุฏ ุจูู ุญู ุงู network?
โ[16/06/2024, 8:42:31โฏAM] ~โฏRami: โ<attached: 00000826-PHOTO-2024-06-16-08-42-31.jpg>
[16/06/2024, 8:48:20โฏAM] ~โฏMoath_Mo.dev: Dr. Sim Hiew Moi ุฑูููุง /ุชููู ู ุญุจุงูุจ
[16/06/2024, 8:52:25โฏAM] ~โฏRami: ูุฐุง ุงูุณูุณุชุฑ ูุงูู oob?
[16/06/2024, 8:52:40โฏAM] ~โฏAbdo: โThis message was deleted.
[16/06/2024, 8:53:53โฏAM] ุฃุณุงูุฉ ุงูุญุณุงู ูุงููุฏูุดู: +60 16-855 7648
[16/06/2024, 8:54:07โฏAM] Hamdan Saleh: ูุงุดุจุงุจ ููู asriุ
[16/06/2024, 8:57:17โฏAM] ~โฏMohamad Noureddine: ูุณูู ุดุฑุญ ุชุนุจุงู ุนูุงูุงุช ูููุณุฉ
[16/06/2024, 9:10:02โฏAM] Hamdan Saleh: ุงููุฏููุง ูุงุดุจุงุจ
[16/06/2024, 9:11:36โฏAM] ~โฏ๐๐๐๐๐ โโถโโพ: ุฑูููุฏุง ุญุชุดุบูู ููู ูููุณุฉ
[16/06/2024, 9:12:03โฏAM] Hamdan Saleh: ุดุฏูุฏู ูุนูู
[16/06/2024, 9:12:06โฏAM] ~โฏ๐๐๐๐๐ โโถโโพ: ุฒูุฑููุง ูููุณุฉ
[16/06/2024, 9:13:05โฏAM] ~โฏ๐๐๐๐๐ โโถโโพ: ุชุนุทูู ูุซูุฑ ูุงุฌุจุงุช, ู ุชุฑุงูุจ ุงูุญุถูุฑ ููุงุฒู ุชุญุถุฑ
[16/06/2024, 9:13:30โฏAM] ~โฏAbdullah Al-Shateri: ุดุจุงุจ ูู ููู ุชุฌูุจู ุงุณูุงุก ุฏูุงุชุฑุฉุ
โ[16/06/2024, 9:13:50โฏAM] Hamdan Saleh: Timetable Semester I, Session of 2024_2025.xlsx โข โ4 sheets โ<attached: 00000839-Timetable Semester I, Session of 2024_2025.xlsx>
[16/06/2024, 9:13:56โฏAM] Hamdan Saleh: ููุง
[16/06/2024, 9:17:59โฏAM] ~โฏReem..: โ~โฏReem.. joined using this group's invite link
[16/06/2024, 9:34:01โฏAM] ~โฏ๐๐๐๐๐ โโถโโพ: ูุงูู COA ุงูุณูุณุชุฑ ุฐุงุ
[16/06/2024, 9:34:13โฏAM] ~โฏ.: ูุง
โ[16/06/2024, 10:26:50โฏAM] ~โฏAbdullah Al-Shateri: โ<attached: 00000844-PHOTO-2024-06-16-10-26-50.jpg>
[16/06/2024, 10:26:57โฏAM] ~โฏAbdullah Al-Shateri: ููู ูุฐู ุฏูุชูุฑุฉ ู ุดุจุงุจุ OS โ<This message was edited>
[16/06/2024, 10:32:11โฏAM] ~โฏAbdullah: ูู ูููุช ุฏูุชูุฑู ูุฑุงุญุงูุง ูุจูุง ุงุญุณูfkrahana
[16/06/2024, 10:32:34โฏAM] ~โฏAbdullah: ุฏูุชูุฑู ูููุณุฉ ุดุฑุญูุง ุนุงุฏู ูุฏุฑุฌุงุชูุง ุจุชุฏูู ุญูู
[16/06/2024, 10:42:44โฏAM] ~โฏAbdullah Al-Shateri: ุชุณูู ูุง ุชูุตุฑ
[16/06/2024, 10:44:59โฏAM] ~โฏMohaned: โThis message was deleted.
[16/06/2024, 11:12:40โฏAM] ~โฏAbdulkader: ุฃุญุฏ ูุนุฑู ุฃู ุดู ุนู ุงูshort semester ูุงูููุงุฏ ุงูู ุจุชุฌู ูููุ
[16/06/2024, 11:29:07โฏAM] ~โฏMoath_Mo.dev: ุงุชุนุงููุช ูุนุงูุง ูู ูุงุฏุฉ IP ุทูุจุฉ
[16/06/2024, 11:40:26โฏAM] ~โฏ๐๐๐๐๐ โโถโโพ: ุญุฏ ูุนุงู ุฑูู mr.zaidุ
[16/06/2024, 1:21:40โฏPM] ~โฏFares Hamid: ูุง ุนูุงู ุชุฌููู ุงููููุงุช ุฒู ูุฐุงGreetings Maam,

Hello Puan Rohani, i am writing this email to discuss about my foreign language course which is mandarin section 12 where it going to be held on Wednesday 11am to 1pm.So i am afraid that it would class with my other courses because i dont know my time table of other courses. So what should i do?

Thank You
[16/06/2024, 1:21:54โฏPM] ~โฏFares Hamid: ูุด ุฐุง
[16/06/2024, 1:22:06โฏPM] Faisal Bakuwayn: ูุงุญุฏ ุฑุงุณู ููุฏูุชูุฑุฉ
[16/06/2024, 1:22:10โฏPM] ~โฏ.: ูุงุญุฏ ูุฑุณููุง ูููู ุจุงูุบูุท
[16/06/2024, 1:22:15โฏPM] ~โฏYoussey Tahoon: ูุฐุง ุดุฎุต ูุจุนุช ููุฌุงูุนู ูููุง ุน ุงุณุงุณ ุงููุง ููุฏูุชูุฑู
[16/06/2024, 1:22:21โฏPM] ~โฏFares Hamid: ๐
[16/06/2024, 1:23:53โฏPM] ~โฏFares Hamid: all2023242@fc.utm.my

ูุนูู ุฐุง ุงูุงูููู ูุฑุณู ูุฌููุน ุงูุทูุจู ุงูู ูู ูููู ุงูููุจููุชุฑ
[16/06/2024, 1:24:11โฏPM] Hamdan Saleh: ุงููู
โ[16/06/2024, 4:16:15โฏPM] ~โฏ.: โ<attached: 00000861-PHOTO-2024-06-16-16-16-15.jpg>
[16/06/2024, 4:16:15โฏPM] ~โฏ.: ุงูุณูุงู ุนูููู ุดุจุงุจ ูู ุฃุญุฏ ุนูุฏู ุฑูู ุชูุงุตู ูุน ูุฐู ุงูุฏูุชูุฑุฉุ
[16/06/2024, 6:15:15โฏPM] ~โฏFares Hamid: ูุง ุนูุงู ููู ุงุณูู ุฏุฑูุจ ููุงุฏูุ
[16/06/2024, 6:15:31โฏPM] Hamdan Saleh: ุนููุช ุณุจููุชุ
[16/06/2024, 7:10:21โฏPM] ~โฏAhmed Marwan: ุชุฑูุญ ูู academic office ุชููููู ุงุจุบู ุงุณูู ุฏุฑูุจ ูููุงุฏุฉ ุงูููุงููู
[16/06/2024, 7:26:45โฏPM] ~โฏFares Hamid: ูุดููุฑูู ุงูุฌููุน ๐ซก
ู ุนูุฏ ูุจุงุฑู ููู ุนุงู ูุงูุชู ุจุฎูุฑ
