topic,category,question,answer,keywords,timestamp
UTM ROBOCON Team Recruitment,Academic,Are you interested in the UTM ROBOCON Team?,"Join our Basic Workshop and Autocar Challenge to gain knowledge and hands-on skills in electronics, programming, and mechanical design! Build your own autocar and compete with other participants to win the race! Benefits include a platform to share innovation, knowledge, and experience with fellow participants, step further into MCU programming and circuit design, boost your resume with technical skills and project experience, hands-on experience with real-world robotics projects, and network and collaborate with robotics enthusiasts. Take your first step towards becoming a ROBOCON member by joining the UTM ROBOCON Recruitment Challenge 2024/25! Don’t miss out! Early bird discounts are available for participants. Link to Registration Google Form: https://forms.gle/VawpDwwxeTPqTGnVA. For more details, visit our website: https://utmrobocon.com/, Instagram: https://www.instagram.com/utm.rbc, or Facebook: https://www.facebook.com/utmrbc.","['UTM ROBOCON', 'recruitment', 'robotics', 'workshop', 'autocar challenge']",2024-09-15
Final Year Project (FYP) Guidance,Academic,شباب حد عمل fyp او اتعامل مع الدكتور دا؟,دكتور فاهم جداً في مجاله. اشتغل معاه صح وبيفيدك. الصراحه هو مشغول شويه ما اعتقد ياخذ طلاب undergraduate كثير. لو معاك رقمه ابعته بالله. +60 13‑385 4888,"['FYP', 'doctor', 'guidance', 'undergraduate']",2024-09-12
Past Semester Exam Papers,Academic,يا شباب اذا في احد عنده تستات او فاينلات للسمستر اللي فات يرسلها لي على الخاص بالله,تحصلها ان شاء الله في ysag library. هذا رابط المكتبة: https://sites.google.com/view/ysag/e-libraries,"['past papers', 'exam', 'library', 'ysag']",2024-09-21
English Language Course Requirement,Academic,اذا جاي ب ايلتس ودرجتك ٥.٥ ف ما اعلى ، تقدر تشيل المادة وما تاخذها,إذا عندك لانجوسكيل او ايلتس م يحتاج تاخد انقلش ١ ع طول تاخد انقلش ٢,"['IELTS', 'English', 'course', 'requirement']",2024-09-29
PCB Design Tutorial,Academic,How to make your Own PCB,طالب مصري شرحه و تجربته في صناعة ال PCB رهيبة ما شاء الله. رابط الفيديو: https://youtu.be/g2b9MPy3WeI?si=tTctfxMi7RLF5K2_,"['PCB', 'design', 'tutorial', 'video']",2024-09-25
