topic,category,question,answer,keywords,timestamp
Housing Assistance for APU Students,Student Life,لو احد يعرف طالب في APU يفيدني ب رقمه عشان احتاج سكن حولين الجامعه,رسلت لك على الخاص,"['APU', 'سكن', 'الجامعة']",2024-01-10
Course Registration Process for First Semester Students,Academic,هل في تغيير في طريقة التسجيل حق طلاب أول ترم؟,الاكايدميك ادفايزر حقك هو الي ينزلها لك، اذا ما نزلت او شي تواصل معاه هو المسؤول عنك فالجامعه.,"['تسجيل', 'طلاب', 'أول ترم']",2024-01-10
Bridging Exam Registration,Academic,هل هناك تسجيل لإختبار ال Bridging؟ وين يسجلوا ويقدموا عليه؟,https://studentppi.utmspace.edu.my/?page_id=3345,"['Bridging', 'اختبار', 'تسجيل']",2024-01-10
Visa and Insurance Renewal Process,Visa/Immigration,فيزتي ثلاث سنوات وikad والتأمين لازم يتجدد سنويا؟,نعم لازم تجددهم.,"['تأمين', 'تجديد', 'فيزا']",2024-01-10
Accessing UTM Results for Master Students,Academic,كيف أحصل على UTM result لطلاب الماجستير؟,UTM PORTAL-GSMS أو UTM SMART-RESULTS.,"['UTM', 'نتائج', 'ماجستير']",2024-01-10
Internet Service Provider Recommendations,Student Life,أحد يعرف اش احسن شركة اتصال عندها باقات نقطة الاتصال فيها ممتازة؟,انا استخدم celecom و حلوه معي و النت قوي جدا.,"['اتصال', 'انترنت', 'باقات']",2024-01-10
Methods for Transferring Large Amounts of Money Between Saudi Arabia and Malaysia,Other,أحد عنده طريقة تحويل المبالغ الكبيرة من السعودية لماليزيا غير المحافظ الرقمية؟,مبالغ فوق عشره ألف دولار لها شروط خاصة ويجب أن تذهب إلى بنك أوف أمريكا من السعودية، بعدها تتحول لبنك ماليزي.,"['تحويل', 'مبالغ', 'سعودية', 'ماليزيا']",2024-01-10
Information on Essential Furniture Stores,Student Life,أين أجد مكان لتأثيث أثاث أساسي بأسعار معقولة غير السوق حق الجامعة؟,,"['تأثيث', 'أثاث', 'محلات']",2024-01-10
Holding Letter and Passport Collection,Visa/Immigration,هل أستطيع استلام الجواز مع نسخة من الهولدينق ليتر أم أحتاج نسخة أصلية?,يمكنك إرسال إيميل للـ UTM كما حصل مع آخرين لتعريفهم بأن الهولدنق ليتر ضاع وبعدها يمكنهم أن يعطوك الجواز.,"['holding letter', 'passport', 'visa renewal']",2024-10-03
Changing Sections for New Students,Academic,هل يمكن لطلاب السنة الأولى تغيير السكشن في الأسبوع الأول أم أنهم ملزمون بالسكشن الذي كتب لهم?,نعم، يمكنك تغيير السكشن حتى بداية الأسبوع الأول.,"['first year', 'section change', 'academic policy']",2024-10-03
Filling Online Immigration Form,Visa/Immigration,هل يجب تعبئة الفورم قبل الوصول إلى ماليزيا?,نعم، يجب أن تعبئ الفورم قبل أن تصل بيومين.,"['immigration form', 'Malaysia', 'arrival']",2024-10-03
Finding Furniture in Malaysia,Student Life,أين يمكنني العثور على أثاث أساسي بأسعار معقولة غير السوق الخاص بالجامعة?,يمكنك زيارة موقع https://www.mudah.my/.,"['furniture', 'Malaysia', 'affordable']",2024-10-03
Availability of Clinic Services,Other,هل العيادة مفتوحة؟,هذا غير محدد في المحادثة.,"['clinic', 'services']",2024-10-05
Textbook Purchase for Preparatory Math,Academic,أين يمكنني شراء الكتاب التحضيري للرياضيات أو استعارة نسخة مستخدمة?,يمكنك شراء الكتاب من الدكتور بمقابل 40 رنجت أو استعارة من طلاب سابقين.,"['textbook', 'math', 'preparatory']",2024-10-03
Timetable Access after Course Registration,Academic,كيف أطلع جدول الحصص بعد تسجيل المواد?,يمكنك رؤية السكشن الخاص بك وموعد الغرفة الدراسية عبر الروابط المرسلة أو عبر البريد الإلكتروني.,"['timetable', 'course registration', 'academic']",2024-10-06
University Graduation Ceremonies,Academic,هل هناك تفاصيل عن حفل التخرج؟,لم يتم ذكر تفاصيل دقيقة ولكن الطلبات تكون غالبًا عبر البريد الإلكتروني.,"['graduation', 'ceremony', 'academic']",2024-10-05
University Staff Contact Information,Academic,كيف أجد ملف يحتوي على أسماء الدكاترة ومواقع مكاتبهم؟,تقدر تلاقيه عند مدخل الأكاديميك أوفيس، ورقة مطبوعة على الجدار فيها الايميلات وأرقام المكاتب.,"['ملف', 'أسماء الدكاترة', 'مواقع المكاتب']",2024-06-10
University Payment Procedures,Academic,كيف أستطيع دفع الرسوم الجامعية؟,يمكن الدفع عن طريق الportal أو تطبيق utm smart.,"['دفع', 'الرسوم', 'الجامعة']",2024-06-10
Public Transportation to University,Student Life,هل في محطة باصات قريبة من يو مول إلى جامعة UTM؟,لا يوجد باصات مباشرة ولكن يوجد باصات توصل إلى gate 5.,"['محطة باصات', 'يو مول', 'جامعة UTM']",2024-06-10
Printing Services Location,Student Life,وين أقرب محل طباعة من ديسا سكوداي؟,مقابل رينبو.,"['محل طباعة', 'ديسا سكوداي']",2024-07-10
Engineering Drawing Supplies,Academic,ايش الأدوات المطلوبة لمادة Engineering Drawing؟,لوح A3، ورق A3، أقلام H4، HB، B6، لصقات، برايه، مسطرة T، مثلث 30-60 ومثلث 45.,"['Engineering Drawing', 'أدوات', 'مستلزمات']",2024-08-10
Visa Cancellation Requirements,Visa/Immigration,ما هي متطلبات إلغاء الفيزا؟,يجب التوجه إلى المكتب المختص أو الاستفسار من القنصلية للحصول على الأوراق المطلوبة.,"['إلغاء الفيزا', 'متطلبات']",2024-08-10
Road Tax Renewal,Other,كيف أجدد الـ Road Tax والتأمين؟,تقدر تجدده أونلاين أو عن طريق POS Laju. تأكد من أن السيارة مؤمنة.,"['Road Tax', 'تأمين', 'تجديد']",2024-08-10
Language Skills Test Inquiry,Academic,اختبار اللانقوج سكيل يميديني اخذه بدون ماادرس؟,ايوه مو بشرط.,"['language skills test', 'study requirement']",2024-10-09
Refund of Language Course Fees,Academic,هل ممكن يسترجع الرسوم أو يحولوها الى رسوم ال bridging؟,تتحول للبريدينج او لأي سمستر بس لازم يراسلهم عبر الايميل ويشرح لهم المشكلة.,"['refund', 'language course fees', 'bridging']",2024-10-11
Re-taking Language Skills Test,Academic,هل يستطيع الطالب يعيد اختبار language skills؟ واذا نعم كم لازم تكون المدة بين الاختبار الاول والاختبار الإعادة.,نعم، لا يوجد مدة محدده. يتواصل مع ادارة الامتحان ويشوف التواريخ المتاحة.,"['re-take', 'language skills test', 'exam']",2024-10-11
Using iPad for Study,Student Life,هل تنصحوني اخذه او لا iPad 9th generation؟,ما راح يفيدك اذا كنت طالب IT. لكنه ممتاز للدراسة بوجه عام، خاصة مع تطبيقات مثل Notability.,"['iPad', 'study', 'Notability']",2024-10-12
Sourcing Notes and Study Materials,Academic,ممكن اعرف ايش يقصدون هنا وكيف ممكن اعدلها؟,ممكن تفتح السلايدات من اللاب توب وتحل على دفتر خارجي ولكن الأيباد أفضل لحل السلايدات مباشرة.,"['study materials', 'slides', 'notetaking']",2024-10-13
Tuition Fees for Summer Internship,Academic,الآن الي ياخذ انترشب في الصيف في اي كلية في الهندسة، كم حيدفع رسوم للجامعة؟,يعتمد على الكليه، دفعت 1200 والرسوم كانت 900 لكن رفعوا في كليتنا.,"['internship', 'tuition fees', 'engineering']",2024-10-15
Transition from Language to Bridging Program,Visa/Immigration,أنا طالب مسجل في utmkl وطُلب مني أخذ البريجنق في جوهور. ماذا أفعل لتحويل برنامجي؟,روح لل utm space الجهة المسؤولة على البريدجنق اشرحلهم وضعك وبيعطوك العلم. أرسل ايميل الى ugrad@utm.my لتحديث حالتك من طالب لغة الى طالب بريدجنج فقط + ارفق نتيجة الLinguaskill.,"['تغيير برنامج', 'بريجنق', 'Linguaskill']",2024-10-15
Visa Renewal Process,Visa/Immigration,هل سيجددون لي الفيزا سنة أم لحد متى؟,بالغالب التجديد مايكون سنه. وقد كان من قبل تعطيهم خطة دراسية على أساس أنك ستزيد سمستر، لكن الفترة الأخيرة صار تشديد في هذا الموضوع.,"['تجديد الفيزا', 'تخطط دراسية']",2024-10-18
Master's Degree Admission Requirements,Academic,كم مطلوب معدل البكالوريوس للتسجيل في الماستر؟,3 في UTM.,"['ماجستير', 'معدل قبول']",2024-10-16
Language Academy Alternatives,Academic,ايش افضل معاهد اللغة غير ال ELS وسعرها كويس في كوالالمبور؟,معهد ستارت فورد، أعتبره معهد ممتاز فيه اجانب كثير حاليا وتعليم ممتاز ورخيص.,"['معاهد لغة', 'كوالالمبور', 'ELS']",2024-10-17
University Bank Account Opening,Student Life,هل مناسب كطلاب قي جوهور انه نفتح حساب عندهم؟,إذا اضطريت وطلعت الراجحي عاد شوف احد اصحابك عنده ماي بنك او cimb وتودع في حسابهم ويحولوها لك.,"['بنك الراجحي', 'طلاب', 'فتح حساب', 'جوهر']",2024-10-20
Mid Semester Break Dates,Academic,متى الميد سميستر بريك؟,لم يتم تقديم الإجابة على السؤال.,"['ميد سميستر', 'إجازة']",2024-10-22
Weight Allowance for Flights,Other,اذا اعطوني ٣٠ كيلو في الطيران شيرلانكا هل اقدر حقيبتين في الشحن ولا حقيبة واحدة؟,نعم تقدر تاخذ حقيبتين.,"['الطيران', 'شحن', 'وزن']",2024-10-20
Repair Services,Student Life,احد يعرف مكان مصلح تلفونات قريب من ميلاتا و ميلاوس؟,تسلم.,"['تصليح', 'تلفونات']",2024-10-22
Health Advice for Eye Irritation,Other,ايش مشكلة حكه و العيون تصير حمرا ، بسبب الشاشة ولا الغبار؟,راجع طبيب مختص او اشتري قطر حق التحسس تلقاها في اي صيدليه.,"['صحة', 'عيون', 'حساسية']",2024-10-23
Ticket Transfer for Culture Day,Student Life,إذا في واحد اشترى التذكرة حق culture day بس تكون تذكرة premium وما عاد بيحضر الحفل يتواصل معي؟,لم يتم تقديم الإجابة على السؤال.,"['ثقافة', 'تذاكر', 'احتفالات']",2024-10-22
Online Classes and Holidays,Academic,هل يوم الخميس سيكون إجازة أو كلاسات أون لاين؟,الخميس اجازة رسمية، ولكن بعض الدكاترة قالوا إن الخميس سيكون أون لاين.,"['إجازة', 'كلاسات أون لاين']",2024-10-24
Deepavali Online Classes Schedule,Academic,ما هي مواعيد الدروس بسبب احتفالات ديبافالي؟,سيتم تنفيذ الأنشطة التعليمية عن بُعد في الفترة من 29 أكتوبر 2024 حتى 30 أكتوبر 2024.,"['Deepavali', 'Online classes', 'education']",2024-10-25
International Office Schedule,Student Life,هل الانترناشونال اوفيس مفتوح اليوم؟,ايوه مفتوح.,"['International Office', 'open', 'today']",2024-10-28
Cultural Event Time and Location,Other,ما هي الفعالية حق الثقافة العربية الساعة كم ووين موقعها؟,اليوم الأول من الساعة 2 الظهر إلى 10 المساء، يوم الجمعة القادمة. اليوم الثاني السبت ثلاث ساعات من 7 المساء إلى 10. الموقع هو DSI.,"['cultural event', 'Arabic culture', 'location', 'time']",2024-10-29
Visa Requirements for Singapore,Visa/Immigration,ما هي اجراءات الدخول إلى سنغافورة و إيش المتطلبات؟,طلع ورقة سفر إلى سنغافورا من السفارة، وتقدم على الفيزا عن طريق مكتب ب 160 تقريباً.,"['Singapore', 'visa', 'entry requirements']",2024-10-27
Required Form for Malaysia Entry,Visa/Immigration,شباب فورم الوصول إلى ماليزيا مطلوب تعبئته من الطلاب فقط ولا حتى السياح؟,السياح والطلاب الذين يأتون أول مرة يحتاجون إلى تعبئته.,"['Malaysia', 'entry form', 'students', 'tourists']",2024-10-29
