topic,category,question,answer,keywords,timestamp
Graduation Project Survey,Academic,شباب من فضلكم بس محتاج من وقتكم خمس دقايق للفورم علشان مشروع التخرج,https://docs.google.com/forms/d/1iQE6hL67l0hk2BYGrmNmWBGLolybza105Dc-GRSrlGc/edit,"['graduation project', 'survey', 'form']",2024-06-06
Short Semester Course Registration,Academic,"The faculty will implement a short semester in Semester 3, Session 2023/2024 spanning from 4 August until 3 October 2024. In connection with that, students who are interested in enrolling in this short semester are compulsory to fill in the Short Semester Course Registration Application Form.","Please ensure all sections of the form are filled out accurately and submit it via the provided Google Form (https://docs.google.com/forms/d/e/1FAIpQLScsuok7hJV07BcijzRjIj3qwv09NcO41h3DjC0157sB5Ie2WQ/viewform) by no later than 13 June 2024. The faculty will only process forms that are fully completed. Contact No : 07-5557064, Email : skm-ug@utm.my","['short semester', 'course registration', 'application form']",2024-06-09
Financial Skill Management Survey,Academic,"Hi, we are from Group A7/A8 of SEEE4012, Section 5. We are conducting a survey to evaluate and compare the financial skill management among students in their 1st and 4th year of university study.",https://forms.gle/hRre1Nup5ze46LDC7,"['financial skill management', 'survey', 'SEEE4012']",2024-06-16
Course Registration for Next Semester,Academic,متى يبدا تسجيل المواد للترم الجاي وهل اقدر اسجل عن طريق الportal ولا؟,التسجيل فتح. معم عن طريق البورتال في خيار تحت course registration.,"['course registration', 'portal', 'next semester']",2024-06-18
Thermodynamics Course Preparation,Academic,Did any one take Thermo and can throw some hints or resources so i revise during the Holiday please?,https://youtube.com/@user-jl4pw7wu8m?si=mfIQY7s6R_vEhMkr هنا بتحصل شرح ثيرمو.,"['thermodynamics', 'resources', 'revision']",2024-06-20
Elective Course Registration,Academic,To all SEMM 3rd year students who will register for electives for the next semester. Please register for these 2 elective courses (temporary) only.,The actual elective courses you will take will depend on the type of track you will choose. Track selection is expected to be made online after the semester exam 23/24ii is over.,"['elective courses', 'track selection', 'SEMM']",2024-06-23
Manufacturing Process Course Difficulty,Academic,و كمان مادة manufacturing process هل هي صعبه ام لا,لا سهله بس محتاجه حفظ.,"['manufacturing process', 'course difficulty']",2024-06-27
