topic,category,question,answer,keywords,timestamp
Biomedical Material Study Resources,Academic,هل احد عنده شرح لمادة Biomedical Material,اللي فاتو شرح مواد تبع اليو تي ام سبيس,"['Biomedical Material', 'study resources', 'UTM Space']",2022-11-05
Statics and Dynamics Study Resources,Academic,في شروحات ل statics and dynamics من ysag ??,هذي تجميعة كويسة لافضل الدكاترة في المادة .. بالنسبة لي Jeff Hanson الافضل بالانجليزي و ابراهيم عكة الافضل باللغة العربية https://drive.google.com/drive/folders/1U-XphcnwMnGv30P2P1CEg0RK3Y4BoP3t,"['statics', 'dynamics', 'study resources', 'Jeff Hanson', 'ابراهيم عكة']",2022-11-06
Basic Anatomy Past Exams,Academic,في احد عنده اختبارات سابقه basic anatomy ؟,للاسف دكاترة المادة هذي كانو يمنعونا ناخذ اسئلة الاختبار لان غالبا الاسئلة بتتكرر,"['basic anatomy', 'past exams', 'test 1']",2022-11-14
Uploading Past Exams for Basic Anatomy,Academic,يا شباب لاهنتو الي اخذو الاناتومي خلال فترة الاونلاين يرفعو نماذج الاختبارات للدرايف من اجل الطلبة الجدد,تم رفع التستات والكويزات تبع السمستر الذي راح,"['basic anatomy', 'past exams', 'online period', 'drive']",2022-11-14
Responsibility for Uploading Questions,Academic,مين مسؤول عن وضع الاسئلة في الدرايف تبع الجالية؟,اسامة المسؤول عن رفع الملفات @97466156389,"['questions', 'drive', 'responsibility', 'uploading']",2022-11-23
