topic,category,question,answer,keywords,timestamp
Pre-Registration for Semester II 2020/2021,Academic,ูู ุญุฏ ุนูุฏู ุนูู ูู ูุงูููุงูุ ูุนูู ุงูุฌุฏุงูู ุฑุงุญ ุชููู ุฌุงูุฒุฉ ูู ุงููููุฉุ,"For your information, *PRE-REGISTRATION* for *Sem II Session 2020/2021* will commence from *20th January 2021 until 29th Januari 2021*. The Administration of the School of Mechanical Engineering has decided that *PRE-REGISTRATION* at SKM is *COMPULSORY* for all students starting from *SEM II SESSION 2020/2021*. Listed herewith are the activities that have been improved for smoothing the pre-registration process.","['pre-registration', 'Sem II', '2020/2021', 'SKM', 'compulsory']",2021-01-07
Vibration Course Study Materials,Academic,ุงูู ุนูุฏู ุดุฑุญ ุฏุฑูุณ ูููุงูุจุฑูุดู ุญู ุฏูุชูุฑ Husin talib. ูุฑุณูู ูู ุงููุฑูุจ ๐,Vibration materials shared in the group.,"['vibration', 'study materials', 'Dr. Husin Talib']",2021-01-10
Final Exam Schedule for Math 1,Academic,ุดุจุงุจ ููู ุงุนุฑู ูุงููู ุงููุงุซ ูุชูุ ูุงุซ ูก,ูู ุงูุฌุฏูู ูููู ุงูุณุงููุณ,"['final exam', 'math 1', 'schedule']",2021-01-12
Co-Curriculum Registration,Academic,ุดุจุงุจ ูู ุงูุณูุณุชุฑ ูค ูู ูุงุฒู ุงุฎุฐ co curriculum ู ุงุฐุง ุงููุง ูู ูุงุฏู ุงุฎุฐุ,Attached are the guideline as well as steps for registration of co-curriculum courses for Semester 2 Session 2020/2021. Students are advised to register within the stipulated time to avoid any inconvenience.,"['co-curriculum', 'registration', 'Semester 4']",2021-01-13
Professional Skills Courses,Academic,ุนูุฏู ุงุณุชูุณุงุฑ ุนู ููุฑุณุงุช PROFESSIONAL SKILLS ุุ ูุนูููู ูููู ููุฌูุงูุฑ ูู ุนูุฏูุง ูฅ ููุฑุณุงุช ูุงุนูููุง ูุฑุฏุช ููุงุฒู ูุงุญุฐูุง ุนุดุงู ูุชุฎุฑุฌ ุุ ุณูุงูู ุงูุญูู ูุชู ุชุจุฏุง ุงูููุฑุณุงุช ูุฐู ูููู ูุนุฑู ูุชู ุชุจุฏุง .. ุ,ุฐู ุชุงุฎุฐูุง ุงุฎุฑ ุชุฑู ูุจู ุงูุชุฎุฑุฌ ุจุงูุฒุจุท. ููุด ุจุงูุถุฑูุฑูุ ุชูุฏุฑ ุชุงุฎุฐูุง ูุงูุช ุณูู ุซุงูุซู. ุงูุงููููุฉ ุจุณ ูุทูุงุจ ุงุฎุฑ ุชุฑู. https://www3.utmspace.edu.my/utmpp/MainPage.aspx,"['professional skills', 'courses', 'graduation']",2021-01-14
Early Registration Policy,Academic,ูุง ุดุจุงุจ ุงูุงู ูู ุงูุงุฏูุงูุฒุฑุฒ ูููููุง ุงู ุงูุชุณุฌูู ุงููุจูุฑ ุถุฑูุฑู ูููู ูู ุงุญุฏ ุนูุฏู ุนูู ุงููู ุจูุณูู ุชุณุฌูู ูุชุงุฎุฑ ูุฐุง ุงูุณูุณุชุฑ ุงู ูุง ุุ ุนุดุงู ูุดูู ุงุณูุงุก ุงูุฏูุงุชุฑู,ุฃุนุชูุฏ ุฐุง ูุธุงู ูุทุจู ุนูู ุงููู,"['early registration', 'advisors', 'semester']",2021-01-15
Experimental Methods Reports,Academic,ุณูุงู ุนูููู ุดุจุงุจ ุ ุงููู ุจุงูู ูุญุชูุธ ุจ ุฑูุจูุฑุชุงุช Experimental methods ูุฑุณููุง ุจุงููู,ูุดููุฑูู ูุงุดุจุงุจ ุฎูุงุต ูุตู ๐๐ป,"['experimental methods', 'reports']",2021-01-15
Section Assignment for Courses,Academic,ุดุจุงุจ ุจุงููู ุงูุด ุงููุถุน๐ ุงูุญูู ูู ุจูุณุฌููุง ููุง ุงูููุงุฏ ููุง ูุง ุ ูุงููู ูุฒุนููุง ููุณ ุทุฑููู ุงูู ุงูุณูุณุชุฑ ๐,"New policy, students cannot simply choose sections from now own. Every semm course, need to be choose according to this list. For us, it will be section 1. But problem arise when each section can only accupy 30 students. However, fkm told us to just follow the list","['section assignment', 'courses', 'policy']",2021-01-19
Science and Technology Thinking Course,Academic,ุงูุณูุงู ุนููููุ ุญุฏ ุฎุฐ UHIT2302 science and technology thinking ุ ููู ูุถุน ุงููุงุฏู,ุฎุด ุนูุฏ ุงูุฅูุฑุงููุฉ ุงููุฑู ุทูุจุฉ. ุงูู ุดูุก ุงุชูุงุนู ูุนุงูุง ูู ุงูููุงุณ ูุจูู ููุง ุงูู ููุชู ูู ุงููุงุฏุฉ,"['science and technology thinking', 'UHIT2302', 'course']",2021-01-23
Course Feedback for UHIT2302,Academic,ุญุฏ ุฎุฐ UHIT2302 science and technology thinking ุ ููู ูุถุน ุงููุงุฏู,ุฎุด ุนูุฏ ุงูุฅูุฑุงููุฉ ุงููุฑู ุทูุจุฉ. ุงูู ุดูุก ุงุชูุงุนู ูุนุงูุง ูู ุงูููุงุณ ูุจูู ููุง ุงูู ููุชู ูู ุงููุงุฏุฉ.,"['UHIT2302', 'science and technology thinking', 'course feedback']",2021-01-23
Course Feedback for Dr. Kawthar,Academic,ุทูุจ ุฏูุชูุฑู ููุซุฑ ุฏู ูู ุงุญุฏ ูุฏ ุฃุฎุฐ ุนูุฏูุงุ,ุนู ุฑุฃู ุุทูุจู ุฌุฏุง ูุบูุฑ ูุชุดุฏุฏู ูููู ุชุนุทูู ูู ูุงุฆู ูู ุงูุงุณุงูููุชุงุช. ููู ุงูุฏุฑุฌุงุช ุงูู ุงูุงู ูุง ูุฏุฑู ูููู ูุจุฏู ุนูุจูุง ุงููุง ุชุนุทู ุฏุฑุฌุงุช ูููุณู.,"['Dr. Kawthar', 'course feedback', 'assignments']",2021-01-23
Course Selection Advice,Academic,*Graduate success* *Ethics and culture service* ูููู ูุชุงุญูู ุนูุฏู ูุงูุฌุฏูู ุงูุด ุฃูุถููู ูู ูุงุญูู ูุฌุน ุงูุฑุงุณ,Ethics ุงุนุชูุฏ ูุซูุฑ ุดุจุงุจ ูููููุง ุฃููุง ูุชุนุจู ู ูููุง ุงุฎุชุจุงุฑุงุช ุชูุชุจ ุงูู ูููู ุงู ูุฏุฑู ุงูุด. ุงุนุชูุฏ graduate success ุชุดุชู ุงูู ูุฌููุฏ.,"['Graduate success', 'Ethics and culture service', 'course selection']",2021-01-23
GSA Course Instructor Recommendation,Academic,ุดุจุงุจ ุงุญุฏ ููุตุญ ูู ุฏูุชูุฑ ูู ูุฐููุงุก ููุงุฏู GSA ุ,No specific answer provided in the chat.,"['GSA', 'course instructor', 'recommendation']",2021-01-26
Numerical Methods Project Inquiry,Academic,ูู ูู ุงุญุฏ ุงุฎุฐ ูุฐุง ุงูุจุฑูุฌูุช ูู ุงููููููุฑูุงูุ,No specific answer provided in the chat.,"['Numerical Methods', 'project', 'inquiry']",2021-01-26
