topic,category,question,answer,keywords,timestamp
Final Exam Document Sharing,Academic,,"SEMM2613 FINAL EXAM_20192020_2_P1_Q1.pdf, SEMM2613 FINAL EXAM_20192020_2_P1_Q2.pdf, SEMM2613 FINAL EXAM_20192020_2_P2_Q3.pdf, SEMM2613 FINAL EXAM_20192020_2_P2_Q4 OR Q5.pdf","['SEMM2613', 'final exam', 'documents']",2021-01-02
Instrumentation Study Materials,Academic,احد عنده فاينلات حق instrumentation؟ او tutorial زي هذي محلولة ولا سلايدات؟,,"['instrumentation', 'study materials', 'tutorial', 'slides']",2021-02-09
Exam Marks Discussion,Academic,,"Salam and g'day all, your marks are now available in the aimsweb, please have a look now. any request for marks revision is before 8pm today.","['exam marks', 'aimsweb', 'revision']",2021-02-28
Course Registration After Foundation,Academic,ايش المفروض نسوي بعد مانكمل الفاونديشن،،، عشان التسجيل للسمستر الاول هل ظروري ندفع عشان ينزلو المواد او بيكون تلقائي او كيف الطريقة؟؟؟,المفترض تكون دافع رسوم الفاونديشن Already عشان ينزل لك الجدول من الجامعه مش شرط تدفع رسوم السمستر الاول ع طول. الدفع يكون خلال السمستر مش مشكله. لاكن اهم شي تكون دفعت حق الفاونديشن.,"['foundation', 'course registration', 'semester 1', 'payment']",2021-02-25
Exam Preparation and Integrity,Academic,,"FYI, we, all lecturers who taught SEEE2073 are currently compiling answers from Chegg. However I believed all of you from this section are clean enough right? Or else I will be very sad as I have failed to instil integrity in you. Can’t imagine we produce future engineer with no integrity.","['SEEE2073', 'Chegg', 'integrity', 'exam preparation']",2021-02-23
Thermodynamics Coordinator Contact,Academic,في احد عنده رقم الcoordinator حق الثيرمو؟,تواصل مع academic adviser او اي احد شغال في academic office,"['thermodynamics', 'coordinator', 'contact']",2021-02-24
Exam Marks Access,Academic,كيف نشوف الدرجات من aimsweb?,http://pmaya.fkm.utm.my/obeutmz/pelajarutm/ ادخل باليوزر و الباس حق myutm,"['exam marks', 'aimsweb', 'access']",2021-02-28
