topic,category,question,answer,keywords,timestamp
Sharing Test Materials,Academic,الي عنده تيست الاول للمواد الي اخذه يرسله هنا على شان ارفعه للمكتبه,"Q1 PASSWORD: tXB57u9
T1 QUESTION 1.pdf (document omitted)","['test', 'materials', 'upload', 'library']",2021-03-12
Request for Lecture Notes,Academic,و حتى اذا في واحد منكم اخذ عند دكتور يشرح كويس اعطوني اسمه و اسم الماده,No specific answer provided.,"['lecture notes', 'professor', 'subject']",2021-03-12
Test Schedule Inquiry,Academic,شباب احد عنده جدول اختبارات ٢,@60186628634,"['test schedule', 'exams']",2021-12-28
Construction Measurement Course Inquiry,Academic,من اخذ construction measurement (mechanical and electrical),No specific answer provided.,"['construction measurement', 'mechanical', 'electrical']",2021-12-17
Student Referral Program Explanation,Student Life,هذا student get student يعني اذا جيت عن طريق طالب معين في الجامعه يجيبو له مقابل او عموله,وعليكم السلام.. هذا student get student يعني اذا جيت عن طريق طالب معين في الجامعه يجيبو له مقابل او عموله,"['student referral', 'university', 'commission']",2021-12-29
